reviewText,summary,rating,asin
"Super cute. I purchased  these in the pink glow color. It isn't neon pink & it isn't the pink you see in the photo. Its a lavender pink- which is still cute. I have another pair of converse in a 7 and they're too long in the toe. So I ordered a 6.5 and they seem okay. Albeit  I don't think I could have gone down a full-size... I don't know why these are called *seaonal, but the canvas is pretty rough & stuff- while its soft& pliable on my old pair. After I wore them with socks they began to soften up, and these actually have an arch in them. I will wear these a lot, but you will need to break them in a bit.",You probably want to Order these a half size smaller,4.0,B00008ZD31
Very satisfied,Five Stars,5.0,B00008ZD31
"Great fit for my teen daughter. She loves them, they fit her perfectly",Five Stars,5.0,B00008ZD31
"Chucks always run a bit large, so I always order a 1/2 size down. So, if these were my first pair (Jeff Bezos probably wasn't even out of high school yet then...), I'd say they run ""somewhat large"" instead of ""fit as expected"".  :)","Chucks always run a bit large, so I always ...",5.0,B00008ZD31
"Chucks always run a bit large, so I always order a 1/2 size down. So, if these were my first pair (Jeff Bezos probably wasn't even out of high school yet then...), I'd say they run ""somewhat large"" instead of ""fit as expected"".  :)","Chucks always run a bit large, so I always ...",5.0,B00008ZD31
Fit perfectly. Like the color.,Like the color,5.0,B00008ZD31
They were exactly as i was Expected. Timely shipping and reasonably priced.,Five Stars,5.0,B00008ZD31
Shoes seem are quite a bit larger than my usual athletic shoes - order at least a half-dozen smaller.,These run large,2.0,B00008ZD31
"I am a W size 11.  These arrived and were WAY TOO BIG.  It was really weird.  Being a size 11, I already where boat-sized shoes, but these were like a cruise ship! :)",but these were like a cruise ship,2.0,B00008ZD31
The shoes are great and comfortable BUT I received a defective pair. The left rubber toe is bigger than the right. Not nice,Yes and no,3.0,B00008ZD31
"It took me 4 tries to find the size that fits me.  I usually wear a 10.5 in mens.  Finally found that the 9.5 in men's fits good.  A little roomy, but they are comfy.",Order a full size smaller.,5.0,B00008ZD31
Is this a joke? To spent $50 on a fake converse? Very disappointed. Bought this for a friend as a gift. This was the worst gift ever.,Very disappointed. Bought this for a friend as a gift,1.0,B00008ZD31
"The item pictured is an off white canvas. Although the description matches the item not the picutre. Shoes are unique and fit well, seems to be authentic converse as well. Happy with them, just not as pictured.",Item not as pictured,4.0,B00008ZD31
"I love the classic look of Chuck Taylors, but wow, these are legitimately the most uncomfortable shoes I've ever worn. I wore them recently to my work where I'm on my feet for 10 hours and am moving around a lot and lifting stuff, climbing up and down ladders, and by the end of the night I was limping and my feet were throbbing. I have another pair of Chuck Taylors, mid tops, and those have some padding in the sole and I can wear them all night and feel fine. I guess I'm going to have to get some inserts for these if I want to wear them longer than an hour.",I love the classic look of Chuck Taylors,3.0,B00008ZD31
Shoe came in timely manner and look great as expected. Exchanging for different size.,Four Stars,4.0,B00008ZD31
Perfect,Five Stars,5.0,B00008ZD31
A bit wider than needed. The main gripe is after a short while these shoes start squeaking like crazy. Will not buy again.,The main gripe is after a short while these shoes start squeaking like crazy. Will not buy again,3.0,B00008ZD31
"These are good, but just might be knock offs. Since Im not sure, they did something right. Not bad for $30",Real? Still work well,4.0,B00008ZD31
I have wanted some of these shoes for years and I finally got them and I love them. They fit amazingly and they look great!,I love them.,5.0,B00008ZD31
"Go to spot to buy your Chucks
Love them",Five Stars,5.0,B00008ZD31
"nice shoes, like the color",Four Stars,4.0,B00008ZD31
"I ordered, what I assumed was, an 8.5 mens. The shoe was so big once it arrived. Amazon was great on refunding my money!",Fit big for mens sizes,2.0,B00008ZD31
"I received what is obviously a pair of shoes straight from the display shelf. These shoes are dirty from all the customer handling, have scuff marks all around the side white rubber area and the laces are a mess. In addition, the rubber over the toe area is yellow.",These shoes are dirty from all the customer handling,1.0,B00008ZD31
is not at all the right fit. too big by 1/4 inch. I had to return them so I do not know why they are too big and I compared the size to my other pairs,is not at all the right fit. too big ...,1.0,B00008ZD31
A classic. Arrived quickly.,A classic shoe,5.0,B00008ZD31
Love them,Great shoes,5.0,B00008ZD31
"These shoes don't fit my foot at all, they are way to big and I will never in life buy converse from you people again!!!!!","These shoes don't fit my foot at all, they ...",1.0,B00008ZD31
"Fit as expected. Bought for my wife a few months ago. I based the size off the other pairs of ""chucks"" she owns. They were exactly the same. Color almost exactly as pictured. Shipping and all that jazz was fine. - If I buy these Converse through Amazon again, I'll use this seller",Fit is perfect.,5.0,B00008ZD31
They are decent shoes.  Material quality is good but the color fades very quickly.  Not as black in person as shown.,Color fades quickly,3.0,B00008ZD31
The shoe labeled as black with a picture of a solid black shoe will show up as the Black and White Version. Also these sizes are completely whack. How is a shoe and 8.5 in men's and a 10.5 in women's? Having to return. Whole thing seems sketchy.,The shoe labeled as black with a picture of a ...,1.0,B00008ZD31
"Converse will tell you that the shoe runs about a 1/2 size larger than what you normally wear and that is true with these sneakers. Disappointed though that these aren't the original ""vintage"" Chucks that I wore in the late 60s and early 70's...for the original Chucks, you have to go to Nike/Converse's website and they'll run you $80 retail. Limited colors but you can definitely tell the difference in material and craftsmanship when you compare this model of the Converse All Star to the 70's Vintage Chucks. I have 6 pairs of the vintage Chucks and they're incredibly comfortable and never go out of style.","This is the economy version of the All Star, not the original Chucks from the 70's",4.0,B00008ZD31
"Shoes fit a bit narrow in the toes, but may loosen.  Shoe were  old school style",Four Stars,4.0,B00008ZD31
Love,Love,5.0,B00008ZD31
"They are to large , I really need to go down a size",Four Stars,4.0,B00008ZD31
"Love this shoes! Classic, never disappoints!",Five Stars,5.0,B00008ZD31
Perfect ! My daughter wore these to prom. So cute !!,Perfect! My daughter wore these to prom,5.0,B00008ZD31
Black lining started to peel,Look good but peeled a little,4.0,B00008ZD31
"Real Classic Converse, a must have !
It fits too large, but I knew that before buying, I ordered a 5.5 size for my 6.5 regular size, and fits great !",Must have Converse,4.0,B00008ZD31
Fit great absolutely love them,Five Stars,5.0,B00008ZD31
They run big so i had to exchange them. No biggie. But i ordered the all black. Twice. I got the wrong color,They run big so i had to exchange them. ...,1.0,B00008ZD31
"The product purchased, delivered in an exceptional time! Thank you!!!","The product purchased, delivered in an exceptional time! Thank you!!!",5.0,B00008ZD31
Ordered a pair of off whites last week they were extremely too big. Sent them back ordered a smaller pair and recived a pair that fit but they were the wrong color. Done with this seller!!,Ordered twice NEITHER WERE CORRECT,1.0,B00008ZD31
Fit fine although due to the packaging there were minor scuffs on shoes. Box was crushed and destroyed. Very disappointed in the quality of this shipment.,Good fit. Horrible packaging.,1.0,B00008ZD31
Love them! Worked great for my Patty Outfit.,Five Stars,5.0,B00008ZD31
"I have never bought chucks from on Amazon before and it's difficult to find an 8.5 in them anywhere as it is. So I was thrilled to find these. However, THESE ARE NOT AN 8.5. They are most definitely a 9. And honestly, I don't even believe they are truly Converse. I believe they are KNOCKOFFS. I have had TONS of pairs of Converse. They all have tags sewn onto the inside of the tongue of each shoe and they are fabric tags. The tags on these are some sort of rubber. Never ever had rubber tags before, and I've been buying Converse since high school and I'm now 34. I would have just bought a size 8. Now I have to return them and play the waiting game all over again. What a shame.",I have never bought chucks from on Amazon before and ...,3.0,B00008ZD31
"These shoes are great. I buy them for my toddler and 6 yr old. These shoes are comfortable, durable and easy to clean.
I am very happy with how long my kids are able to wear them before I purchase new pairs..",Great shoes,5.0,B0000A504C
I ordered size 3 little kids and i received a siz 3 big kids.  I live all the way in the caribbean so it is difficult fr me to try and return this product.  I now have the task to trying to get it sold. So Disappointed!!!!!!!!!!http://www.amazon.com/gp/product/B00012PIPO/ref=cm_cr_rev_prod_title,Not satisfied with sizing,1.0,B0000A504C
These are my daughter's favorite shoes. They last a really long time and are super comfortable and look great with jeans or shorts or dresses. The shoes are perfect. Plan to order another pair really soon!,The best shoes!,5.0,B0000A504C
K Swiss are the only  tennis shoe my daughter will wear.,K Swiss are the only tennis shoe my daughter will ...,5.0,B0000A504C
Perfect fit for my 6 year old son. He loves wearing them!,Five Stars,5.0,B0000A504C
These shoes are the best. They fit my grandsons feet perfectly. We have ordered these same shoes for him in different sizes as he grows.,These shoes are the best. They fit my grandsons feet perfectly,5.0,B0000A504C
"Purchased for my very active son for school. The shoes is soft and he prefers to keep them on all day and has asked to wear them to church too! Despite the attractive look of the shoe and they have held up to athletics and football, I am not sure if they will last the entire school year",Comfy Shoes,4.0,B0000A504C
next year I will make this purchase again,Five Stars,5.0,B0000A504C
Was exactly what I was looking for.,5 stars,5.0,B0000A504C
great,Five Stars,5.0,B0000A504C
Bought for my Granddaughter and she loves them.,Best Buy on Ebay,5.0,B0000A504C
Exactly what I wanted...,Five Stars,5.0,B0000A504C
still got them.. just need to be cleaned.. we like our k-swiss.,we like our k-swiss,5.0,B0000A504C
"I am not a fan of Kswiss but these are really great. My 7 year old wears a size 11 but bought these in size 12.5. His feet are really small so I wondered if these would be swimmingly big. They fit well with the right amount of room for him to grow in. He says it is really comfortable and hates wearing any other shoes to school.

It has a little weight and feels sturdy. I also do not need to polish it often.",Fine Quality,5.0,B0000A504C
Great Shoe,Five Stars,5.0,B0000A504C
I liked everything,Five Stars,5.0,B0000A504C
My daughter loves this shoe and I loved the price.  Very well made.,Five Stars,5.0,B0000A504C
Product is as expected,Four Stars,4.0,B0000A504C
I wanted a little growing space.,Five Stars,5.0,B0000A504C
"Love these shoes. My kids wear them out! No sole issues, no cracking or pealing. Good quality sneaker.",Five Stars,5.0,B0000A504C
Love love these shoes for my 4 year old,Five Stars,5.0,B0000A504C
Good price and quality.,Like!,5.0,B0000A504C
Bought these for my son and he didn't wanna take em off. Then he tells me.. Daddy you pick the best clothes and shoes ever.,Happy little guy,5.0,B0000A504C
My daughter loves these.,Reminds me of high school!,5.0,B0000A504C
"These are really nice shoes, especially for the price! High quality and my son loves them! They do run a bit narrow, but the length was as expected. I know some reviews said that they run really big, but this was not our experience--they fit true to size. This seller provides fast, cheap shipping! I will purchase more in the future!","Fast shipping, great product!",5.0,B0000A504C
"great product, good quality, I recommend this product","great product, good quality,",5.0,B0000A504C
The shoes run true to size so they are a perfect fit!!!,... shoes run true to size so they are a perfect fit!,5.0,B0000A504C
my son had to take out the inner sole to get a comfortable fit ..he got bruises on his foot  the first day he wore them..its a bit narrow,... to take out the inner sole to get a comfortable fit.,3.0,B0000A504C
"My 6 year old son loved his new shoes. And they are much easier to clean than his previous gym shoes.
Great quality! great price! He asked me if they were good for kicking! lol because he's always destroying his shoes by kicking at everything at school.
Yes! They are great for kicking :)",great quality,5.0,B0000A504C
i ordered a wide fit but i still hard to stretch it when it came it said wide but it was very narrow,i ordered a wide fit but i still hard to ...,3.0,B0000A504C
"They shoes are good, just very narrow and they run about a size bigger",Three Stars,3.0,B0000A504C
Love the shoes and customer service.,Five Stars,5.0,B0000A504C
"Kids love it!
We're satisfied! We will order again next time",Five Stars,5.0,B0000A504C
My son loves them,Five Stars,5.0,B0000A504C
Arrived on time. Good fit,Good,5.0,B0000A504C
"Fits a size too big bUT it looks even better than the actual pic,beautiful shoe",Four Stars,4.0,B0000A504C
Very cute sneaker!,Very nice,5.0,B0000A504C
Great shoes the fit was perfect,Five Stars,5.0,B0000A504C
This is my third pair and I wear them for walking on the treadmill.  Good support and fit.,Third pair,5.0,B0000A504C
"We had the white for my son I. Kindergarten and I just bought the black for 1st grade.  I had a hard time finding shoes that would last my boy the year, but k-Swiss delivers!!!!  He tears shoes up, but these are up to the challenge!!",Up to the challenge of a 6 yr old,5.0,B0000A504C
Love them!!!!!,Four Stars,4.0,B0000A504C
Have loved these classic shoes for as long as I could remember. Now allowing my children to enjoy the style as well as the variety of colors!,Great shoes,4.0,B0000A504C
After one wash the white of the shoe  started peeling off.,Three Stars,3.0,B0000A504C
Nice shoe and great price.,Five Stars,5.0,B0000A504C
Fits as expected.,Five Stars,5.0,B0000A504C
These shoes are tight and fit smaller than normal shoes.,Three Stars,3.0,B0002MB366
Great!,Five Stars,5.0,B0002MB366
"We just received this, seems to be great quality, we'll see how it takes school days...",So far so good...,5.0,B0002MB366
Merrill makes some of the best shoes on the planet.,Five Stars,5.0,B0002MB366
"Very poorly made, broke after less than a month",One Star,1.0,B0002MB366
"They were great shoes and I have three kids I get their shoes from Amazon for value.  i had to exchange these shoes because the tend to run a size larger.  My daughter is size 7 big kid but needed a 6.  Otherwise these are great durable shoes that has held up well.  My daughter as hiked, ran, scooted, and tried to scuff them but they look great.",Great tough shoes!,5.0,B0002MB366
"These lasted for about 6 months of (admittedly near-daily) wear. That's way more than many other brands. (Target's Champion brand is only making it 4-6 WEEKS in our house.) But for this price point, it's not great. Either get them for a great price ($30 or less$ or go with Keen, which is comparable in style and quality but carries a lifetime warranty.

Pros: good fit. Waterproof as advertised. Tread lasted (see pic).

Cons: Scuffing at toes was nearly immediate and permanent. Strap securement loop broke after six months (see pic). No extended/lifetime warranty as found in comparable brands.",Eh. There are better options.,3.0,B0002MB366
Perfect and compact hiking shoes. I took these shoes with me to Hawaii and hiked several trails. They kept my feet dry and comfortable all week.,Perfect and compact hiking shoes,5.0,B0002MB366
good,Five Stars,5.0,B0002MB366
Great fit and feel. My daughter loves these; I bought them for a camping trip.,Five Stars,5.0,B0002MB366
"These are my boys' favorite shoes to wear.  They can run in them, hike in them, and camp in them.  They work well with a Scout Uniform.  My only complaint is the strap that velcros across the shoe.  If pull tightly, it can rip off the shoe, which happened with one of my boys.  A little superglue fixed it and now they know to be more careful.","Great everyday shoe, just be careful with the strap.",4.0,B0002MB366
My daughter loves the shoe! great for everyday use! perfect for hiking! Price is great!,Buy this now!,5.0,B0002MB366
"Great for active kids! they are durable, I would buy them a size smaller they run large and wide it will still leave you with some room to grow",Great for active kids,5.0,B0002MB366
Bought in Jan 2016 hasn't wore them maybe 6 times the sruff on front is peeled off. I wouldnt recommend this product cheaply made not impressed as matter a fact should be refunded my money back what a waste of time!,I wouldnt recommend this product cheaply made not impressed as matter a ...,1.0,B0002MB366
My daughter loves these.  She wears them everywhere.  I like that these don't hand holes like the normal Merrell style I'm used to.,love them,5.0,B0002MB366
Excellent item! Great price and fast shipping! Thanks!,Kid loved them,5.0,B0002MB366
Great shoe. Great customer service,Five Stars,5.0,B0002MB366
"The fit as expected, my son loves them and wears them every day. They hold up well to his constant abuse and have proven to be pretty waterproof in the snow. I would certainly buy them again.",Great shoes for a boy who is growing.,4.0,B0002MB366
"I was expecting more from this brand. Disappointed that the toes got scraped up so quickly, material just peeled off. And 3rd day the elastic cord laces broke.",Expected more from Merrell,3.0,B0002MB366
Velcro straps ripped off. I'm not happy about that part.,I'm not happy about that part,2.0,B0002MB366
"These shoes have stood the test of my 8 year old and his penchant for destroying them.  He's hard on his shoes and typically ends up with holes and wear spots on the toe box, but these have held up for 6 months with no signs of breaking down.  Well worth the money.",Tough shoes for tough kids,5.0,B0002MB366
"I bought my daughter a size 13.5 for summer camp.  I needed an all-around durable sneaker/hiking boot.  These did not disappoint.  She said they were comfortable to wear all day and were not tight fitting. They lasted well throughout the 4 weeks of summer camp and prefers to wear them to school ( 5 months after we originally purchased them).  I do wish they were a little more aesthetically pleasing to look at since she is wearing them to school.
I felt compelled to write this review after reading some of the other comments that these shoes did not last.  This could have been farther from the truth in my daughter's case.  I think Merrell is a great brand and own a pair of their water shoes.  They have lasted me five years so far and look as good as if they just came out of the box.  The same can be said about these hiking boots for my daughter.  I am getting another pair for her as she is growing quickly.",These did not disappoint. She said they were comfortable to wear all ...,5.0,B0002MB366
"Great shoes, happy Mama and happy boy.  Bought a pair for my daughter as well.",Five Stars,5.0,B0002MB366
"Great shoe for a 2nd grade school day and learning to skate board!  My daughter reports that they are a little ""stiff"", but she still likes them.  Easy on and off, very scuff resistant.  We haven't tested the waterproofness yet.",Great for active girls,5.0,B0002MB366
"JUNK JUNK JUNK. The quality of these shoes is THE WORST, which is a surprise coming from Merrell. My son is 10 & has worn many shoes in his life. The Velcro strap broke off in less than a month. Stay away from these poorly constructed shoes.","The quality of these shoes is THE WORST, which is a surprise coming from Merrell",1.0,B0002MB366
As expected,Five Stars,5.0,B0002MB366
love it,love love love these shoes,5.0,B0002MB366
We had to return them.,One Star,1.0,B0002MB366
These are great for my little one as they are easy for him to put on and offer great support and comfort!,We love these,5.0,B0002MB366
"Nice shoes, but size 3 merrels in the store are not the same as size three ordered online. ",Three Stars,3.0,B0002MB366
"Just like all the over reviews say, the leather loop holding the strap broke after about three months of wear. Sounds like we were a lucky few to get that long out of them. these shoes are now useless as the strap is hanging freely from the shoe.",Loop broke making shoe useless,2.0,B0002MB366
Great waterproof footwear.,Puddlejump all day long!,5.0,B0002MB366
My son has flat feet and wears out his shoes very quickly. I got these at a great price and he is still wearing them. They have held up great!,Love Love Love,5.0,B0002MB366
Excellent quality and fantastic price. Should have bought two pairs.,excellent quality.,5.0,B0002MB366
These are the best shoes I have EVER bought for my son. I chose these because he goes through tennis shoes SO fast; like we are talking every month I had to buy a new pair. He is SO rough on shoes that there would be holes in the toes and anywhere else there could be holes! So I spent more and bought these. That was MONTHS ago; like 6 months ago and they are still hole-less!!! They are So durable and still have more life in them. He will probably outgrow them before he wears them out. I will buy them again and again for him. If you child is hard on shoes you will LOVE these! Worth every single penny and more!,Most durable and comfortable shoes I have ever bought for my child!,5.0,B0002MB366
My daughter loves these shoes so far.  We're hoping the quality will hold up well.,Four Stars,4.0,B0002MB366
"The strap broke on my son's shoe after a few months of use. Lo and behold I find I am not the only person to complain of this.  Poor quality from Merrell.  Otherwise, the shoes are in pretty good shape--too bad he can't wear them since they still fit him well.  So disappointed!",Poor quality from Merrell,2.0,B0002MB366
"My 3-year old wears these. I can't remember exactly what size I ordered. I intentionally ordered a size bigger because he grows so fast. Even though the shoes are a little big on him, he doesn't mind and even wears these without socks. The valcro is nice so he can but them in himself. These give him great stability when climbing on the jungle gym or over rocks.",The valcro is nice so he can but them in himself,4.0,B0002MB366
Excellent for everyday activities.,Five Stars,5.0,B0002MB366
"I bought these shoes for my son in April. It is 3 months later today. They were a back up pair of shoes for scouting, so hardly worn. No joke, he has worn them less than 5 times for those outings when he needed to look his best in uniform. These still look brand new, but with limited wear the velcro strap has ripped away from the shoe and is no longer useable. Very unhappy with this purchase, and of course past amazons return period. I will put a call in to Merrell and hope for the best. I hear they have great customer service.",DO NOT BUY THESE SHOES!!,1.0,B0002MB366
rubs heel -- will not be able to keep.  This seems to be a standard problem with shoes today.  Manufacturers need to take a serious look at foot geometry.,COuld have been a good shoe.,3.0,B0002MB366
strap on this shoe torn off in two days.,One Star,1.0,B0002MB366
"We love Merrells but have been disappointed with these.  They are really small, my son who measures an 11.5 is wearing a 13 and my son who measures 2.5 is wearing a 4 , both with just about a thumbs width (women's) to the end of the shoe from the end of their big toe.  My 6 year old has worn them for about a month and then the loop that holds the Velcro strap tore and the strap is useless.  They do provide good traction and the rest has held up to active boy play.",Not what you expect from Merrell,2.0,B0002MB366
"Thanks to all the reviews I read, I ordered a size bigger than I usually do and they fit comfortably.",I ordered a size bigger than I usually do and they fit comfortably.,5.0,B0002MB366
"My child loves these! Very comfortable, and tough (haven't when out yet!)","Very comfortable, and tough (haven't when out yet",4.0,B0002MB366
"Love that these come in WIDE.  It is tough to locate those for little kids wide feet.  My son started taking tap and is having a grand time making noise with these.  Real leather ones are nicer, but for feet that grow quickly and knowing they are going to be destroyed during use, this faux stuff works great.  Will buy again when the foot grows!",Great entry level shoe.,4.0,B0002UUCYM
Fit true to size. My son loved them... The only defect we saw was that the sides of the show are not slippery for when he is doing some tap moves. But from there on great quality!,Will buy then again,5.0,B0002UUCYM
"You have to order up in size. The were too small and really gave my feet some aches.  Other than that, they're great.",they're great.,5.0,B0002UUCYM
Sleek look for my young guy!,Great for Boys!,5.0,B0002UUCYM
