reviewText,summary,rating,asin
The watch is nice my son loved it,Four Stars,4.0,B00ARSOVAA
My grandson loved it,Four Stars,4.0,B00ARSOVAA
Just the right watch for any kid.,Five Stars,5.0,B00ARSOVAA
Bought for my 7 year old. He loves it. He is constantly showing off the projection feature which projects several different batman themed pictures. Very cool.,Very cool.,5.0,B00ARSOVAA
Super!,Five Stars,5.0,B00ARSOVAA
Projection was only half a picture and the straps broke within a week,One Star,1.0,B00ARSOVAA
Bought this for my son and he loves it so much I can't get him to take it off.,Five Stars,5.0,B00ARSOVAA
Awesome !! Fun ..,Five Stars,5.0,B00ARSOVAA
"Grand children loved shining the ""Bat Light: at the Disney movie screen!!!!",Five Stars,5.0,B00ARSOVAA
Our son loves it!!!,Our son loves it!!!,5.0,B00ARSOVAA
"My four year old daughter loves this watch! She broke her old Sonic watch and we had trouble finding another one so we ended up buying this one. So glad we did! Great pictures, clear & crisp colors.",Awesome watch,5.0,B00ARSOVAA
This watch is awesome!  And zmOffers has great customer service.  The watches arrived much faster than anticipated.  I ordered 2 and saw that one was a little less dim and slightly blurry than the other.  I knew this would cause a fight between my nephews so zmOffers replaced the watch only minutes after I sent an email on a Saturday.  Well done!,This watch is awesome! And zmOffers has great customer service,5.0,B00ARSOVAA
"Ordered as a gift from my sons 8th birthday.  He loves the projection and the fact that he's wearing a watch ""just like dad"". My one major complaint is that it is too easy to set the time. If he wears it for any length of time, like say 15 minutes, he bumps the buttons used to set the time and messes it up. It's good and bad that it's easy to set the time, I guess. Bad that he can mess it up accidentally, but good because I can set it back to the correct time easily.",Too easy to accidentally set the time.,3.0,B00ARSOVAA
"I bought this for my 4 year old grandsons' birthday. He loved it but it looked huge on his tiny wrist!!! The button on the side pushed into his skin, so not very comfortable. The projection stopped working halfway through the birthday party but his dad tapped on it and that seemed to get it working again.
The reviews seemed to rave about this watch so this is the reason why I ordered it.
Unfortunately I was disappointed and felt it cost too much for the quality.",He loved it but it looked huge on his tiny wrist,2.0,B00ARSOVAA
"My grandson loves it. Well made ,not easily broken.  Came in a timely manner.",not easily broken. Came in a timely manner,5.0,B00ARSOVAA
"I thought this would really thrill him, but it got tossed aside for the costume.  I think it is pretty neat!",I loved it more than my grandson,4.0,B00ARSOVAA
LIGHT WENT OUT AFTER ABOUT 10 MIN'S! PUT NEW BATTERIES IN SINCE IT WAS AREADY RUNNING WHEN I GOT IT! REALLY WAS AWESOME IF THE LIGHT DID NOT BLOW OUT. NOT WORTH THE TROBLE TO SEND BACK. WOULD NOT TELL ANYONE TO BUY IT AFTER THE PROBLEMS I HAD WITH THE WATCH.,WORKED FOR TEN MIN'S.......,2.0,B00ARSOVAA
"Neat watch My son loved it but the light only worked for 1 day, I didn't return it yet but will ask for a replacement to give it a second chance.",Cool but the light only worked for 1 day,1.0,B00ARSOVAA
My son loves this watch! I think it was a steal as far as the price goes! I tried to find one of equal value for my other son that likes Ben 10 and this watch blows them out of the water!,My son loved it!,5.0,B00ARSOVAA
"Within a couple of days of receiving this watch the set button on the bottom right fell off, never to be seen again.  Not very water-proof without it and cannot set the watch now.  I replaced with another Casio at a higher cost.  They are usually good watches.  A prior one was worn for many years.",Falling apart,2.0,B00ATXGZMK
"I was looking for a simple not expencive whater resistance watch for surfing.
I tried this and i totally can recommand this.
Its easy to controll and i took it 8ft deep in the pool and to a 1,5h surfsession and it still works!
so just get it!",BEST!!!,5.0,B00ATXGZMK
"Hey guys, the watch is nice, too easy to configure. It's a basic Watch to hard work. The only one concern is that the description is not complete because  band is ""Black Glossy"". I don't like the colors in Glossy",Good Watch,4.0,B00ATXGZMK
Very good product.,Four Stars,4.0,B00ATXGZMK
"This was purchased for an 8 year old, and our views are a little different.

Based on his response and use, this would be a five star watch.  He wears the watch all the time and is consistently referencing the time.  He likes to use it as an alarm clock so he can get up for school and the stopwatch to see how long it takes to do various things.  While he has only had it for a few weeks, he has been more than satisfied - that the date appears on the watch makes him even happier.

Based on what I've seen, I'd give the watch something closer to three stars.  The light is your old standard yellow that will fade soon enough instead of the indiglo-style blue light that has been around long enough to not be an expensive option.  The three dials are somewhat meaningless, with the third used for a timer that you've got to read the manual to understand (that should say, the not-kid-friendly manual).  The watch enters set up mode by selecting quickly through clock -> alarm -> stopwatch -> clock set.  Again, this is a not as friendly to kids solution that makes it easier to change the time than needs to be.

I've always been pleased with Casio for producing cheap, accurate, no frills watches, but this one feels like one of those ""look like an adult watch"" frustrations and I think we would have been more satisfied with the more basic Casio.","I think it's not so great, but it's a kids watch and the kid likes it",4.0,B00ATXGZMK
Not kids size,One Star,1.0,B00ATXGZMK
My nephew Loved it. But I don't know what the 3 circles at the top mean. Confused Face....,Five Stars,5.0,B00ATXGZMK
Perfect,Five Stars,5.0,B00ATXGZMK
i bought this for my 8 yr old son. too big for him..going to return it,Two Stars,2.0,B00ATXGZMK
Casio makes the best watches,Five Stars,5.0,B00ATXGZMK
Sorry but this isn't a kids watch.,Not a kid watch,5.0,B00ATXGZMK
Everything it was advertised to be.,True description,5.0,B00ATXGZMK
My son loves this watch!,Five Stars,5.0,B00ATXGZMK
My son loves it!,Five Stars,5.0,B00ATXGZMK
Very Nice,Five Stars,5.0,B00ATXGZMK
"I bought this watch for my 10 year old son. He loves it. He didn't want a theme based watch, he feels more grown up wearing this one. Only had it for about a week, so I can't comment on longevity.",I bought this watch for my 10 year old son ...,5.0,B00ATXGZMK
My kid is happy,Five Stars,5.0,B00ATXGZMK
"Good product. Easy to use.
The band is for a real big kid",Five Stars,5.0,B00ATXGZMK
Prefect for a preteen.,Four Stars,4.0,B00ATXGZMK
Nephew loves his watch.,Five Stars,5.0,B00ATXGZMK
Perfect product ! Thanks !,Five Stars,5.0,B00ATXGZMK
good kids watch. good value for money,good kids watch,5.0,B00ATXGZMK
"Not sure what the intended age range is for this kids watch, but it was way too big for my 8 yr old.  Returned.",Not sure what the intended age range is for this ...,3.0,B00ATXGZMK
My son needed a new watch and wanted something that looked like adult watches. This Casio is a great time piece. It's sharp looking and has very good features. Can't go wrong with this Casio!,Good youth watch,5.0,B00ATXGZMK
Good watch,Four Stars,4.0,B00ATXGZMK
False advertising.  This is a men's watch.  Not sized for kids.  WAY too big on my 8-year old son.,This is a men'swatch. Not sized for kids,1.0,B00ATXGZMK
"I used to be an EMT and this watch's feature to have increments of 1,3,5,10,15,20,30 minute timer is the most useful thing ever. I haven't found another watch that does it for this price. It is the third one I've owned. The only flaw is when the wrist strap breaks. Its an expensive little strap (16$ when I've gone to repair it). It's just cheaper to buy a new one. Thank you for the speedy delivery.",30 minute timer is the most useful thing ever,5.0,B00ATXGZMK
The light button worked twice and then it never worked again. Returned and replaced the say day we got it.,You Get What You Pay For,1.0,B00ATXGZMK
"This is not a kids watch. My son purchased this with his own money and the wrist band is WAY WAY to big. He's almost 11 and wanted a ""kids"" watch to make sure it fit, which was the way this watch is currently advertised on Amazon. If we cannot find a smaller wristband to replace the original with locally, we will be sending this watch bag.",Not a kids watch,3.0,B00ATXGZMK
My grandson loves it!,Four Stars,4.0,B00ATXGZMK
my son  love it  for a 5yrold  it keeps taking a beating and keeps ticking!! the aloarm is pritty loud,my son love it for a 5yrold it keeps taking a beating ...,5.0,B00ATXGZMK
Its too big for a boy's hand.,Two Stars,2.0,B00ATXGZMK
"everything ok with service and product. Just as described in the photo. love them, i would buy it again. great!",like it.,5.0,B00ATXGZMK
"they are exlent seller I recomend
I no have any problen with my produc
all by okey without problem
.",exelente seller,5.0,B00ATXGZMK
"Good, but scratch very easy!",Three Stars,3.0,B00ATXGZMK
Love this watch.,Five Stars,5.0,B00ATXGZMK
"Bought it as a gift for my son.
He never takes it off.
Can take a beating without breaking.
Would recommend for a active kid.",Nice rugged watch,5.0,B00ATXGZMK
"Buyer Beware its made out of a Shiny Material. Thats the only drawback, otherwise a perfect beater watch for a 9 year old",otherwise a perfect beater watch for a 9 year,4.0,B00ATXGZMK
"My son is very happy with his watch.
Where's it everyday.
Easy for him to set.",Five Stars,5.0,B00ATXGZMK
"My 10 years old love it, but it looks huge on his arm.",Four Stars,4.0,B00ATXGZMK
all ok,Five Stars,5.0,B00ATXGZMK
Working fine so far.. Nice looking watch for kids,Four Stars,4.0,B00ATXGZMK
"Although it is supposed to be for kids, this watch was too big for my 11 year old son, and we have to return it!",thiswatch was too big for my 11 year old son,2.0,B00ATXGZMK
"Excellent condition, made a great gift.",Five Stars,5.0,B00ATXGZMK
"Not at all a kid's watch... won't tighten up on my nine year old, still a few notches left on his father.  Lame.",Lame.,1.0,B00ATXGZMK
"This watch is not waterproof as marketed.  We have purchased two since April.  The first one lasted a month, the second six weeks.  Both got water in them from limited exposure - a bath and a water slide.  This is a good watch if you never go near water.  It is not water proof and is a waste of money if that's what you are looking for.",Do not buy this watch if you want waterproof,1.0,B00BF77SX4
"the quality is very poor, the setup button only work for one day after a day at the beach I going to return it",only work for one day at the beach,1.0,B00BF77SX4
I bought the watch for my daughter and she loves it.  She has been wearing it since she got it.,My daughter loved it,4.0,B00BF77SX4
My son loved the watch but after only 1 month and occasional pool use it got waterlogged. Not worth the effort to get repaired. Get something more durable.,Not water resistant,2.0,B00BF77SX4
"I got this watch for my 9 year old for his Birthday. He loves it and never takes it off.
It's easy to use and great around water.
He has skinny wrists and this watch is so realistic to the size of a child's wrist, yet advanced enough for a young boy.
I've tried other watches and they were too big.
We are very happy with this watch.",Awesome watch!,5.0,B00BF77SX4
"My 8-year old loves his watch.  Very comfortable strap and size, easy to program (he's figured it out all on his own).  Nice design, great light.  He loves the chronograph (stopwatch) and to set alarms.  And what a great price.  Very pleased!",My son loves it!,5.0,B00BF77SX4
Cannot swim with it.,One Star,1.0,B00BF77SX4
Great kids watch at a great price! I've been a Timex fan since I was a kid and have always been impressed with the quality of their product (even with their lower priced watches). My wife and I bought one for each of our kids for Christmas and they love them! No problems with any of them so far and the little icons for each of the different modes are a great... the kids think it's awesome when they see them flashing. They shipped quickly and were received quickly which is always nice. I would definitely recommend this product to anyone looking to purchase a good watch for their kids at a good price!,Great kids watch at a great price!,5.0,B00BF77SX4
We bought this for our son for Christmas. He seems to like it (when he actually wears it).,He seems to like it (when he actually wears it),4.0,B00BF77SX4
"My 7 year old loved this watch because of the Ironman brand (He's a triathlete.)

But it has been very disappointing.  The buckle broke off of the band after 3 months.  I was able to buy another band and scavenge the buckle to save his watch.  But tonight, swim practice killed it.  How can they claim waterproof to 30m and it dies during a 7 year old's swim practice in a 5' deep pool?

I've had the adult version (Timex Ironman) for years and beat the crap out of it...you can't kill it.  But this kid's version is, unfortunately, junk.",Band broke at 3mo.  Ruined by water at 4mo.,1.0,B00BF77SX4
My 8 year old son loves this watch and it is simple enough for him to set and change himself.,My 8 year old son loves this watch and it ...,5.0,B00BF77SX4
Good for kids.,Five Stars,5.0,B00BF77SX4
Bough two for my 7 year old twin boys and they love it.  I have the adult version that is too big for them.  Perfect size.,... for my 7 year old twin boys and they love it. I have the adult version that is ...,5.0,B00BF77SX4
gift for grandson he loves it,happy grandson,5.0,B00BF77SX4
A seemingly good present for a grandson.,First Watch,4.0,B00BF77SX4
my 8 year old loves his new watch!,great watch,5.0,B00BF77SX4
"This is the second watch just like this that I've purchased for my 11 year old daughter - and the last. Despite being water-resistant to 30 meters, both of them were damaged by incidental water exposure. The first one she got wet in the shower - noticed it and immediately took it off and I dried it with a towel within a minute of the exposure. It fogged up and then the face had missing parts of the display. Since it fit her small wrist where others don't, I ordered another one. This one she got wet by jumping in the shallow-end of the pool with it - noticed it and took it off right away and dried it. Same exact problem. I don't call this water-resistant. And like other reviewers have noted, you have to pay to have the one-year warranty honored. So no more Timex for us. I am sorry, too, since we liked the design of the watch with the adjustable soft strap.",Second time this watch has been damaged by incidental water!,2.0,B00BF77SX4
Wrist band broke within a few weeks of light use.,Wrist band likely to break,3.0,B00BF77SX4
very nice,Five Stars,5.0,B00BF77SX4
"My grandson is 10 and he loves his watch, it is excellent for an active, busy little boy!",Great product from a great seller!,5.0,B00BF77SX4
"My son was so excited to get this watch and after a week, it broke. We aren't sure what happened. We changed the battery for it to no avail. Needless to say, my 11 year old was very disappointed as was I.",my 11 year old was very disappointed as was I,1.0,B00BF77SX4
"I bought this for my son he loved it but the button is very hard to push and it leaves a mark in his thumb,I even tried it it was harder than I thought. He's had it for 2 years now great watch but the light is kind of hard for him.",I bought this for my son he loved it but the button is very hard to push ...,4.0,B00BF77SX4
"Buy this watch for my son and just what I expected, he is happy.",he is happy.,5.0,B00BF77SX4
A real hit with my grandson.,Five Stars,5.0,B00BF77SX4
Perfect.,Five Stars,5.0,B00BF77SX4
The is the second one I have bought for my son. He wore the first one for nearly a year and needed a new one. He loves it just as much as the first one.  It is waterproof and heavy duty.,Durable,5.0,B00BF77SX4
"Excellent purchase for both a 6 year old and his 8 year old cousin. The boys LOVE them! I had bought them as accessories to the boys' first-ever suits for attending a very dressy family wedding. The first and third graders looked and felt very grown up. Best of all, they really like the timed alarm feature to help them manage when to take periodic breaks from doing their homework or chores or playtime. The younger one needs a little help with buckling the watch, but if any other prospective purchaser is hesitant about sizing for a child's wrist, don't be. The strap fits well, is well-constructed, and comfortable.  I got the boys their watches in black to go with everything they wear.",Terrific purchase for young boys,5.0,B00BF77SX4
Gift for a friend-- looks good and was delivered quickly,Four Stars,4.0,B00BF77SX4
My son is 9 years old and it is his first watch he loves it. The only thing that is a small problem is it has an alarm feature which can accidentally be activated by young ones.,Great first watch...,5.0,B00BF77SX4
"My  10 year old grandson loves it. His birthday watch was his favorite gift. He couldn't wait to wear it and his sisters say it wears it morning noon and night. It was great seeing his face when he opened the package, it was filled with real joy.",His birthday watch was his favorite gift. He couldn't wait to wear it and ...,5.0,B00BF77SX4
"The time was off for a while, but it seems to be keeping correct time now.",Four Stars,4.0,B00BF77SX4
excelent alternative for kids between 8 to 12 years,Four Stars,4.0,B00BF77SX4
Cute but not durable.,Didn't hold together very long.....a few days.,2.0,B00BF77SX4
Grandson loved it.,Five Stars,5.0,B00BF77SX4
"granddaughter loved it, vey stylish",Five Stars,5.0,B00BF77SX4
"Needed a discreet watch for my nephew, as school rules dictate discreet-looking watches only.  He loves it, the school loves it, everybody's happy.",Needed a discreetwatch for my nephew,5.0,B00BF77SX4
Good one,Three Stars,3.0,B00BF77SX4
"Received two of these watches for Christmas for my boys.  Both are inoperable within 4 months.  The first was water damaged in a pool -- not water proof.  The second has the case cracked with minimal impact.  They appear to be cheaply made and do not deserve the ""Ironman"" label.",Received two of these watches for Christmas for my boys ...,1.0,B00BF77SX4
"Bombed on my kids 9th birthday between this watch and a piece of garbage record player. Why do things get decent reviews? I don't get it... I count on you people to give accurate reviews of things. I don't care if it's only a $30 watch, I expect it to last for more than a month before it falls apart!

bah! this sucks. we had his last timex for years before it broke... now what!?

Update on 6/8: received a replacement watch and it sucks too. Will not buy anymore crappy watches. will spend money for one that lasts. More landfill, great!",Crappy watch don't waste your money,1.0,B00BF77SX4
I bought two of this watch I was disappointed to find the second one not working. I don't know how to contact the seller so I can get a refund or exchange.,Timex watch issue!,3.0,B00BF77SX4
"My 6-year old loves this watch. He's been obsessed about keeping time since starting Kindergarten and this really helps him ""keep track"" on his own. I give it 4/5 stars though since the set up and extra features are very difficult to figure out unless you want to take the time to sit down and read through the instructions (which aren't very easy to read)! For our use though (Time keeping & backlight) it works great and seems to be holding up well.",Recommended.,4.0,B00BF77SX4
Read other review,SO FAR SO GOOD,5.0,B00BF77SX4
This was a gift for my grandson .,Five Stars,5.0,B00BF77SX4
Didn't survive my son's shower... Supposedly water resistant to 30 meters. Buyer beware.,Water damaged. Dead watch.,1.0,B00BF77SX4
Perfect for my 9 year old.  It can cinch down around his small wrist.  The buttons are easy for him to use and he loves the night light feature.,Great for young boys!,4.0,B00BF77SX4
"Easy to wear, seems really durable.  My child loves the indiglo light too. Great first watch for my 5 year old",My child really likes it,5.0,B00BF77S2K
It is simple to use - he figured it out on his own. Looks great and functional!  Great features that are perfect for active boys.,great for my 9 yr old boy,5.0,B00BF77S2K
"The first day my son wore this to the beach, water entered the watch.  Based on the other reviews here, I don't see how Timex can call this watch water resistant.

As for the warranty, Timex currently wants you to ship the watch back at your own cost (unless you can figure out a retailer who still has their return envelopes - I couldn't) and pay them $8.  It's absurd that it will cost me half the cost of the watch for Timex to fix what is clearly a design flaw.

So much for ""IronKids"" and so much for ""Takes a lickin' and keeps on tickin'.""  Shame on you, Timex.",Good watch; not waterproof,1.0,B00BF77S2K
Nice kids watch. Perfect for my 9 year old son. He can use the functions easily.  He wears it everyday.,Timex kids watch,5.0,B00BF77S2K
"You would think that since this is a watch designed for children, it would be child friendly. The buttons are harder to push than my Timex Ironman adult watch. Other than this rather large issue, the watch seems to be ruggedly built and fits my 5 and 7 year olds wrist comfortably.

Maybe it is a new watch issue and will get better over time, but that is yet to be determined.",Buttons are hard to push,3.0,B00BF77S2K
I bought this for my 7 year old and he loves it.  He can get it on and off easily by himself and it looks great.  Very happy with our purchase.,Nice watch,5.0,B00BF77S2K
"My daughter loves the look and feel of the watch, but a few of the buttons fell off the second day we had it",Timex Kids Watch,3.0,B00BF77S2K
"It took a while for my nephew to be ready to wear a watch, but now that he wants to - he loves it! It's perfect. I like that it doesn't have tons of cartoons on it or anything. I looks nice with his school uniform or play clothes.",It's perfect. I like that it doesn't have tons of ...,5.0,B00BF77S2K
Highly recommend if you are looking for a watch for your children.,VERY DURABLE,5.0,B00BF77S2K
We bought for my son which he lost it 2 weeks later.,Nice and rugged!!!,4.0,B00BF77S2K
My boy loves this watch. It has been through a lot of abuse.,Great lasting kids watch.,4.0,B00BF77S2K
"Learning to tell time can be confusing for a young child. This watch was a good size, a good fit, and just right for my grandson.",Perfect for my grandson,5.0,B00BF77S2K
"Works well for us.  I set it, and when the alarm goes off, my 6 year old knows it's time to start our bed time routine.  It might take a bit of practice for a little guy to learn to set the alarm himself, though.",Quality product,5.0,B00BF77S2K
Good for kids.,Five Stars,5.0,B00BF77S2K
"Bought this for our soon to be 5 year old. DONT waste your money on those cheap plastic $5 watches. They cannot do half of what this watch can, and they are not comfortable on their little wrist. This ones fabric band is perfect.",DONT waste your money on those cheap plastic $5 watches,5.0,B00BF77S2K
Gave this to my 8 year old son for his birthday and he loves it! The timers are s big hit.,Great watch for kids,5.0,B00BF77S2K
its awesome,Five Stars,5.0,B00BF77S2K
Watch stopped working after a few months.,One Star,1.0,B00BF77S2K
Perfect for kids.  Easy to operate.,Five Stars,5.0,B00BF77S2K
Nice watch and easy for kids to take on and off by themselves.,Five Stars,5.0,B00BF77S2K
This was a gift for a special little boy,4 year old likes it!,5.0,B00BF77S2K
Nice watch for a kid.,Five Stars,5.0,B00BF77S2K
"Looks great and fits great. True to it's old slogan, even after the abuse of an active 10yr old boy, it's trucking along like a champ. My son accidently went swimming, in the ocean, in his watch for several hours, and it still works. I was surprised since it's only listed as water resistant. We had to dig the sand out of the watch face, but it wasn't even scratched.",The old timex slogan holds true!,5.0,B00BF77S2K
Watch is basic and seems durable.  Perfect for my active 11 year old son.  He likes to use the reminders feature so he knows when he has events.,Perfect for my active 11 year old son,4.0,B00BF77S2K
Works perfectly! Easy for my 6 year old to use daily.,Easy for my 6 year old to use daily,5.0,B00BF77S2K
"Perfect watch for my 8 yr old. He has worn it for 2 months now and it still works great.

He has not swam with it so I can't speak to water resistance, but based on the reviews won't test it.",Great Fit on 8 yr old,4.0,B00BF77S2K
"My nephew loves it. Its sporty and comfortable on the wrist and he has no problems with reading the screen. It's a great little starter watch and very durable. It was really easy to program too, which, from experiences with these kid watches, some of them make me want to pull out all of my hair and stomp on them!",Love it.,4.0,B00BF77S2K
"Bought this for my 10 yr old son so he knew what time to be home by when playing outside. Stylish and functional, would totally recommend.",would totally recommend.,5.0,B00BF77S2K
Watch claims it is water resistant to 30 meters. It broke while in the shower. Garbage. Do not buy.,Can not get this watch wet,1.0,B00BF77S2K
"I bought the watch on 9/19/15. The watch battery died on 10/17/15. You need a very small screwdriver to open up the back of the watch which I did not have. The cost of taking it to the watch store for a new battery is half the cost of the watch.  Prior to the watch dying my son loved it, the band was much more comfortable as compared to plastic or rubber bands.",battery died in less than a month,1.0,B00BF77S2K
