reviewText,summary,rating,asin
"I like that these shoes fit good and are not too tight and stiff like most Stride Rite shoes I have purchased. The only downside is that the laces, which are not properly pictured by the way since you have to tie a bow on top with the strings hanging like adult tennis shoes - they get undone easily so I end up putting on his velcro shoes instead. Other than that they are very nice and I would still recommend them.",I like that these shoes fit good and are not too ...,4.0,B000H86W0W
"Very sturdy, held up well over 8 months (DS grew out of them before they wore out, always a plus!) and very comfortable.  DS LOVES Stride Rite shoes!",Great shoe!,5.0,B000H86W0W
"My son has now gone through three pairs of these shoes (in different sizes).  They are great.  They hold up well, don't show scuffs, and seem to be very comfortable.",Love them!,5.0,B000H86W0W
I loved this for my son's first walking shoe.  I just purchased his second pair and I am a little sad to put these away.  Stride Rite is a great shoe and this is a great price!,Cute Tot Shoe,5.0,B000H86W0W
"Great Stride Rite look, but each time our son wears them, the laces come undone.  They are cute though!",Nice looking shoe but comes off too easily!,3.0,B000H86W0W
"These shoes are so adorable and durable. They've been through a lot with my 3 year old and they are still in great condition. The only problem I've encountered is getting his feet in and out. The little velcro strap at the side of the shoe doesn't allow for the tongue to come completely out so sometimes it's a hassle. Although, my son has chubby feet for a thin kid, so maybe it's just him. I have to push his heel down and this usually causes him to giggle since it's ticklish. Either way, I would recommend them.",Great Product,5.0,B000H883UY
It has been about half a year since we bought these shoes for my 3 yo son and they are still in great condition.  We have washed them many times and they do not show any sign of wear.  I might buy the exact shoe for this fall.,Thses held up great,5.0,B000H883UY
Great sturdy shoe,Great shoe fits and wears well,4.0,B000H882BO
great fit!,Five Stars,5.0,B000H882BO
"What parent doesn't like Stride Rite's quality shoes at a good price?

The Landon lace up is well made, with high quality leather and stitching throughout. The sole of the shoe is a semi-flexible rubberish material.

I like the Landon particularly because the sole is much more flexible than
the suede dress shoes Stride Rite makes.

I also think that Landon's leather look can be worn throughout the year, versus only winters for suede. (IMO)

There is minimal padding in the shoe, which may or may not make a difference to you.

With Amazon's sales/discounts, I ordered several sizes/colors at about $15 a pair.

My husband hates my ""stocking up"" but he'll be thanking me later that we won't be scouting for dress shoes at the last minute! Plus - these will easily re-sell at the consignment store. :-)",Great dress shoe for the little man in your life :-),5.0,B000H882BO
My son loves the shoes for attending a wedding.  They are so soft.  Stride shoes are great!,Great shoes,5.0,B000H882BO
"these shoes are leather well made and perfect for school ,my son  whose opinion is the only one that matters loves these .bonus got them for $18+ great buy for real leather shoes!",my son loves them,5.0,B000H882BO
"I got these shoes for my son as part of his required kindergarten uniform. They look nice, are very comfortable and overall I'm very pleased with this purchase. Another great product from Stride Rite.","Comfy Shoes, Great for School",5.0,B000H882BO
"Great, soft leather.  Good quality insoles and excellent grip and traction.  My son can wear these to church or to a playground.  We love them.",Stride Rite Landon Lace Up,5.0,B000H882BO
this is a great shoe. my son was born with club foot so his feet are extra extra wide. he loves these shoes and he doesnt complain about his feet hurting when he wears them.,great shoe,5.0,B000H882BO
This appears to be a good quality shoe.  It looks exactly as it appears on the webpage.  Would recommend.,Stride Rite Landon Lace Up,4.0,B000H882BO
"My son normally kicks every thing he sees in the road and the soles his shoes are usually off before the end of  the first term but these shoes are very durable, strong and long lasting. I  WOULD ENCOURAGE ALL MOTHERS TO BUY THEM  FOR SCHOOL!!!",Great Shoes,5.0,B000H882BO
"These sneakers are great for everyday use. After purchasing them, I had wished that I had gone ahead and ordered several pairs in different sizes. Stride Rite sizes are very reliable, and I find that I can order them each time without having size issues. My daughter has skinny feet, both narrow and thin from top-to-sole, and the regular width fits her well.",Buy several pairs if you can get them for a good price,5.0,B000H8715M
"My daughter loves her shoes, she puts them on and takes off, she says ""I'm a big girl now I can put my shoes on all by myself"" with a big smile on her face. My daughter has wide feet and this shoe is perfect for her.
Samantha and Amanda's mommy.",Perfect shoes,5.0,B000H8715M
"I bought these for my pre-school son, they look nice and are reinforced in the tip, but are not made from leather. I've used others from this brand and they were excellent!! let's wait to see if these are too.","Cute, but not leather..",4.0,B000H8715M
"First 'real' shoe for granddaughter.  Was wonderful. Shaped right for baby foot, easy to put on and take off.  Very sturdy and stayed looking good through a lot of use.",Best first shoe,5.0,B000H8715M
these are solid shoes as expected from Stride Rite.  However they are not very flexible and my toddler had trouble walking in them and ended up NOT walking when these we on him.  When I would put his other Stride Rites on with the Natural Motion System he walked much better.  I would not buy again for a beginning walker.,solid shoe but my son did not like them,2.0,B000H8715M
I got these at a great price and my son wears them everyday! Easy to put on and take off and easy to clean... he jumped into a fountain today and they dried quickly and look new... I love these shoes!,great price and perfect shoe for my son.,5.0,B000H8715M
"These were great for my 18 month old son - he has wide feet and the fit is perfect; I like that it can be adjusted ""perfectly"" with the velcro.  They have lasted very well through some tough play.  I also like that he is very sure-footed in them, unlike some other shoes.  Highly recommend!",Great fit and easy to walk in,5.0,B000H8715M
"This style of Stride Rite is perfect for my 20 month old son.  It has been really tough finding a good fit for his very wide feet, but these fit really well and the Velcro seems to be less restricting than tie shoes.  I keep buying another exact pair every time he goes up a size!",Reliable fit for big baby feet!,5.0,B000H8715M
"My wife is an avid shopper who looks for the best bargain!  My grandson is 17 months old and has a wide foot and where we live, and within 40 miles, she could never find a shoe his size!  She is very satified with the savings + the quick delivery!  We will definitely shop on line more often!  Very satisfied!",Stride Rite Toddlers' Riley H&L Shoe XW,5.0,B000H8715M
I bought this shoe for my son and they fit great. He has a wide foot and these fit him very well.,Great deal on a great shoe,4.0,B000H8715M
"I admit that I was first drawn to these shoes by the price - Amazon had a wonderful sale on them at the time. I read favorable reviews on them on other sites and decided to get them in several sizes for all of my children.  I was pleasantly surprised to find that they are sturdy, well-built shoes. They offer great support in the soles and the uppers. The velcro attachments are strong and wide enough to provide good closure to the shoe. They have lasted for at least one season already and will probably be retired only because each child will outgrow their respective pair. This was one of my best children's purchases at Amazon.com . I would certainly recommend these shoes to other parents for their children.",Great shoes for a child!,5.0,B000H89TJS
"A good shoe, as the title says, but so narrow that my son's normal-width foot is too wide.  Disappointing for us, but probably good for kids with very slender feet.","Good shoe, but narrow",2.0,B000H87UP8
I like these shoes. They look awesome. My baby love them.,Five Stars,5.0,B000HQO2S8
good item  and seller,good,5.0,B000HQO2S8
"These shoes are nice in that my son can put them on himself. Otherwise I wouldn't purchase again. The ""leather"" pealed off as soon as he got them wet by walking in damp grass. Save your money if you have a kid that plays outside a lot.",These shoes are nice in that my son can put them on himself,2.0,B000HQO2S8
We have been searching a long time to find a shoe that fits as good as these.,Its about tIme,5.0,B000HQO2S8
"THE SHOE IS TOO SMALL, NOT SERVED TO MY CHILD",One Star,1.0,B000HQO2S8
good quality shoes my son uses them for all I'm happy,Five Stars,5.0,B000HQO2S8
excelente,Five Stars,5.0,B000HQO2S8
It is offered on the website,Five Stars,5.0,B000HQO2S8
They came a bit unglued in the front. disappointed.,disappointed.,1.0,B000HQO2S8
"The elastic material that ""tightens"" the shoe got stretched out too quickly. There is no way to tighten the shoes now so they keep slipping out of my son's feet.","The elastic material that ""tightens"" the shoe got stretched out ...",2.0,B000HQO2S8
"My three year old grandson has almost every item made from the movie CARS.

When I saw these sneakers, I just had to get them for him. He lives in Rhode Island, and I live in Delaware. It was so cold that his southern mommy would not leave the house to go to the mailstation to pick up the package. Finally, his dad picked them up on the way home from class. He called and said,""Ganny!!! thank you for Lightening McQueen shoes. I love them""  I know all the characters since he has most of the toys. He wanted to wear them with his CARS pajamas to bed. They appeared to be of good quality for a rough and tumble three year old. Thank you for helping make Jack's Valentine'sDay even more special.",How to win your grandson's heart,4.0,B000I2XAUM
"A big hit with my son. Velco is great for those that don't know how to tie yet, and the style and fit are perfect!",Sneakers,5.0,B000I2XAUM
I was under the impression that these shoes had wheels on them since they are called skate shoes.  Wrong!!  They are regular sneakers.  They are really cute and look nice but don't buy them if you think that they are skate shoes.,Not skate shoes,3.0,B000I2XAUM
This is a really great sneaker- my son loves them!  He has been wearing these for well over 3 months and no problems.  These are the only pair he ever wants to wear.,Love them!,5.0,B000I2XAUM
I bought these at Target for my sons.  My six year old wore his two months until they fell apart.  Not too long in my opinion.,DIdn't last long,2.0,B000I2XAUM
"My Son is using every day this product and Lights still work,  Very nice an good quality.",Excelent!,5.0,B000I2XAJS
"My[...]really loves the pair I gave him for christmas. He insists on putting them on everyday! So, they're getting kinda battered now but are still good and the lights still flash. Good quality!",Smooth Ride,5.0,B000I2XAJS
"My son is crazy about cars and as he tends to run rather than walk these days, I really wanted to get him some light up shoes -I've looked around and these are the best light up shoes.  When he walks the lights flash in sequence in various parts of the shoe, but the best part is that Lightening McQueen's headlights light up -not to mention the shoes have lightning's face on the top and front of the shoe (eyes on the velcro part and mouth on the front of the shoe) and the sole of the shoe looks like the under part of a car.  My son demands to put them on first thing in the morning and stomps around in them all day.  when he isn't wearing them he is tapping them on the floor to watch them light up... also, before these, I have struggled to get him to wear shoes longer than 5 minutes, but wearing these are like some kind of fun game for him.  I highly recommend these to anyone who's child is a fan of the movie.",the best toddler shoes ever!,5.0,B000I2XAJS
"Mi hijo de 2 aos es loco con estos tenis, cada vez que se viste no importa la ropa que tenga, estos tenis es lo que se quiere poner. Y son muy bonitos a mi me gustaron mucho. Estoy muy contenta con el producto.",Excelentessssssssssssssssss.,5.0,B000I2XAJS
"El producto lo recibi en perfectas condiciones, excelente comprarle a ustedes.-

saludos

Maryury",cars,5.0,B000I2XAJS
The sneakers are great.  My son loves the wheels on the side.,Love the Wheels,5.0,B000I2XAJS
"I purchased a pair of the Disney Cars Toddler Boys Lightening Strap Sneakers for my grandson's 4th birthday. He loves them! They appear to be well made and have details of Lightening Mc Queen from the movie, Cars.",The cutest!,5.0,B000I2XAJS
"We just received these shoes for our almost 4 year old.  He LOVES them.  The soles are nice and the single velcro strip is quick and easy.  Difficult to tell from the photo, but McQueen has a little toothy grin at the toe.  He is convinced he is now fast as lightning!  It was nice to find a Cars shoe in a color other than black.",A Happy Kid!,5.0,B000I2XAJS
My son loved these shoes. Even though he is two all he could say was CARS!,Sneaker Review,5.0,B000I2XAJS
"We bought these shoes for my 3yo daughter in August. She wears them every day and they still look great. (But I have to admit that she's not really hard on her shoes. She usually outgrows them before she outwears them.) Here are just some of the reasons why I'll probably have to buy her a new pair when she outgrows her current pair:

-Everyone comments on how cute they are with the tires, chassis, and flashing lights.

-They're easy for her to put on and take off by herself.

-No one has noticed or commented that my daughter is wearing a ""boy's"" shoe.

-The dark color helps to hide dirt and scuff marks.

These are great shoes for any Cars fan...whether you have a boy or a girl. I only wish they came in grown up sizes!",My Daughter Loves Her Lightning McQueen Shoes!,5.0,B000I2XAJS
My grandson can not wear the shoes because they were too tight around the top of the shoe and there was no way to extend them. I won't buy shoes without being able to try them on again.,Disney shoes,3.0,B000I2XA5M
"Of course my 2-year old loved these shoes, but they have sewn a rather tight piece of elastic under the tongue and velcro closure that makes it very difficult to get on.  This isn't mentioned in the item description. As another reviewer did, I cut the elastic with scissors and the shoes worked well - but I didn't expect to have to do that to a brand-new pair of shoes.  Seems like a design flaw.",Hard to put on,2.0,B000I2XA5M
This is a very nice sneaker. The only drawback is that it's hard for a young kid to wear them by himself.,good sneaker but hard for young kids to weat them by themselves,4.0,B000I2XA5M
I bought these shoes for my grandson. He loves them. They were very difficult to put on his feet until we clipped the inside of the shoes. Other than that they are great fun and cute.,two year old loves shoes,5.0,B000I2XA5M
"Great looking shoe.  My son is a big Lightning McQueen fan and he loves them.  Only downfall is that it's tough for my toddler to get his feet in the shoe.  He's very independent and he was able to put on his old shoes, so it was disappointing for him to have to now ask for help to put his shoes on.","Great look, tough fit",3.0,B000I2XA5M
"Our 2 1/2 year old grandson LOVES all sorts of cars. He is thrilled to have ""Car Shoes"". Easy on and off. Love the flashing lights. The shoes are well made. Would buy again and again.",Disney Cars shoes,5.0,B000I2XA5M
"My grandson LOVED these because they were ""Cars"" shoes and it didn't hurt that they light up when he walks and stomps around.",Disney Cars light up shoes,5.0,B000I2XA5M
These shoes are fantastic! Not only are they super cute but they stay nice and clean. My son wears them ALL the time and dirt just doesn't stick so they always look very nice. The velcro shield on the front makes it easy for my toddler to take off and put on his own shoes.,ADORABLE!,5.0,B000I2XA5M
"My boy could not have been happier, and Santa sure got a 5-star rating this past Christmas for having thought of these sneakers he ""hadn't even asked for!!!""  Only place he doesn't wear them is to bed, which doesn't mean he hasn't tried.",A very happy 4-year old,5.0,B000I2XA5M
"This is a really nice little toddler sneaker. It slips on and off easily

thanks to the big velcro flap on the top of the sneaker.  The sides have little make believe tires and the sneakers flash every time the child takes a step.

They are of excellent quality, and sturdy enough to last till they are outgrown. My grandson absolutly loves them!",Perfect Boy Toddler Sneakers,5.0,B000I2XA5M
"They velcro...I bought them a bit big but they can be tightened with the velcro.  Of course, they don't get dirty and so far, they appear to be very durable.  They do not light up...fyi.",Super McQueen shoes,5.0,B000I2YRNG
The shoes are great and easy to put on.  My son loves them.  They were sold out everywhere else so I looked online and found them through Amazon for much less!  Shipping was fast and we're happy!,"Great shoes, great price!",5.0,B000I2YRNG
"Bought a pair for each of my two-year old grandsons.  Both are fans of the Cars, and they both loved them.  They are easy to put on because of the velcro closure.  Light-weight and comfortable for little feet. Because of the color, easy to wear/match with any outfit.  Very satisfied with this purchase.",Disney Cars Toddler Boys' Lightning VS Skate Sneaker,5.0,B000I2YRNG
Bought these for my son and was very happy with the quality of the shoes. Bought them on a sale. Well worth the money spent! They appear that they will withstand my very energetic and tough on shoes 4 yr. old.,Great Shoes,5.0,B000I2YRNG
"I was very pleased with these shoes! They are so cute and look well-made. I ordered a 1/2 size larger and they fit fine. My two-year-old grandson was as pleased with these shoes as a two-year-old can be. He is a big ""Cars"" fan.

The only disappointment was that they didn't light up and I thought they might.",Disney Cars Toddler shoes,5.0,B000I2YRNG
"Great price, great style, easy on/off for parents!!  Fast shipper too!!  Just great sneaks - tough too!!",Wonderful sneaks my lil guy LOVES them!!,5.0,B000I2YRNG
"My son loves the Cars movie.  I purchased a bunch of shoes from Amazon.com for him to try on and these fit him the best.  They light up and now he won't wear any other shoes.  I tried to get him to wear something else, but instead all I could do was reorder these shoes at a larger size.  I also orderded in a bigger size for next time.  Oh and yes, the price is just right!  I feel its quite a bargain.",Great Product -- Great Price,4.0,B000I2XAMK
This is a good looking shoe. But be aware that it's not made of leather. My son wore it for a few days and his feet were always sweaty and started peeling very bad.,Be aware,2.0,B000I2XAMK
"We finally found light up Cars sneakers!  My 6 yr old son is thrilled with them.  We don't generally find light up sneakers in his size anymore, so we were very excited to find these.  Quality seems good, we like the stretch laces and velcro strap.  I like the color (doesn't show the dirt much) and he loves the theme and lights.  He even plays with the themed shoebox still.",My son loves them!,5.0,B000I2XAMK
This is a good looking nice sturdy shoe for the little fans of Lightening McQueen and the gang.,A real kid pleaser,5.0,B000I30CDE
My son lves the light up cars shoes and they fit himm comfortably!,Great shoe,5.0,B000I30CDE
"I bought them for my 3 year old Grandson and he loves them.  I was surprised at how well they are made for the price.  He has a wide foot, but these sneakers fit fine.  He loves the way they light up.",Great Sneakers,5.0,B000I2YRKO
"My five year old son loves it. He even likes the box it came in that he is saving it and putting his other toys (legos, etc.) into that box.",Cool shoes with lights,5.0,B000I2YRKO
"These are great! My son loves them.  They appear to be of good quality and should last a long time.  I'm wondering how long they'll flash for, but so far so good!",Lightning McQueen shoes,5.0,B000I2YRKO
"This nifty pair of sneakers

Is a bargain at the price

I thought they would look cheesy

But they're really very nice

They light up in three places

And are made by Buster Brown

Velcro straps hold them in place

Each with its padded tongue

It's hard to find the light-up type

For kids who have large feet

Available up to size 2

They really are a treat

Tough and sturdy, waterproof

(We put them to the test)

Big kids who love the movie ""Cars""

Will like these shoes the best

Amanda Richards, March 2, 2007",Light-ups for little kids with big feet,4.0,B000I2YRKO
"This shoe is a nice combo of fun and function. My son is a huge Disney Pixar Car fan so of course he loves the sneaker. I love it because they fit my son perfectly,(I ordered 1/2 size up), and the velcro straps are so easy to use that he fastens them himself.

They were worth every penny and should fit as long as you know the child's proper size.",Excellent quality sneaker with a fun character that lights up,5.0,B000I2YRKO
We could not use these shoes.  The tongues on these shoes are too short and we had to force them on. They were even a 1/2 size larger than our grandson wore.  It was a big disappointment and waste of money.  Save your receit.,Ligtning Double Strap Sneaker Review,1.0,B000I2YRKO
"These are so tough to get on, even after a few weeks of wear. My son is 7 and he has the hardest time getting into them.  Once they're on, however, he says they feel great, and it's the usual Geox quality.","Good sneakers, if you can get them on.",3.0,B000I8192M
"We've tried a wide variety if higher end brand shoes for my son (who is very picky about what is on his feet.  If he's not comfortable, they're OFF!).  These Geox have been the best shoes!!  My son loves them and they've worn really well.  Unfortunately, they're finally wearing out (not a surprise with the HUGE amount of wear they've had), and I'm in the market for another pair.  My son has only become this attached to one other pair of shoes, a pair of Kenneth Cole shiny black dress shoes.. but he doesn't wear those every day :-).",A great pair of shoes,5.0,B000I84XX4
"I got a great deal on these Geox, and my son absolutely loves them!  I was having a hard time getting him to wear anything other than Crocs until I found these.  He's hard on his shoes, and tends to poke holes in the toes from crawling around pushing cars and trains on the floor.  These have a wrap around rubber toe protector that has the shoes still looking great after a couple months of almost daily wear.  I would definitely purchase again!",My son won't take them off,4.0,B000IBGZGY
"I haven't had to wear them outside yet, but they look great. My neice wanted to steal them from me. I put a gel insole in them so they're even more comfortable. I hope they're warm, too.",Snow Boots,4.0,B000IZ70JG
My 10 year old daughter loves these shoes. Swears they are the most comfortable pair she owns. I have to admit they are the only ones at her school and everyone compliments her.,Excellent Shoe,5.0,B000JV5NTS
"My Daughter just loves these sneakers! As all 6yr olds would say,""I can run faster, and jump higher!!"" The sneakers seem to be well made, and hold up well!",My daughter loves these sneakers,5.0,B000JV5NTS
not all the kids have this shoe and it is really nice!!!,lasting and diffrent,5.0,B000JV5NTS
"I have bought these shoes for my son, aged 10, and would like to ask that you carry them here, in the larger sizes.  My son wears the extra wide and these fit extremely well.  There are amazingly few places, even in websites, that carry wider shoes.",Please carry the larger sizes in these shoes,5.0,B000JWU97S
We are very pleased with these shoes.  They were a great price and my son loves them.  Fit is great and they have style!,Very pleased,5.0,B000JWU97S
"It is very well made. Looks very sporty, and is supposed to be comfortable since there is air ball at the heel. The hook and loop is easy for my son to wear because shoe belts are little difficult for him now.",good shoes,5.0,B000JWU97S
"I was pleasantly surprised when I received these shoes.  It looks so much better than in the pictures.  Although I am not sure about it's ability to make my son jump higher, my son loves wearing it!
He's been wearing these shoes everyday for more than a month, and it still looks brand new.  Five stars for this excellent, stylish, and well-built shoes!",Looks better than the picture.,5.0,B000JWU97S
"THESE SHOES MAYBE DONT HELP MY SON JUMP HIGHER, BUT THEY ARE MADE REALLY WELL AND STURDIER THAN MOST",LOVE THESE SHOES,5.0,B000JWU97S
"The seller sent out the shoes in perfect timing. The only drawback is that they, from my son's perspective, do not let him jump so high -- like in the commercials for the Super Ball shoe. I knew that wouldn't happen, but try explaining that to a strong-willed 4 yr old! I really like these shoes. They have a great fit, are very well made (as all Stride Rite's are), and the Velcro is easy for him to use. I have finally found a shoe that will oust him from his rain boots with no battle. He is actually wearing these more often than his rain boots!",Amazing Shoe That My 4 Yr Old Willingly Wears!,5.0,B000JWU97S
"I have always purchased Stride Rite shoes for my son, 5.  He asked for this particular style from having seen them on a commercial.  He is very pleased with the style and I am happy with the quality.",Shoes did not disappoint,5.0,B000JWU97S
