reviewText,summary,rating,asin
"Great Watch for kids, my son loves this watch,wearing everyday for school! Little bit pricey but it's ok!

I will recommend this watch!

Thanks",Great!!!!!,5.0,B005OVFT38
"The strap feels pretty rough, and my son definitely doesn't like it, and hardly ever wears the watch because of it.  Sure, you can replace the strap, which we plan to do, but what a pain, we would've bought something different to start with had we known.",Needs a better strap,2.0,B005OVFT38
Great watch BUT the strap velcro section is too large and consumes too much of the strap which in turn makes it uncomfortable to wear and hard to adjust.  Not much room for growth either.  Wish they made the strap about 2 cm longer.  Off to buy a new strap I go! :(,"Disney Kids' W000093 ""Time Teacher"" Stainless Steel and Nylon Cars Watch",4.0,B005OVFT38
"For what ever reason when i typed in gifts for 3 year olds this is the one that caught my eye. My little grandson isn't quite 3 but being forward thinking and knowing his curiosity level and ability to focus I chose this. I could not see it in detail quite like the picture I am looking at now. I just trusted the disney product.  My son told me that once he opened it christmas morning he would not take it off. that he was truly fascinated with it.but then this little guy knows his numbers to 20 and abc's and much much more and that since he was not quite two
The whole watch and strapping look like they will lastI will know more as time goes ondon't be afraid to purchase this item.",gonna tell time!,5.0,B005OVFT38
Will be a Christmas gift for my grandson. It is perfect for him and I know that it will help him to learn time.,Time Teacher Watch,5.0,B005OVFT38
He loves the watch but doesn't want to wear it since the band is scratchy. Wish we had bought something else.,"Watch awesome, band itchy",2.0,B005OVFT38
My grandson loves his new watch.  Its the perfect watch for a preschooler. It fits a small childs wrist perfectly.,Great kids watch!,5.0,B005OVFT38
"I got this for my 7-year-old son for Christmas, and he wears it all the time.  The nylon-web band seems like it will be pretty durable.","A good child's watch, it has hands and everything.",4.0,B005OVFT38
"My son really likes the watch, but I thought the time teacher aspect would be more useful/user-friendly.  Sticking some paper on the watch is not going to work for more than a day!","Watch is cute, but ""time teacher"" is not practical",3.0,B005OVFT38
This watch is great for little ones who are just learning to tell time.  Easy to use and the picture on the watch is big and easily seen which my nephew loves.  I also like that the band is velcro so it can be adjusted to fit smaller wrists.,Perfect for little wrists!,5.0,B005OVFT38
This watch is amazing.  When I first opened it I thought it was small but when I put it on my 6 year old it was great.  The band is comfortable so he wears it without fussing and its very durable.  The hands actually say minutes and hours so he picked up on telling time quickly.  Now he looks at other clocks with ease.  Most kids can't tell time but it is very important.  Very glad I purchased this one.,Love this watch!!!,5.0,B005OVFT38
The watch hasn't last a month.,One Star,1.0,B005OVFT38
It very nice!,Five Stars,5.0,B005OVFT38
"I love this little watch, quality is very good and the numbers are really easy to see, I just wish that the velcro was a bit thiner bit over all really pretty and useful!!!",I love this little watch,4.0,B005OVFT38
"Unlike the ""Frozen"" Time Teacher watch I purchased for a neighbor child, this one does NOT have a moveable bezel for teaching time; it only has the corresponding minutes written on a stationary bezel (black), stating ""five,"" ""ten,"" ""fifteen"" etc. at the numbers ""1,"" ""2,"" ""3"" etc. to explain their correlation.  By contrast the Frozen bezel can be turned to show how there are (for example) ten minutes between the 2 and the 4.  My bright 5-year-old great-grandson will have no problem learning with this watch, but for a younger or less advanced child, I'd suggest getting the bulkier model that has a moveable bezel.","""Teaching"" bezel is not moveable; Better for school-age child.",5.0,B005OVFT38
Great look and awesome ...,Nice product ...,5.0,B005OVFT38
Grandson absolutely loved this and wouldn't take it off in the beginning.,Grandson loved this,5.0,B005OVFT38
Great starter watch for kids. Band keeps watch in place securely and the watch is solid not cheap. Great buy.,Great starter watch for kids,5.0,B005OVFT38
I gave my son this watch for his 7th birthday.  He loved the watch and was able to take it on and off easily.  It is great that he can practice telling time on a regular basis and it's water resistant so he can wash his hands without having to take it off.  The style and design are perfect for a little boy.,Nice watch!,5.0,B005OVFT38
"I got the watch for my 5-year old, who is very excited about being able to tell time.  The pin (that you pull out to change the time), kept working itself out enough that the watch would stop telling time.  If I pushed it back in it would work for a while, but would then stop on its own again.  We sent it back and have ordered a different one.

The band is also a bit bulkier than it looks in the photos, so we ordered a traditional band for the replacement watch we ordered.",Didn't work right,2.0,B005OVFT38
My son is just learning to read time and I decided it is time to get him a watch. I saw this red Balloon kids Black Velcro Time Teachers watch on Amazon and placed an order. The watch reached after two weeks and my son was all excited about his new watch. The watch comes with labeled hour and minute hand that makes it all the more convenient to read time. The attractive red and green colors on the white background make the dial attractive. The black bezel Velcro strap is convenient to wear around the wrist. The watch is water resistant to 3ATM and the finish is accurate and comes with one year warranty.,Comfortable to wear and easy to read time,5.0,B005OVKAY6
"Watch seems to work ""ok"", but the secondhand was bent and it wasn't worth the effort/cost to send it back.",Secondhand was bent,1.0,B005OVKAY6
"This is a great started watch, my son is in the 2nd grade and this watch promotes his learning to tell time. The wristband is so better than the regular wristband. He wears it every where and it stays on. I would highly suggest this watch over any Disney or Lego or fashion watch. If you want a reasonable price starter watch, this is one to get.",Walking time teller,5.0,B005OVKAY6
I bought this for my son and it lasted 2 weeks. I dropped it onto a hardwood floor and it broke the glass. I would have hoped for higher quality in a watch for a kid,Mickey broke,3.0,B005OVKO4W
"He will be 4 in July..."" Grandpa, thank you for the watch...I love Mickey Mouse....I love you too grandpa""

Priceless!!!!",Call from my Grandson.,5.0,B005OVKO4W
The band does not fit around my six year old's wrist. I also bought a girl version and that one does not fit on the wrist of my four year old. This was very disappointing as they were Christmas gifts.,band too small,1.0,B005OVKO4W
"Great time piece for little kids.  I wish it were a few dollars cheaper though, but great gift for a kid.",High Quality for Kids,5.0,B005OVKO4W
My three-year-old grandson always wants to play with my watch so I got him his own Disney watch. This one has Mickey's hands tell time.,Time Teacher Disney watch,4.0,B005OVKO4W
My son loves this watch.,Five Stars,5.0,B005OVKAY6
"My son who is learning how to tell time loves it. He is very small for his age and it fits him well. The only thing I can say is that the pins holding the band on could be stronger, we had to replace them after my younger so pulled at the watch while it was on.",My son who is learning how to tell time loves ...,4.0,B005OVKAY6
"This is the second kids watch we are trying for my almost 7 year old.

Here are the pro's and con's for this product:
Pro's:
Actual time piece is sturdy and the white minute numbers on the rim have not rubbed off. The inside numbers and minute tick marks are easily read.
Con's:
The white hour hand is hard to tell where it is as it blends in with the white background of the face of the watch. It'd be great if this hand was a different color.
The band of the watch is uncomfortable. The velcro is a great idea but the whole band is scratchy and therefore my son doesn't like wearing it.  We will be switching the band out.

When it's worn,  it does serve the purpose of helping to tell time.",Needs improvements,3.0,B005OVKAY6
Watch band was much too small!,One Star,1.0,B005OVKAY6
"It abruptly stopped yesterday.  It did restart  after I reset it, but later the pin that holds the band fell out.  It's really very flimsy so I'm not interested in fixing it.  I buy children's watches for two reasons:  I have a very small wrist, and I teach young children.  I use my own watch when I'm teahing them to tell time

Timex was always my go-to watch.  The timex children's watches fit my wrist, and they are sturdy and dependable.  They used to have some excellent watches to help children learn how to tell time.  Those don't seem to be available any more.  The entire Timex line is superior to this Red Balloon watch.  (Now I just have to find out how to return this and get a refund.)",Don't Buy This,1.0,B005OVKAY6
Grandson loves it,Five Stars,5.0,B005OVKAY6
This watch is perfect for those learning to tell time. My son has been excited to tell me the time every time I ask :),Thiswatch is perfect for those learning to tell time,5.0,B005OVKAY6
A small rod that attaches the watch to the velcro wrap broke after two days...,Four Stars,4.0,B005OVKAY6
First watch that was sent did not work at all.  Looked like it was a returned watch.  Second watch is working OK so far.,Firstwatch that was sent did not work at all,1.0,B005OVKAY6
Great watch to teach telling time for the price.,Bought to teach telling time to our grandson.,5.0,B005OVKAY6
good.,Five Stars,5.0,B005OVKO4W
"Very elegant and looks very manly with a reasonable price.  I am sure our grandson will like it.  Thanks, Amazon",I am sure our grandson will like it. Thanks,4.0,B005OVKO4W
Great learning watch!,Five Stars,5.0,B005OVKO4W
My nephew liked it.,Five Stars,5.0,B005OVKO4W
Excellent. Made little boy's day,Five Stars,5.0,B005OVKO4W
This is a great first watch! My 6-year old son wears it every day to school and has not problems with it. It's a really good learning watch.,This is a great firstwatch,5.0,B005OVKO4W
My grandson loved it!,Five Stars,5.0,B005OVKO4W
Bought this as a Christmas present for my niece.  They just visited Disneyland and she is still excited about Mickey Mouse.,Bought this as a Christmas present for my niece. ...,5.0,B005OVKO4W
"The watch band is a little short, so I will have to replace it, but other than that, I am will pleased. Thanks for making this available.",Thewatch band is a little short,5.0,B005OVKO4W
"This was a big hit for a delighted 3 year old boy. It's well made, apparently good quality, easy to put on with velcro. It's early for him to receive a watch at 3, but he will grow into it and get used to looking at the clock face.",Home Run for a Kid's Gift,5.0,B005OVKO4W
"My son wore it for two days and the pin popped on one side already...  Of course, no idea where the pin went.  So...  unusable till I purchase a pin.",Disappointed,1.0,B005OVKAY6
"I bought two Timex watches last year for my boys and they wore them in the tub and swimming with no problems.  The bands understandably were worn so I bought two Red Balloon Timex watches that were ""Time Teachers"".  The first one came broken. The hour hand just spun around so I had it replaced.  It immediately got water inside and fogged the screen.  The second one got water inside and fogged the screen then rusted. I did not return it in time and now I am stuck with the watch.  I would not recommend this brand or model to anyone.  My kids were very disappointed with their Birthday Gifts.",Very disappointed with Birthday Gifts Red Balloon Kids Watches,1.0,B005OVKAY6
"I like it, and it works great. I just haven't been able to get my 7-year-old son to like it as much as I do.","I like it, and it works great",4.0,B005OVKAY6
"The watch is a fine idea and my grandson, age 5, is learning to tell time with it.  The strap is course and rough, and I hope it will hold up to comfort and use.  There's a lot of info in a small space, but the hour and minute hands are really small.  I guess kids eyesight is usually good, so probably not a problem once you get it.",A good teaching tool,4.0,B005OVKAY6
Band is awkward. But great for beginners for telling time.,But great for beginners for telling time,3.0,B005OVKAY6
"This watch is not made for children. We loved the design of this watch, but the crystal sits a little proud of the face, which causes it to crack or chip very easily. Not a good design for kids. Replacement crystals can cost up to $50. If the crystal chips and falls inside the watch, it impedes the progress of the hands, thus running the battery dead. We experienced this problem twice. Perhaps this would not be a problem if the crystal were actually Lexan or Lucite.",Crystal Breaks Easily,1.0,B005OVKAY6
This is a great watch. My son loves it.,Five Stars,5.0,B005OVKAY6
My son loves this watch and has already made improvements in telling time!,Five Stars,5.0,B005OVKAY6
"This is a great watch for a child to Lee to tell time with. The outside circle moves, the hands ha e ""hour minute"" printed on them every Tim k mark is visible. My 6 yr old loves it and is learning to tell time with it. Highly recommend this product.",This is a great watch for a child to Lee to tell time ...,5.0,B005OVKAY6
This watch is perfect for kids learning to tell time.  The hour and minute arms of the watch are labeled and the band around the outer edge of the face helps them with the seconds.  It is a velcrow strap around the back so it is easy on/off that they can do themselves.,Perfect watch for kids learning to tell time!,5.0,B005OVKAY6
"My 5 year old grandson drove everyone crazy with asking the time every two minutes and then ""telling"" everyone the time as he was learning how to use it.  Great product!",Quick time teacher.,5.0,B005OVKAY6
Terrible watch band- the Velcro is stiff and does not stay closed.,One Star,1.0,B005OVKAY6
:),Five Stars,5.0,B005OVKAY6
Nice I think my grandsons will like them,Four Stars,4.0,B005OVKAY6
My son loves it. He is definitely learning to read time at the age of 6. I'm completely happy with the purchase.,Son Loves It,5.0,B005OVKAY6
"I have so much to do in working full time and trying to raise kids who won't end up in prison that some things, like teaching time, are pretty low on the list of to dos. This watch came up in a super lighting must act now gold box deal and I got it for a steal. My five year old boy loves wearing his big boy watch and is learning to tell time. Phew. ;) Check that one off the list. ;)",Good way to teach time for lazy moms,5.0,B005OVKAY6
I was very disappointed in the quality! It was shipped broken and its very expensive for a child's watch!  I would not recommend this watch.,Horrible,1.0,B005OVKAY6
"We bought this watch for our son for his 9th birthday. He loves it, and his ability to tell time has already improved.  It's a great watch so far. No complaints!",Great First Watch!,4.0,B005OVKAY6
This watch is great but the strap is very sharp on the edges which means my son does not want to wear it!,Watch strap,4.0,B005OVKAY6
"This was bought for an 8 year old boy, and is highly recommended. EASY to read, band is fantastic for an active boy, and works great!",AMAZING!!,5.0,B005OVKAY6
I would recommend this product. It has a quality look and appears to be quite durable. Our 7 year old grandson loves his watch!,Quality product.,4.0,B005OVIAJI
"This is a gift for my 5 year old grandson - he hasn't received it yet, but it sure looks great to me.  Hope he will learn to tell time the good old fashioned way.",captain america stainless steel time teacher - bought for 5 year old.,4.0,B005OVIAJI
My grandson was asking for a watch and this fit the bill!  Loved that there were different choices of superheroes!  He wears it all the time.,Grandson loves it!,5.0,B005OVIAJI
i bought it for my 7 year old son. The band disturbed his wrist so i changed it. Cute watch.,good enough except the band,4.0,B005OVIAJI
Captain America is my youngest grandson's hero. He loves his watch. Great watch built well. This was an excellent purchase.,Great watch,5.0,B005OVIAJI
why not get your kid something fun that will teach him how to tell time the old fashioned way??  quality seems to be good,good for teaching,4.0,B005OVIAJI
"I managed to grab this watch while it was a lightning deal, priced significantly lower than what appears to be the regular pricing.  My rating might be a half star lower at the regular price point.  The watch and wristband are both solid builds though the strap can be irritating over a long period of wear.  The numbers for both hours and minutes are both easily readable and the hands are contrasted nicely as well.  Our son loves it and has quickly taken to telling the time thanks to this watch.",Great Value If You Can Catch It On Sale,4.0,B005OVIAJI
"Our 6-year old grandson was thrilled with this watch. He actually learned how to tell time in less than 15 minutes...after struggling for months! His parents tell us he is approaching complete strangers to inform them of the ""current time!""  The watch seems to be well-made, and he liked the Captain America graphic.",Our 6-year old grandson was thrilled with thiswatch. He actually learned how to tell time in ...,5.0,B005OVIAJI
Love it! It's exactly what I've been looking for!,Perfect,5.0,B005OVIAJI
"my grandson,age 8, totally loved this watch.  He was used to digital watched so this watch was a must have for him.  He's very smart and picked it up fast.  I bought this because he is an avid Captain America fan, so he was eager to wear it.",totally loved this watch,5.0,B005OVIAJI
"I bought this Christmas present for my 5 year old grandson, a Capt America fan, who will soon be learning to tell time...so it is perfect.  It looks just like the picture, no surprises.  The band is velcro so he should be able to get it on and off with ease.",it looks just like the picture,5.0,B005OVIAJI
I was very disappointed when I opened the package. It looks cheap and was poorly crated. It was not worth what I paid for it. it's not worth the time and effort to send it back. I would not recommend anyone purchase this from this company. I hope my nephew will understand and hopefully like it.,How disappointing.,2.0,B005OVIAJI
Watch came with un-attached minutes arm.... quality control fail!,One Star,1.0,B005OVIAJI
"We purchased for our kindergartner as he was learning to tell time in school.  I think it is a great way to teach kids to read a clock.  My son loves the look of the watch, but he constantly complains the band is not comfortable.  The band has a section that doubles up and tucks back under the band.  The ""extra"" part that goes back under just rubs the wrong way and now he rarely wants to wear it.  His brother has a similar timex watch that they both love to wear and is comfortable.  I assumed when purchasing this would be the same kind of watch, but I was wrong the band is shaped weird.  I'll post a picture of what I am talking about regarding the overlap on the band.",Great Teacher- Not Comfortable,3.0,B005OVIAJI
Easy to read and to use.  Great for kids learning to tell the time?  My six year old loves it,This is an excellent watch for kids learning to tell the time,5.0,B005OVIAJI
My 6 year old grandson put this watch on and even wore it to bed the first night. It has the hour hand and the minute hand marked to help teach him to tell time. Seems to be sturdily made.,Power rangers watch,5.0,B005OVIAJI
We purchased this for our almost 3 year old. Fits him perfect. Easy for him to put on and take off himself. He loves to spin the dial.,Time Teacher,5.0,B005PKZG5E
This is an attractive watch and my child liked telling time by Mickey's hand movements but the watch face cracks VERY easily. I actually purchased two of these and both cracked within three weeks of ownership without rough handling (normal 4-year-old play). If you are looking for a durable child's watching this is not what you are looking for.,Watch face cracks easily,1.0,B005PKZG5E
My grandkid loves it. he is 4 years old and has learned how to tell time with the handy instruction book that came with it.,Watch,5.0,B005PKZG5E
"I was surprised that the face of the watch, which is glass, is higher than the bezel.  The first one we received was already chipped. We are waiting on the exchange.  If my nephew (2 1/2 ) wasn't smitten with it, I would return it instead do exchanging it. Glass gives clear view, but how practical is it really when the kids are going to break it eventually and get glass on then, or worse yet, in them.",Glass watch face is higher than bezel,2.0,B005PKZG5E
"I bought this watch to help my kindergartener tell time since they just started learning that in school.  Terrible watch for this purpose!  Face is too tiny, the hands are white so you can't see them against the face and the numbers (05, 10, 15) that I thought would help him are SO TINY you cannot see them at all.

This watch would probably be good for a smaller child but not for someone learning how to tell time.  Back it goes.",Not for older kids learning how to tell time,1.0,B005PKZG5E
I bought this watch for my 2 and a half year old son .  He loves watches and is very good with recognizing #'s already.  We previously bought him cheaper watches that all broke.  So far he loves this one because of Mickey Mouse and there's # on the watch itself as well as the bezel to learn the minute hand function.  The Velcro is perfect for taking it on and off and proper sizing.  Overall great watch that he loves and it seems like it will last a long time so I don't see replacing it anytime soon.,My son loves it,5.0,B005PKZG5E
"Bought this watch for a nephew that loves Mickey and is learning to tell time.  He LOVESSSSS it!!! Won't take it off.
 Now..to buy my daughter one, since she saw his.  Great product...definitely recommend!!",Perfect Gift for a 5 year old,5.0,B005PKZG5E
My grandson loves his watch... He shows it to everyone and tells us the time every two minutes!!  Very nice product...,Micky Mouse Watch,5.0,B005PKZG5E
"Bought this watch as a Christmas gift for my three year old Grandson to learn to tell time. Looks great, will wait to see if it will take the licking that it will get from him.",Time Teacher,5.0,B005PKZG5E
"It's nice.  I bought it for my son as a gift, so we'll see what he says when I give it to him on his birthday next week.  I just wish they would have included the battery.",It's nice. I bought it for my son as a ...,4.0,B005PKZG5E
"so far so good.
my girl enjoys it.
Let's see how long it stays working",nice watch.,5.0,B005PKZG5E
"My 6 year old grandson loves this watch.  The color is great, and the build quality is first rate.  Being able to use the hands to read time to me is way better than going all digital.  This looks like a watch that will last for a long time...and it's waterproof!","Buy this for a great ""time""",5.0,B005PKZG5E
My grand nephew loves it!,Five Stars,5.0,B005PKZG5E
Great acquisition for our 21/2 year old grandson! He loves it.,Quelle heure est-il Grand-pre?,5.0,B005PKZG5E
"It looks even better quality in person, I am very excited to give this to my son for the holidays. He is 5 and always tries to tell time so this is such a great help :)",It looks even better quality in person,5.0,B005PKZG5E
"Like the watch, hate the band.  Too clunky and bulky, material stiff and uncomfortable,  and difficult for a five year old to manage.  A plastic band would be much, much better.",Got my first Mickey Mouse Watch in 1954.,3.0,B005PKZG5E
"The watch itself is OK.  Reasonably easy to see the hands and tell the time.  The band is somewhat of a pain to put on, however.
The part that loops through the holder and then back on itself to fasten with the velcro is bulky and does not want to stay put -- even with an adult helping.  That should be a little thinner and easier to manipulate.  My four year old grandson had trouble fastening the watch on his wrist by himself.  Overall still a nice item.",Reasonably easy to see the hands and tell the time,3.0,B005PKZG5E
The watch is beautifully made and I am sure my Grandchildren will like and enjoy wearing this watch.  The price is also very reasonable.  Thanks Amazon.,The watch is beautifully made and I am sure my Grandchildren will like ...,4.0,B005PKZG5E
My 6 year old son likes it very much. I like that is its analog watch so it teaches him how to tell time.  The straps are comfortable bit a little bit bulky.,I like that is its analog watch so it teaches him ...,5.0,B005PKZG5E
Started to fall apart after just a few weeks. Had to order a different one.,Two Stars,2.0,B005PKZG5E
Perfect! Just what I was looking for!,Perfect Mickey Mouse Watch,5.0,B005PKZG5E
Grandson's gift.  He loves it.,Five Stars,5.0,B005PKZG5E
"Love it! The strap doesn't go small enough but I mean he is only 2, maybe it will fit when he is 3 and better able to understand telling time anywaya",Food stuff,4.0,B005PKZG5E
"After 3 months, the minute hand is loose and just flops around. Making it pretty much unusable to tell time.",Only lasted 3 months.,1.0,B005PKZG5E
We bought this for my son for his 11th birthday. It was just what he wanted. The only small complaint is that he says that the velcro is a bit itchy,We bought this for my son for his 11th birthday ...,4.0,B005PKZG5E
"My son loves wearing this watch.  Easy for him to put on.  Great buy - it taught him how to tell time, without my help!!",Easy for him to put on,5.0,B005PKZG5E
