reviewText,summary,rating,asin
"I ordered 1/2 to 1 size larger than his usual size, and got wide based on the other reviews, and am very glad I did!  My 17 month old son can wear the 6W without socks, but with socks they are a little too tight (they are cuter without the socks anyway, but some days he wants socks).  They fit just perfectly, and I thought they were going to be a little big.  Anyway, sizing aside, they are very good quality, as expected from Stride Rite, and really really cute.  My son does not get red spots or blisters from them as it he did with another brand of similar looking sandals.  He does not want to go anywhere without either these or his brown Stride Rite tennis shoes on, and he is very opinionated!  Good purchase!","Does run small, but very cute!",5.0,B000FIJVR0
"The shoes fit my grandson but are a little smaller than I expected. He won't get as much wear out of them before putting them away for his younger borther. That being said, they are well made.",A litle small,3.0,B000FIJVR0
"General speaking, it is good, but my baby hate to wearing it, since the material is too hard for him.",My baby refuse to wear it,2.0,B000FIJVR0
"Great Sandal, Great Price, Fast Shipping!!!!
This leather sandal is true to size and really really a great sandal at a great price!!!",Great Sandal,5.0,B000FIJVR0
First pair of shoes I've found that are wide enough for my 20 month old son. He's only been able to wear crocs to this point. He won't take them off. They look great with shorts or dress khakis.,Perfect,5.0,B000FIJVR0
"My son wears wide width shoes so finding shoes for him has always been a bit of a challenge. We bought these last summer and they fit so perfectly, we bought them again this summer in his current size. They're cute, fit perfectly, and let his little feet breathe in the heat. They're durable and I know will last until they just don't fit anymore. The amazon price was fantastic as well. I purchased them when they were on sale for a good $10 cheaper than anywhere else.",perfect sandal for toddler,5.0,B000FIJVR0
"I first bought Stride Rite shoes from Amazon because they were recommended by a coworker. I have been in love with them since! I bought these for my son because of the blazing summer heat of Louisiana and I wanted open toed shoes for him. He loves these shoes (which is saying a lot) and always wants to put them on. Stride Rite has to be very comfortable for my tot as he wants to constantly wear them. I am very pleased with this product and I will be buying again for as long as I can.

I like the feel and color of them too.",Stride Rite,5.0,B000FIJVR0
I bought this sandal for my 16 month old son. He loves wearing it. Looks very good and very comfortable. He walks around it this all the time! Definitely recommend it.,Awesome!,5.0,B000FIJVR0
"See subject line.  Need I say more? The shoes are sturdy, and well made, with comfort for the wee feet built thoughtfully into the design.  Buy them.","Sturdy, good looking, and the twins loved them!",5.0,B000FIJVR0
"It seems good quality ,but my son doesn't like it at all. The material inside seems hurt his feet . they are too hard for 2 years old kids. I think they could do much better if they change the material",my son refuses to wear them.,3.0,B000FIJVR0
"My son loved these but we did need to return them and get a size larger. We also got ""wide"" and it didn't look wide but did fit comfortably",Comfortable,4.0,B000FIJVR0
"Totally pleased with this, but sizing runs a little smaller than usual despite ordering half size larger than his current size. Sad. Will probably outgrow in another mth, tops. Would I get the same thin in bigger size? Of course!",Pleased!,5.0,B000FIJVR0
These are great summer sandals for a little boy.  They are durable enough for everyday play and then look nice enough to wear with khakis on Sunday.  The fit was true to size and they've held up through a rough 3 months so far with nothing beyond the expected scuffing of the leather.,Great shoes for everyday or dressing up,5.0,B000FIJVR0
"The leather was a bit stiff in the beginning, but that's how all leather is.  It does stretch nicely, and has always been comfortable for my son.  Shoe is a few shades darker than what is shown, but is very attractive.  All in all, a quality shoe!",PERFECT FIT,5.0,B000FIJVR0
"We only purchase Stride Rite shoes due to our son having very wide feet, and generally love them. These ones make his feet smell, and I notice a different pair that looks very very similar (Harper Fisherman) does not.

I looked at them closely and believe it's because the insole on this one is some type of material while the Harper insole is leather.

They also gave him blisters on both feet and we have been having him wear socks with them to help heal the blisters.

Overall, a decent shoe, but has some flaws.",Not the best Stride Rite shoe,3.0,B000FIJVR0
"Great sandal!  My son just started walking and these sandals have a soft sole to help him with his balance.  Other sandals I've purchased have been incredibly hard soled which makes it difficult for my son to walk with as he's still learning.  The velcro strip is convenient and doesn't stand out so my son actually leaves the sandals on - with any other shoe that has ties or straps he pulls the shoe right off.  The sandal goes great with any outfit too - also great in the water.  I thought the water would ruin the leather however, not the case at all, still looks brand new.  My son wears them to the creak by our house every weekend.  Would highly recommend these sandals!",Awesome sandal,5.0,B000FIJVR0
Just pop these on my son and go! very cute and stylish. they're very comfortable and go with evrything. i would recommend!,Great Little Sandal,5.0,B000FIJVR0
"I bought these for my 2 1/2 year old.  He loves them. He wears them almost everyday and fusses if you offer him a different pair of shoes.

He needed a wide size and these fit great. They are true to size and are very flexible.  The leather is holding up well and not showing scuffs.

I highly recommend and wish I had bought 2 pairs when they were on sale!",Favorite shoes,5.0,B000FIJVR0
"I was looking for a nice leather sandal with good rubber soles that would not slip for my son to wear this summer.  These shoes are firm, yet slightly flexible, which is important in early walkers.  I had originally purchased a cheap sandal from a local discount chain store for less than $10. This shoe, although greater in price, is the better buy!  He likes his sandals and almost never tries to take them off. In fact, he very often will bring them to me to put them on! I gave this shoe 4 stars only because it is a bit expensive.  However, I did purchase a second pair for his twin sister!",Great looking sandal!,4.0,B000FIJVR0
"My son had a pair of these when he was about 2 years old. Now almost 5 we were looking for a nice sturdy but comfortable pair of summer shoes that would endure his active and dirty lifestyle. These are the perfect sandal! The best part is they clean up very well after a hard play if need be for a more formal event/outing.

My son loves them and even at two they were easy for him to put on himself. Highly recommend!",x2 and still just as great!,5.0,B000FIJVR0
"My son has been wearing these Little Angler sandals for 2 1/2 years, and we both love them.  They are well made, comfortable and provide plenty of support.  They hold up well--they don't wear out, he outgrows them.  We feel the same way about Stride Rite's tennis shoes.",great sandals,5.0,B000FIJVR0
EXCELENT ITEM. MY SON LOVES IT. ONLY OBJECTION THAT I HAV IS THAT BACK BELT IS GOING DOVN AND GETS OFF FROM FOOT.,Stride Rite Little Kid/Big Kid Angler Sandal,4.0,B000FIJVR0
They seemed like nice sandals but the sizing was not accurate.  We ordered 5 wides and they were smaller and narrower than a size 4 regular sandal we had,mis-sized?,3.0,B000FIJVR0
"I bought these for my 14 month old son. They look darling in person and seem to be well-padded. He didn't even have them on long, however, before his feet started to appear pinkish, especially around the top of the sandal. I had to take them off and carry him, as I didn't want to allow them to damage his skin. They fit him properly, so it wasn't a sizing issue. I don't feel they are healthy for soft, chubby, little feet.","Cute, but they are more suited for an older child",3.0,B000FIJVR0
"Typically you can't go wrong with Stride-Rite shoes for Toddlers.

This shoe is great because quality, as usual, is above average. Along with leather upper there is solid traction rubber soles making them more than a flimsy sandal. Velcro straps too for easy on and off.

Another reason I chose this particular sandal for a second time is because unlike most sandals chosen for hot summer days these actually protect little toes while climbing, running, skipping, tripping, and sometimes falling.","Stride-Rite, a Great Shoe",5.0,B000FIJVR0
My son has been wearing these shoes since he was small now he is 9 and still wears them they are so comfortable and light weight i strongly recommend.,Great Shoes#1,5.0,B000FIK09S
"This is the second pair of these styles of shoe that I have bought. My Kid uses it every day to school and have been very resistent. He is a sport guy, so all the time is running, kicking balls and they have last the whole year. I have changed them due to size not by use.

 Very easy to get in and out of their feet.",Excellent shoes,5.0,B000FIK09S
The pair was a bit too expensive but my son likes it and it seems to fit him comfortably.,Expensive but Good,4.0,B000FIK09S
"Stride Rite's Austin athletic shoe is a well made and versatile shoe.

The quality of the leather is nice, and the stitching is strong throughout the shoe. It has a heavy dute sole that should wear well for quite a while, even for an active child.

The shoe itself is heavy, not like an ultra light sneaker (which most kids probably don't wear anyway).

Note - there is little padding on the inside of the shoe, which may or may not make a difference depending on your child's foot.

This shoe comes in W & XW sizes.

Another great thing about this shoe is that it's gender neutral, so a boy or girl could wear it.

I love Stride Rite's quality and versatility in the Austin athletic shoe.

I won't buy this style again, because honestly, I ordered one in every size. With the sales/discounts it was about $13 per pair, and I can easily sell used pairs for this much at the consignment shop.",Stride Rite quality for boys or girls,5.0,B000FIK09S
My six year old chooses these from his closet every time as he feels very good in them,very supportive sneaker,5.0,B000FIK09S
I've been buying this style for my son for 4 years.  We've had them in both white and black and just love the quality and fit.  Highly recommend!,My favorite Stride Rite shoe!,5.0,B000FIK09S
"I love the stride Rite shoes quality, I bought this for my son as part of his uniform for school, I really like these shoes they go with everything and always the Stride Rite shoes are very comfortable for him, he loves this shoes and since I received them he doesn't take them off.",Stride Rite always the best,5.0,B000FIK09S
These are so nice and well made I kinda wish I would have bought 2 pairs in black as well!,Great shoes!,5.0,B000FIK09S
"The shoes were fine, but I bought them for my five year old, and they're way too big.",Good shoes. Wrong size.,2.0,B000FIK09S
"This is a good quality shoes with good price. It looks very sturdy. I bought 11W size, so that my son can wear thick socks. And black can go with any color.",good quality,5.0,B000FIK09S
Perfect school shoes for my son,Good shoes,5.0,B000FIK09S
Great shoes!,Five Stars,5.0,B000FIK09S
As usual Stride Rite makes and awesome product that will last.,Five Stars,5.0,B000FIK09S
"Item arrived on time.
I love this sneaker. Its a nice looking sneaker and it fit perfect.
I strongly recommend.",Nice Sneaker,5.0,B000FIK09S
These shoes are for school uniform.  My grandson's feef are extra wide and it is difficult to buy wide shoes for a 4 year old.  These worked really well this year. May buy another pair this year.,xw shoes,5.0,B000FIK09S
"It's a heavy sole sneaker for a preschooler to wear... not to mention running much to small in size. I will not buy this brand again, unless it's the leather sandals - those are great!",not a satisfied customer,1.0,B000FIK09S
"na. was a good buy, this lengthy word count quota on this review is completely un-neccesary. the end, the end.",na,5.0,B000FIK09S
got it for my son to go to school....just what I was  looking for....did not regret I bought this product,strong shoes,5.0,B000FIK09S
"My son wears his shoes to school and out to play daily. I wipe the outside with a Pre-moistened antibacterial wipe every night and they look new day after day. Other more popular brand named athletic shoes, couldn't  keep it together under this continual wiping...the coating over the ""leather"" began to peel off, but not the Stride Rites. The sizing chart is extremely accurate.",Very durable shoes,5.0,B000FIK09S
"It is a good sneaker , little heavy, but for school looks like a very good choice. I would buy it again.",Good purchase,5.0,B000FIK09S
"very comfortable. my girl like so much, good for school and sport. very good price. look very smart and style.",little yellowlish but look very smart,4.0,B000FIK09S
"I bought these for my 10 y.o. daughter and they really received very little use. The strap broke after 3 months, which was about 30 uses. The strap ripped right off and it's too late to return. Poor quality.",Broke in 3 months,1.0,B000FIK09S
"My older kid started kindergarten this year, and I wanted him to have good shoes.  Uniform dictated black shoes, so I got these for him. He loves them. As a reference he used Crocs all the time before school, but now he uses these for school, and they are comfy like Crocs too.",Great for kindergarten,5.0,B000FIK09S
cute shoes worked for catholic school requiring white shoes. Love velcrow part for my toddler.  She can put on herself.,cute,5.0,B000FIK09S
These I bought as well for my daughter I know  they are the kind of shoes you know will bring comfort to her little feet. Been buying her this brand make for over one year  and I love their shoes.,Good quality,5.0,B000FIK09S
These shoes are great for fit and how long they last.  Stride rite shoes give my sons extra wide feet a comfortable fit.  I have to take one star away from this color and style for how they look - they kind of look like prescription orthopedic shoes from years ago.  This is my fault because I wanted a shoe that was neutral to go with anything - I should have thought about an all black shoe for a kid before I bought it.  We will be buying more colorful versions of Stride Rite shoes in the future and this is the first time we have bought a Stride Rite shoe that didn't look great.,Great Shoes - Kind of Ugly Though,4.0,B000FIK09S
"Only 6-8 wears and the inside is falling apart and exposing the inner makings which are very rough and rub holes in socks, never been worn without socks i would not buy agaian or recommend this item. spent around 50.00 for these bad buy.",stride rite product wronq quality,2.0,B000FIK09S
"I just bought a pair of the Austin Athletic shoe size 11 for by daughter. 1 shoe was fine but the second one was yellow and it looked worn out, the leather even looked wrinkled. not sure were the shoe was but it was not inside the box with the other good looking sneaker. im returning the pair and will go to the mall to buy the sneakers, don't want any more surprises.",got a worn out sneaker,1.0,B000FIK09S
"the material is very nice ,looking like it will last a hold year. my daughter love it hook loop works good..............",it is ok,5.0,B000FIK09S
"My grandson is attending a private school for kindergarten and this is one of the shoes recommended for his uniform.  Looks nice and fits well.  I have had other Stride Rite styles for him and I have always been please with their fit, look, comfort and wearability.  I highly recommend Stride Rite.",Stride Rite is always a great Toddler shoe,5.0,B000FIK09S
I was just looking for a simple pair of white sneakers for my granddaughter for school.  These looked good so I ordered them.  What a pleasant surprise.  Sturdy and attractive and my granddaughter just loves them .  At age 4 she is very fashion conscious (smile). - and they really do look better in fact than they do in the pictures online. Short story - we love them.,Better than it looks,5.0,B000FIK09S
"Although a large size, but my son still like these shoes, but the only drawback is that the tongue of the shoes  is too high, the child complained to the foot when worn friction will be pain and uncomfortable",the tongue of the shoes is too high,4.0,B000FIK09S
Its been 3 months since i bought them and i have to say that l am buying another toddler for my kid. I have to say that my i bought another pair of toddler for my dother and they are intact,Its Bad quality,2.0,B000FIK09S
"Been looking for shoe for my 5 year thats comfortable and  durable, this shoe did just that for me. He wears it to school everyday, very pleased with this purchase.",Love Stride Rite austin,4.0,B000FIK09S
"Bought these shoes for my twin grandsons!! They love them! Easy to wear, wash and white shoes match everything! Will buy again for next size!",Great shoes,5.0,B000FIK09S
"I usually buy Stride Rite shoes for my son at the mall, and the shoes from the store are usually great and fit well, so I thought buying them online would be ok. These shoes have worn out really quickly, and there's a hard plastic part of the sole that juts into the arch of his foot and rubs until he has blisters. I think there's probably some special sub-par factory that makes everything you buy online, knowing you aren't likely to return it because you don't feel like dealing with the hassle. That's how they get you. Anyway, this might be a bad batch of shoes but I am disappointed.",surprisingly low quality,2.0,B000FIK09S
I buy this for the kids school. They look fine and Im very happy with the stride rite brand. They are easy to clean and fit right in my kids feet.,confortable,4.0,B000FIK09S
"We are required to have this as a school uniform shoe. My 4 year old is very active, but not more so than the average preschooler. I have purchased three pairs of this shoe so far this academic year (2012-13). The first pair purchased in September 2012 - the toe stitching came out (which didn't really affect the shoe because the sole is glued at the toe as well), and the sole by the ball of the foot wore out. Second pair purchased in November 2012 - toe stitching came out again, sole getting thin, and velcro strap broke at the point where it folds over. Third pair purchased March 2013 - hope it lasts to the end of the year!","Weak velcro, poor toe stitching, sole not very durable",2.0,B000FIK09S
"this is the second pair of shoes (same model) I buy. My daughter uses them for her school and these are the perfect gym shoes. She loves them and she was the one requesting the same ones. Fit true to size and so comfortable. May I say the previous pair is still in excellent condition after one year of daily use, only she outgrew those.",Worth every penny!,5.0,B000FIK09S
"I'm very glad with the product - It's same that I saw in the web - The size is correct
Thanks very much!!!",It's very nice,5.0,B000FIK09S
Shoe is a little heavier than the New Balance one I bought for my son previously. It is also a little bit tight in the front compared to other wide width shoes.,A little tight and heavy,3.0,B000FIK09S
"In spite of the fact that my grandson had this shoe style before, and I ordered , what I thought was the next size up, and was in the same XW width, he got painful blisters on his pinky toes on both feet.  I returned both the black and white pair. Next time we will go to the Stride Rite store. No more shoes by mail for a child. Faulty judgement on my part.",Shoes made blisters on my grandsons toes,1.0,B000FIK09S
"i love stride rite , i bouth this for my 3 year old son BUT i think
this are not as soft as other stride rite shoes /tenis","i love stride rite , i bouth this for my 3 year old son BUT...",3.0,B000FIK09S
My son used this for 3 months before the top stitch near his big toe came apart. It was suppose to last him the school year. Instead  he needed a new shoe by December! I am really disappointed.,Looks good but comes apart easily,1.0,B000FIK09S
"My son needed these as part of his school uniform. Having extra wide feet makes it really hard for me to find shoes that fit his physical needs as well as his school uniform requirements. His previous pair had laces and it wasn't easy to keep those tided all day. This new pair have Velcro which is totally convenient for him. They look ""dressy"", but they are also comfortable.
I bought them at Amazon because they were cheaper than the Stride Rite web site. I do recommend this product.",Stride Rite Austin Athletic shoes,5.0,B000FIK09S
These are a great sandal from Stride Rite.  I purchased the same pair last year- they were very comfortable and wore extremely well.  I would highly recommend these.  They are also easy enough for my 3 year old to  put on by himself!!!,Great sandal for toddlers!,5.0,B000FINGKS
my daughter was/is learning how to walk and these are by far her favorite. The sole bends well and helps her keep her balance. well worth the moeny.,amazing,5.0,B000FINGKS
"After searching store after store, I finally found what I was looking for.  It is really hard to find shoes that I like for my son in a wide.  I want the shoe to still look little-boyish, since he is 2. Most of what you find in stores looks like a big boy should be wearing it.  It fit him perfectly and the shoes look adorable if he is wearing a one-piece outfit or if he has on shorts and a t-shirt.  I would definitely buy again!",Just what I was looking for...,5.0,B000FINGKS
Love this for my little boy. Perfect for his Easter outfit.. Thanks so much and appreciate the exchange so quickly.,love it,5.0,B000FRXH26
These shoes are more adorable in person than in the picture. They are unusual and dressy. Great for dressing up your boy! I put my grandson in them and he wore them with the Infant & Toddler Boys Vintage Style Knickers Outfit 5 pc. outfit for his pictures! Totally adorable:),So Stinkin' Cute!,5.0,B000FRXH26
These saddle shoes are great and look adorable on my 1.5 year-old. They were true to size and he walks fine in them (I was worried that they may be too stiff). I would definitely recommend them!,Great dressy shoes!,5.0,B000FRXH26
"Purchased these shoes for a special occasion and my son loved them so much they became his favorite shoes.  Now, over a year later, they are too small and we're sad that Designers Touch doesn't make a size 11 or 12.  He wore them at least 4 days/week and they never wore out or had any defects. Lots of compliments, too, because they are so darn cute!",Son's favorite shoes,5.0,B000FRXH26
"i bought these shoes for my 18mnth old for Christmas.  However, when they came they were too small.  I went online to exchange however i could not because the item didn't ship from Amazon.  So, i returned and went to re-order.  When I originally ordered the product I paid less than $19 for the shoes.  When i went to re-order they were $44.  Totally unacceptable to me and will make me think before I order from Amazon again.  You should be able to exchange all product for the same price you originally bought it.",Bad Return/Exchange Experience,1.0,B000FRXH26
"These shoes are adorable. Just received them in the mail today for my 11-month old, who wore them briefly for some Christmas pictures. They looked super cute and seemed like a comfortable, quality shoe; well-made, with sturdy soles.",Quality shoe,5.0,B000FRXH26
"These shoes are so adorable. I was having the hardest time finding dress shoes to go with my 18 month old son's Easter outfit. These were perfect. A little expensive, but for me they were worth it. They are a good quality shoe, and look adorable. Everyone always comments on them everywhere we go!",Love these shoes!,5.0,B000FRXH26
I love these shoes and my grandson looked so handsome in them.  They are well made. I would recommend these shoes to any toddler. Thanks!,Love these shoes!!!!,5.0,B000FRXH26
"These shoes are awesome. My son loves them and we have had many people ask where we got them. Unlike most dress shoes, they are soft and comfortable. Very nice!",Great shoes!,5.0,B000FRXH26
"My son has wide feet and this was the 4th pair of saddle shoes for my toddler that I could actually get his foot into, so they were the pair we decided to keep. Thank you Baby Deer for making shoes with more room! Unfortunately after the  two hours of wear (and yes, there was quite a bit of running around during that time since he's 20 months old and always on the GO) I was heartbroken to see he developed two large blisters on the back of both of his ankles. He was unusually cranky while wearing these and I regret not even thinking that the shoes could be to blame. Very disappointed for the price that we only got to wear them once.",Caused blisters on both ankles after two hours of wear,3.0,B000FRXH26
If you want your toddler to dress sharp from head to toe these shoes complete the outfit These shoes are so sharp I love them,... complete the outfit These shoes are so sharp I love,5.0,B000FRXH26
Very cute!,Five Stars,5.0,B000FRXH26
Love the shoes and they fit my baby just right.,Five Stars,5.0,B000FRXH26
Great quality but seemed a little on the bigger side so I doubled up on the socks until he grew into them! Lots of compliments. They are cute!!,Great quality,5.0,B000FRXH26
"i love them they are just perfect, well made and not that heavy.",Five Stars,5.0,B000FRXH26
