reviewText,summary,rating,asin
"Comes with a dead battery, so plan on spending another $12.00 at the jewelry store to get the battery replaced.",Purchased watch,2.0,B004QXHDCU
It met my specifications.  I wanted something for a ten year old boy that looked like a boy's watch and would fit his arm.,Boy's Watch,5.0,B004QXHDCU
The watch was a perfect one for my grandson and he loved it until we tried to set it and the battery is dead. so now I have to buy a battery for it or send it back. I fear that since it is from England  it will take for ever to get it fixed so I will take it to a jewler and try to replace the battery.  if that doesn't work I plan to return it.  It could have been damaged in shipping as it was not protected very well.  only in a manila envelope with a small amount of bubble wrap. my first disappointment from Amazon,watch does not work,1.0,B004QXHDCU
Not as nice as I expected. Not really camo.  Too much trouble to return and I only hope the little boy likes it.,Watch,2.0,B004QXHDCU
"If the face lighted up, this would be beyond perfect. Easy for a kid to put on, encouraging him to use it and learn to tell time. My grandson loves it, which makes me very happy.",Grandson Hasn't Taken It Off,5.0,B004QXHDCU
My 5yr took a notion for a watch last yr he sees me wearing one and he wanted one I tried several cheap-o watches he can't tell time (: but the bands kept breaking and I'd get another after he did not forget about them .. This time I got him this watch and band and it is still all working and in one piece (: And the best part is he can put it on and take it off by himself now (:,Boys watch,5.0,B004QXHDCU
The awkward Velcro strap is too long to fit the 8 year old boys. It is of an adult size strap.,Strap is too long to fit the kids,2.0,B004QXHDCU
Got this watch for my 8 year old.  Great practice for analog time telling and its stylish enough for his age.,Nice Watch,5.0,B004WYP8WK
nice leather band,Five Stars,5.0,B004YF52TQ
"The bullet wrist cuff was everything I had been searching for. It was in perfect condition when I received it. The only drawback is that it is a little tight around the wrist of a man. If it had been made a little longer, I could have given it 5 stars. Very cool piece of jewelry though! Perfect for us bikers!!",Edgy new wrist cuff!,4.0,B004YF52TQ
"My daughter really likes the slap-watch style and has gone through a few of them.  The first suffered a split of the rubberized cover exposing the spring metal underneath.  That took over a year to become an issue so I write it off to normal wear and tear.  The second slap watch was made with somewhat floppier rubber resulting in the watch actually popping out of the case because the flex induced by the curling of the strap around a small wrist turned the circular rubber retainer section into an oval with a big enough gap to allow the watch to fall out.  This issue was clearly the result of mediocre materials for the purpose.  The Euro Sparkle watch associated with this review is the third we have purchased and is a good unit.  It is made of a stiffer rubber and is holding up well.  Note that the watch ships from overseas so it took a while, maybe 2 weeks, to arrive here in Maryland.",Good watch for kids.  Better than some for sale out there.,5.0,B004YSVGH0
poor quality,don't was your $,1.0,B004YWSFXE
Great for toddlers or kids who want a watch but are too small even for a watch with adjustable bands. Just watch out for the face that pops out. My almost 3YO daughter loves her watch and enjoys straightening it and popping it onto her arm. She can do it herself! I even showed her where the short hand is!,"Great, but face pops out!",4.0,B004YWSFXE
"We ordered this super cute watch for my daughter's friend's birthday.  She loved it, but a week later let us know the watch stopped working.  They took it to have the battery replaced but was told it was not the battery that was the problem.  When I contacted the company about getting it exchanged, they quickly sent out a replacement watch (they didn't even have us send the other one back).  Last I heard this one is working fine.",Super cute but had to be replaced,3.0,B004YWSFXE
Don't fit all wrists very well,Three Stars,3.0,B000QSIU44
This is a fun little watch and had my youngest boy telling time as soon as he put it on. A fun item for all your young Lego fans.,"""Time"" for Lego.",4.0,B000QSIU44
my son was so excited to get this. however after about a week the minute hand broke.. not worth the money. very dissapointed,broke within a week :(,1.0,B000QSIU44
kid was very excited about this watch as a bday gift!!,Five Stars,5.0,B000QSIU44
My boy had lotsa compliments from his classmates... Really pleased :),Really pleased: ),5.0,B000QSIU44
"I've been wearing this watch for about a month and a half now, and it's great. It keeps time like a champ, and if anything might run a minute or two fast. The days of the week can be set to English, or French; the work days are written in black, Saturday is written in blue, and Sunday is written in red. The face is a deep sapphire blue with luminescent dots near the stick markers, and luminescent bars on the hands. It only takes a little time in bright sunlight in order for the marks to glow bright. The only issue that I had was getting it sized initially- the pins in the metal band are apparently quite tight/small, so I had to go to a watch specialist (rather than just a jewelery store) to get the band fitted. Now that it's adjusted, it's my go-to daily watch. Love it!",Great watch!,5.0,B0055XBH7W
"Gave this watch as a gift to a loved one.  She loves it, great watch, looks fantastic, but loses a few minutes every week or so, ie it gets slow by about 3-5 minutes a week.

Update:
So nearly one year on, this watch is losing about 15 minutes every week.  This isn't horrible and with some thought one just has to remember to check the time to make sure its right every so often, however, it could make someone late and speaks somewhat to the quality of the watch. If someone knows how to adjust it let me know.","Very happy, great looking watch but loses some time",4.0,B0055XBH7W
"Keep wearing it and move it because it doesn't keep accurate time at the first few weeks. I think I didn't wind it up enough maybe, but I have faith it will work better soon.
Also the Day of the week is in Italian/Spanish.",Keep it Moving,4.0,B0055XBH7W
"Take this for what it's worth, since I sent the product directly to my nephew for his birthday: My 9yo nephew loved the watch.  My sister said it was well-made and he uses daily and keeps it on for his tennis lessons (he's in 2 competitive leagues and it's comfortable for him to play with).  I'm pleased that he was pleased.",Nephew Loved It,5.0,B0058ZV31M
I got it for my nephew's birthday and he loves it.  He has been wearing it religiously since last November. Part of that is his discipline and part of that is his love for this watch.  Money well spent.,My 10 yr old nephew loved it,5.0,B0058ZV31M
It's a fun gift for a child to receive.  It can stand up to hand washing and even a shower.  The 7-year-old can manipulate all the modes and enjoys doing so.  The band is adjustable to fit a child's wrist.  The watch is small enough to look appropriate on his wrist and big enough to read the time easily.,Great watch for kids.,5.0,B0058ZV31M
"It's a great watch for a youngster. It runs well and a seven-year-old can manipulate it the different modes, doesn't have to worry about getting it wet, and likes it.  The band is adjustable.  The watch is big enough to be read easily and small enough to look good on a five to nine year old child.
I'd recommend this to friends for their kids.",This is a watch to please a child.,5.0,B0058ZV31M
There is no written word on the features of this watch enclosed or on the box.  What r its capabilities?  Send me an explanation of this watch so I can tell my 4 grandsons why they will like this Windy watch.,Help!,1.0,B0058ZV31M
Bought this for my 9 year old son and he loves it. Great quality. Exactly what he was looking for.,Great watch for kids,5.0,B0058ZV31M
7 yo son love it.,Five Stars,5.0,B0059URZ5Y
Grandson loves his watch!,Yes,5.0,B0059URZ5Y
I love it,Five Stars,5.0,B0059URZ5Y
Was a gift for my 10 year old nephew. Hope it runs longs.,Four Stars,4.0,B0059URZ5Y
excelente,Five Stars,5.0,B0059URZ5Y
Bought this for my grandson so he would know what time it is when he is in class. He wears  it every day. He is 11 and did all the time settings himself.,Works great,5.0,B0059URZ5Y
Fantastic. My 9-year old son absolutely loves it!,Five Stars,5.0,B0059URZ5Y
Very cheap looking.  Not worth the money.  I am in the process of returning it.,Very cheap looking. Not worth the money. I ...,1.0,B0059URZ5Y
"The watch was good....until it suddenly stopped working, approx. 1 1/2 months after it was purchased. It comes with a 2 yrs. warranty so I hope they can repair it or send me a refund.

Update: Amazon issued a full refund. Happy for the refund, less for the quality of the watch.",The watch was good..,1.0,B0059URZ5Y
"My grandson really is a rough and tumble guy, 10 years old. This watch really holds up. He swims with it, plays ball, never takes it off. Great watch for a boy",Great watch.,5.0,B0059URZ5Y
"Excellent. The 18-year-old who received it and a ""smart watch"" has worn this one more than the ""smart watch."" Smart man.",Excellent. Very cool.,5.0,B005CM7Z7M
have to return  Did not work.,One Star,1.0,B005CM7Z7M
"My 6yr old loves it and wears it. Now he has to learn telling time the old fashioned way, haha",My 6yr old loves it and wears it. Now ...,5.0,B005CM7YR8
Thought this was cute and when I ran across this I bought it to give to my Grandson for his 7th birthday. He loved it because he loves Star Wars and Legos. The watch was a disappointment because the back of the watch fell off immediately with no way to put it back on unless we glued it on permanently and he didn't like that idea. So it sits in a baggie in the junk drawer. So sad.,He loved it because he loves Star Wars and Legos,1.0,B005CM7YR8
"Bought this as a gift for my 5 year old, who is really into the Star Wars movies. He asked for the watch and he will love it . The watch is really nice for the price.",Nice watch for the money.,5.0,B005CM7YR8
"Ordered this for my son and he loved it! It was easy to adjust for his wrist size. It is lightweight which is good as he gets used to wearing a watch for the first time, and he loved that it came with a mini figure!",Great Kids Watch!,5.0,B005CM7YR8
Arrived broken.,One Star,1.0,B005CV7FB4
It works just for one month!,Two Stars,2.0,B005CV7ETW
I really did not expect poor quality so I was unpleasantly surprised when I opened up my package. This is definitely not an item that will take wear and tear and looks cheap. Bought for my kid but returned it. Wouldn't even want to give it away.,Set up for disappointment,2.0,B000Y090LQ
Fell apart in a week,Three Stars,3.0,B005FC09HM
the worst. broke within 24 hours.,dont waste your money,1.0,B005FC09HM
Great product and fast shipping.,Five Stars,5.0,B005FC09K4
"Bought this for my eight-year-old son and he was so excited about it. We were worried that it wasn't water-proof and it was a hard week of trying to remember not to get it wet. The velcro strap was nice, but a bit long for him. We were most disappointed that the face shattered after about a week of wear. He is a busy boy, but obviously the workmanship wasn't great. Liked the design and my son enjoyed the numbers on the side to help him remember how many minutes each number stands for, but had to return it.",Face shattered within a week,2.0,B005FC09K4
This is only water resistant. The band if for kids over 10 or 12. I got it for my 6 year old grandson. Wish it was water proof. He loves to swim and i know the watch will go swimming anyday now.,Nice looking watch,4.0,B005FC09K4
"We bought this watch as a present for our son. Little did we know that it will arrive with a broken face.
Very disappointed.",Disappointed,1.0,B005FC09K4
"My twin boys live and breathe Hot Wheels so this was a ""must have"" for them.  The watch is basic, it would have been nice to have a ""light"" button but was easy to set and the boys love it.  The Hot Wheels metal box it comes with is perfect to pack 9 or 10 Hot Wheels for a long car ride.  I will be buying more for birthday gifts for their friends who have admired it!",Hot Wheels Watch,4.0,B000Y04SG8
Would've been great if the little screws or bolts or whatever they are that attach the strap to the watch face didn't fall out.,fell apart,3.0,B005KD013I
"Excelente producto, todo llego como fue especificado en la venta, en perfecto estado.
La caja llego en perfecto estado, sin ningun tipo de golpe.",Captain America Kids,5.0,B005KD013I
"My son was so excited when it arrived, but we noticed almost immediately that the silver paint around watch face was coming off on our hands.  Returned!",returned it,1.0,B005KD013I
I am not impress with the watch but it has really nice tin packaging and the shield pin looks really cute.,the watch looks cheap but the shield pin looks nice,3.0,B005KD013I
The button on the side messed with the digital display telling the time. My five year old would constantly have to have me fix it so it would display the time and not the date. We forgot to take it off when he went swimming and water filled the display and it broke.,It's Okay,3.0,B005KD013I
"I bought this for my 6 year old son for Christmas. Fits his tiny wrist (he's smaller than your average 6 year old). He loves it! The only complaint I have about it is the settings button is easily pressed, and it frustrates my little guy big time. other than that the watch looks good and it's a great deal for any Captain America Fan! ALSO, the little gift tin it comes in is a great plus!!",My little man loves this!!,4.0,B005KD013I
This was a great gift for my son who is a huge wrestling fan.  He has loved every min. of it since he opened it on christmas morning.,A great gift for a 8yr old,5.0,B005KCZI0A
I bought this watch set to gift my kid. I thought that it will be good quality and kids will love it. I saw the same watch in another merchant showroom and very disappointed with the quality with very little features. The price was also 1/3 of what i paid to Amazon. It is not worth for what I paid to Amazon.,Cheap stuff,1.0,B005KCZI0A
"This blatantly refers to the WWE as the WWF, something it hasn't been known as since, what 2002? Any references to ""WWF"" are typically edited and a ""no no"" due to a lawsuit by the World Wildlife Fund, so I'm calling it as I see it, this 99.99% a cheap, knock-off from China.  Unless Amazon listed this incorrectly, I highly doubt it...",How is this a licensed product? It refers to WWE as WWF!,1.0,B005KCZI0A
"5 stars
I love it, Kiddo loves it.
strap is great, but manufacturers should consider tinier hands, the minimum (i mean the part of the strap that should bend around the wrist for adjustment) was a little big for my slim 3 year old (37 pounds).
i was not too happy then to review when i bought it 10 months ago, now he is almost 4, it is the perfect wristwatch for him.
Don't get it twisted, any age (10 year) can were this watch, the band is .much.
i will recommend",5 star.,5.0,B005OVBN4M
The watch strap broke after a week! Obviously not made for kids. Disappointed even though the little boy loved it.,Not well made to last.,2.0,B005OVBN4M
I got this for my 6 year old but his wrists are a bit  small for it-will pull it out again in a few months,a little big,4.0,B005OVBN4M
my son is really happy to get it.his happiness is my satisfaction.it looks beautiful.but i am little bit critical about the band.they could improve the band.,love it.,4.0,B005OVC6KW
Exactly what I needed. Good seller,Good,5.0,B005OVBJ0U
I bought this for my grandson but he is a little young (2 years old) for a real watch and this is a teaching how to tell time watch. I'm saving it till he gets older.,I bought this for my grandson but he is a ...,5.0,B005OVBS2O
Bought as a gift.,Five Stars,5.0,B005OVBS2O
I bought this for my son for his 4th birthday because he loves Mickey Mouse.  It's perfect for a little one.  Of course he can't tell time but I like that the minute hand says minute and the hour hand says hour but I guess your little one would have to be able to read those words first in order for it to make sense.  At any rate it looks nice and the price is right.,love,4.0,B005OVBS2O
My son loves the watch but the band is rather cheap for a young child and has a lot of potential for the band to come undone and losing the watch.  Band is only velcro - would not recommend if child is young and active.,Nice quality watch but band could be better,3.0,B005OVBDJC
"Very disappointed! We bought this for our 5 year old son for Christmas and it showed up broken. The minute hand was loose but it would engage when he went to set the time. After setting the time it would get stuck on the hour hand and become loose again. Besides that the velcro band is very bulky, hard to put on a smaller size, and felt itchy to my son. Returned this watch and are buying one with a nylon strap and staying away from the velcro. I do not recommend. I do however love the face on this much better than the one that we got. I wish they sold this face plate with a nylon band.",Very disappointed. Watch was broke and velcro was bulky.,1.0,B005OVBP5O
My son loves this and wears it everyday.  We've had it a long time and it still looks and works great.  Very nice kid's watch.  Allows him to practice time-telling also.,Highly recommend.,5.0,B005OVBP5O
"The crystal broke within 6 months of wear.  Only the movement is covered by the 1 year (limited) warranty, so now I must find someone to replace the crystal or just replace the watch.

My 3 year old loved his Mickey Mouse watch.  It was the best when he received it...up until the crystal broke.  Since it is designed for kids 3+ you would think it would last a little or, a lot, longer.  Disappointing.",Broken crystal,3.0,B005OVBP5O
This is a great watch but my 4 year old daughter does not like to keep it on so it will be stored for a later time.,Great Watch,4.0,B005OVBP5O
"Bought it for a 5 year old and he loves his ""arm clock"" - works fine, happy grandson!  What more could you want?",Great Kids Watch,5.0,B005OVBP5O
"it arrivied on time,plus it was exactly as advertised.my grand daughter loved it and has kept it on since receiving it.",wonderful,5.0,B005OVBP5O
My son loves this watch.  It fits a 2.5 year old without falling off and they can take it off on their own if they need to.,My son loves this watch. It fits a 2 ...,5.0,B005OVBWLQ
Got this for my grandson for our trip to Disney land and he loved it. It fit him with lots of room to grow.,watch,5.0,B005OVBWLQ
Very nice. I m very satisfied!!! Thank you very much.,Five Stars,5.0,B005OVF8SE
excellent,Five Stars,5.0,B005OVF8SE
Gorgeous! My nephew loves it.,Five Stars,5.0,B005OVF8SE
My child wore this watch for only a month and the minute hand is broken.  It does not keep the right time.  Save your money on this one!,My child wore this watch for only a month and ...,1.0,B005OVF8SE
"Sturdy, easy to read, and fully adjustable. I bought this watch specifically for the velcro strap. Not only does it adjust more finely than the ones with the tab slots, but it gives my Sensory Processing Disorder child something to touch. The soft side of the loop is the perfect ""de-stressing"" texture.",Velcro - perfect for small child watch adjustment,5.0,B005OVF8SE
NOT EASY FOR A CHILD TO READ. Boo to disney.,Three Stars,3.0,B005OVF8SE
"Great condition, very cute watch.",I love it,5.0,B005OVF8SE
Excellent for movie fans,Five Stars,5.0,B005OVF8SE
Great item,Five Stars,5.0,B005OVF8SE
Well made product and my son loves it. It has him more interested in learning how to tell time and I'll likely buy another for our younger son.,Not Cheap,4.0,B005OVF8SE
My grandson loved it!,Five Stars,5.0,B005OVDXHM
This was purchased for our 5 1/2 year old ring bearer at our wedding. He has always called me Buzz and this seemed appropriate. The wedding was 10 days ago and he hasn't taken it off!  Best gift I've ever given!,The boy loves it!,5.0,B005OVDXHM
"I really loved this watch when we first got it.  It was a great tool to teach my son how to tell time but the manufacturer description leaves out a very important detail:  YOU CAN'T REPLACE THE BATTERY.  When this watch dies, its done.  $25-$35 is a lot of money to spend on a watch that will last 6 months to a year.",I really loved this watch when we first got it,2.0,B005OVDXHM
Great quality watch. My grandkids have all gotten these watches in their favorite character for their birthday and they are durable and easy  to teach time on.,Good kids watch,5.0,B005OVDXHM
"It can also be to look at, but manufacturing is not so good, because the cause of the cut","but manufacturing is not so good, because the cause of the",3.0,B005OVDXHM
Awesome watch. 3 year old loves it,Five Stars,5.0,B005OVDXHM
"Our four-year old grandson loves it! Durable, attractive, and comfortable.
It arrived exactly as described and in a timely manner.",Buzz to the Rescue!,5.0,B005OVDXHM
"Great teaching tool. Could not be more pleased with purchase and my nephew loved it, did not ebem know he was getting ready to be taught..for a 3yr old..such a plus!",Great Deal for quality teaching tool!,5.0,B005OVDXHM
Christmas gift for my Great-niece-she LOVED it :) <3 :),Who doesn't love Mickey,5.0,B005OVBGFS
Disney Kids w000006  Mickey watch My son loves it does not take it off and thanks to the watch he is learning to tell time thank you Leo,My sons watch,5.0,B005OVBGFS
I was very happy with the watch. The price was good and it was here in a couple of days.,Happy with Mickey watch,5.0,B005OVBGFS
"I bought this for my 2 year old grandson.  He loves it and has figured out how to put it on and off, now we just have to work on telling time.",I bought this for my 2 year old grandson. ...,5.0,B005OVF6UE
"The watch is okay, just hard to get the child to wear it.",Four Stars,4.0,B005OVF6UE
The band is cheaply made and won't last long.,Two Stars,2.0,B005OVF6UE
"I was a little nervous when I read the reviews about this being extremely small. My son is 7 and not petite.  The watch fit him fine, with room for growth.  For comfort, before his first use, I fit it around a bottle for a few days to get the band bent into a wrist form - that seemed to work well. My only complaint is that the dial spins fairly easily so it usually isn't in the correct spot to help him tell time. Overall, super cute, would definitely recommend.","Nice watch, cute design",4.0,B005OVF6UE
"This kid watches of great quality, all numbers are visible for kids without any problems. It has comfortable fit. Best choice for the first watch and for learning time.",great for kids,5.0,B005OVF6UE
The watch was a little smaller than I thought. My nephew is 5 and it barely fit around his wrist so he might not get much use out of it.,Smaller than I thought,3.0,B005OVF6UE
"It was for a gift, my relative's little boy love it.",my relative's little boy love it.,4.0,B005OVH4N6
Great quality product. Perfect for the Toy Story fan.,Five Stars,5.0,B005OVE6ZK
"Bought it for my 5 year old.  It is easy for him to put on, since it is velcro.  He loves to wear it each day to school.",Great kid's watch,5.0,B005OVE6ZK
"This watch made my son so happy for his 7th birthday. He loves trying to tell the time with it. The labeled hands, and the numbers for the minutes are great. The velcro band is nice because we can size it to his tiny wrist perfectly.",This watch made my son so happy for his 7th birthday,5.0,B005OVE6ZK
"This is a fine, working timepiece and my grandson loves it. The only complaint I have is that the crystal came off exposing the face and hands.  This was after a year of use. He is 8 and is on The Spectrum so he gave it a tough workout I am sure.  This review is actually for the original watch. I have ordered and received a replacement.",Not a Toy,4.0,B005OVE6ZK
I bought this for my 3 1/2 yo for Christmas.  He loves it!  I thought the quality was really nice for a child's watch.,great for small kids,5.0,B005OVE6ZK
My son loves Toy Story he received this a gift for Xmas and he really likes wearing this watch very much.,Xmas Gift,5.0,B005OVE6ZK
Purchased as a Xmas gift. Love it. The only problem was the battery died a few weeks after using. But watch is nice.,Love it. The only problem was the battery died ...,5.0,B005OVH7OM
"The lettering on the hands of this watch is so tiny you are unable to read it, which is the whole point of it being a ""time teacher watch.""  The numbering and words on this watch certainly need to be enlarged!  I am going to return this watch for this reason.",Time Teacher Watch,2.0,B005OVH7OM
Bought this for my 5 year old grandson. He loved it.,Nice watch,5.0,B005OVFDDY
