reviewText,summary,rating,asin
"A very nice dress, especially for the price! It was a couple of inches too long so we had it altered. That's to be expected with these types of dresses though. I'm glad I ordered the 10 because the 8 would've been too tight around her waist. She absolutely loves her dress!",Great dress!,4.0,B000MC1NWK
My daughter love it,Four Stars,4.0,B000MC1NWK
Fit perfect. Follow the size chart.,Five Stars,5.0,B000MC1NWK
my Daughter loved this dress!,Good Quality!,5.0,B000MC1NWK
this dress fits my daughter a little big but she's loved it and was very happy with it.,... dress fits my daughter a little big but she's loved it and was very happy with it,4.0,B000MC1NWK
"We ordered this dress for my daughter's first communion.  It came on time.  It was larger than expected so we had to have it take in and shortened, but the fabric is beautiful and it came well packed and not wrinkled.  She loves it and looked so beautiful for her first communion.  She was the only one who had a floor length dress and got LOTS of compliments on it.  She felt beautiful and special on her special day!  Would totally recommend this dress for a flower girl or minature bride as well.",Beautiful dress at a great price!,5.0,B000MC1NWK
Beautiful in the pictures and beautiful in person.  Excellent for the price. It's a long dress. Not ankle length. Love it!,Love love love,5.0,B000MC1NWK
"I bought this dress for my daughter's elementary school graduation ceremony. She looks like a princess in this soft baby pink satiny creation.  Please, take you time and measure your child. I ordered  a size 10 for my 11 year old and it fits her well.  As a bonus it came with a set of colorful headbands.  Quality and price for this dress are unbeatable.",My daughter's dress.,5.0,B000MC1NWK
"The picture doesn't show the true color of the shade of pink, it is more of a cotton candy pink. This dress is so cute on and not to heavy to be uncomfortable. Hangs well and flows well. The waist is more true to size compared to some of the other tapered dresses I ordered, so it fits true to size for a 8-10 year old child. Very pleased with my purchase.",CUTE!!,5.0,B000MC1NWK
I got this dress for my daughter to be a flowergirl at my wedding and the fabric is lovely and not too cheap looking the dress had to be altered to fit her though as is was just too long.  I washed it afterwards and it cleaned in my washing machine very well.,Nice for a wedding,4.0,B000MC1NWK
If in doubt get a size up but this is a princess perfect dress. It falls nicely to the floor.,Beautiful,5.0,B000MC1NWK
Fast shipping and excellent dress. Material is definitely expensive looking. Daughter loved it and can't wait to wear it at a relatives wedding,Gorgeous,5.0,B000MC1NWK
"Perfect fit and my daughter is so excited to wear this on her special day!  It came quickly, was a good price, and it made my daughter so happy!",Perfect,5.0,B000MC1NWK
Very very nice dress. My daughter likes it very much. Nice color. Floor-Length. Good quality. Very lovely flower brooch. Recommended.,5 stars dress for the girl,5.0,B000MC1NWK
"My Granddaugther was so so beautiful in this dress it was like the dress was made for her .
  The dress did not need any alterations it was tapered so well in the waist she a small girl she,
wear's a size 8 she looked as beautiful as a princess ,Words can not expexpress  the material of the
 dresss was just beautiful. I recommend  this dress for wedding etc. job well done on this dress. and
I receive the dress on time with no problems my granddaughter and my family were very pleased !!!!!!!!!!!!!!!!!",OUTSTANDING !!!!!!!!!!!!!!!!!!!!!!!!!!!,5.0,B000MC1NWK
"I purchased this dress for my 7 year old daughter for her first communion this year.  She LOVES it!!!  It was delivered extremely quickly by this seller even though I don't think it qualified for Amazon Prime.  Excellent dress for the price.  Material is nice and comfortable.  It does not look cheap!  I love that it is somewhat understated without too many ""bells and whistles"".  We will probably leave the flowers pin off--it does seem to make it a bit gaudy/cheap looking for us, but, that is a personal preference for us.  We find that most of these dresses come with some ""fluff"" of some sort no matter the price point.

I would also mention that it was so nice to find this in a size 6!  My daughter is very tiny for her age and the size 6 was difficult to come by.  Her biggest request was that her dress be floor length and this one is!  I was worried it might be too long for her, but, it should be perfect.  Her shoes have a tiny bit of heel, so, I'm thinking this dress will look just right!

My daughter is pleased as punch!!!",We are loving this dress!,5.0,B000MC1NWK
Awesome dress ! My daughter will wear it for her 1st Communion great fabric good quality. Make sure you measure before ordering. FYI looks better with additional peticoat !!,Gorgeous white dress,5.0,B000MC1NWK
"We ordered 2 different sizes for a flower girl dress, and they were adorable!  We were looking at a similar one for $144! Shipping was quick, we sent one back w/out any problem.  VERY SATISIFIED and would highly recommend this dress for the quality and price!",GREAT SURPRISE!!,5.0,B000MOOJCY
I bought size 2 for my almost 4 year old based on their size chart and the fit was perfect. Dress is beautiful and very well made.,Size was perfect,5.0,B000MOOJCY
"Beautiful!  Great Quality, better looking even than the picture. shipped quickly and packaged nice.  would recommend to anyone that is looking for a special dress.",Wonderful dress,5.0,B000MOOJCY
"This was a very pretty dress, but I had to return as it was too ivory for my needs.  Good quality",Great dress for the price!,4.0,B000MOOJCY
"The dress was really pretty, however the ivory has too much yellow and the sequins around the flower were pink. Unfortunately i had to return it as it was for a first communion, but I would recommend this dress.",Beautiful Dress,4.0,B000MOOJCY
The material is soft and the dress is well made.  I had to have it steamed to get the wrinkles out that shipping caused but it looks so pretty.,Great flower girl dress,5.0,B000MOOJCY
"I was skeptical ordering this online but this dress is beautiful and fits great.  My god-daughter picked it out, so she gets all the credit.  Would definitly order again.",very pretty,5.0,B000MOOJCY
I searched all over for a similiar style dress to use for my flower girl and all of them are over $100. This dress is perfect and inexpensive!,Beautiful and good quality!,5.0,B000MOOJCY
I am pleased with this dress. When i took it out of the bag for my granddaughter to try on I was concerned that it would be wrinkled. But it was not. and the fit is perfect.,Princes @ a wedding,5.0,B000MOOJCY
This was a wonderful selection for my granddaughter as a flower girl. She loved the 'twirl' factor and its elegance was matched by its simplicity. Not to mention that the price was right!,Fabulous Flower Girl!,5.0,B000MOOJCY
"I have been searching for months to find a First Communion dress for my daughter. I didn't want something to frilly and break the bank. This is a very pretty dress and looks great on my daughter.  She is right about a 6x and seven. I ordered the six because I read other reviews about it running large. It fits nice and has enough room in case she grows a bit before her big day, but isn't too big where we have to make adjustments. Very happy with this purchase.

  We took the flower off and are going to put it somewhere else on the dress. Looks good with out without it.

The dress also shipped very quickly.",Great for the price!,5.0,B000MOOJCY
"Lovely dress! Super fast shipping and great care in creating this dress! My niece absolutely loves this dress and my cousin, the bride, does too!",flower girl dress,5.0,B000MOOJCY
"This dress is so beautiful!  It is not your typical communion dress, which is what we wanted - it is very sophisticated and does not have that ""too much like a wedding dress"" look.  That being said my daughter wore this dress for the first time at church last Tuesday night for her class picture for her communion....she had it on less than an hour, in that time, the silk flower fell off of the pin it was attached to and came completely apart (yes the flower is missing in her picture) my daughter was so embarrassed  and upset she thought her dress was ruined but I used hot glue gun on all the layers of the flower and re attached the flower to the pin.  The beautiful band around the waist is coming apart and falling off the dress....yes, it is unraveling and the pearls are starting to fall off. I do know that I paid less than $50 for the dress, but Amazon had the best price, other websites had the same dress priced at well over $100....needles s to say I am ecstatic I didn't pay a lot  for it....I am sooooooo saddened and disappointed by the quality of this dress although I did purchase this dress a few months ago, it has been hanging in our closet up until last Tuesday night, when she had her pictures taken.  I just hopes it makes it through Mass and dinner which is next weekend....",Beautiful but.....,3.0,B000MOOJCY
This dress is so adorable!  I bought it for my Daughter's first communion.  The waistline with the sequins and flower are beautiful.  Very nice fabric and well constructed.,So Beautiful!,5.0,B000MOOJCY
"This dress was very cute, but it runs a little large.  I ordered a 10 for my daughter and it was a little loose on her.  She planned on wearing it to a wedding but we just saved it for Christmas instead!  Very nice though!",Cute,4.0,B000MOOJCY
"True to picture, my daughter hasn't worn it yet but she has tried it on and its great, I got a sz 2T my daughter isn't quite 2 yet so there is a little space to grow, so i'd say its true to its sz. I thought it was also a reasonable price. Very happy!!",Very cute!,5.0,B000MOOJCY
I thought this dress was beautiful on line but I fell in love with it even more once I got it.  I bought this in black for my step-daughter to wear in our wedding (age 7) and she loved it. Very classic and sophisicated style yet absolutely perfect for a young girl.,Beautiful!,5.0,B000MOOJCY
"I found these dresses on-line and I knew they were perfect for my future step-daughters as my flower girls.  I got a little scare because one of the dresses arrived the day before the wedding.  HOWEVER, when I saw the girls in the dresses, all of the anxiety of the late arrival faded away.

Seller was excellent to work with to ensure that dress would arrive on time.  HIGHLY RECOMMEND THIS ITEM AND THE SELLER!",Beautiful Flower Girl Dresses!,5.0,B000MOOJCY
"The dress was just georgous and a great buy.  My only disappointment was when the dress is caught in the sun the clear sequins are very pink looking.  I enquired about this before buying and was assured the crystals were clear which they are they just show a pink with exposure to sunlight.  But the communication and the dress are georgous.
Thank you",Organza Dress,5.0,B000MOOJCY
"Seller got this to us very fast. WE need it for our wedding and it all worked out perfectly... Allowing my Fiance to be stress free about atleast one thing involving the wedding.

Thanks!",Thanks,5.0,B000MOOJCY
"this dress is very lovely on my daughter, I prefer short sleeves however and not sleeveless but it is fabulous for the price...",Very beautiful dress,5.0,B000MOOJCY
"Muy buen producto, llego en perfecto estado a Venezuela buena tela, corte y costura, mas de lo que esperaba recomendado",Tiernas,5.0,B000OQL8DI
"As always, Hanes great quality is something I can count on in every purchase. The colors and prints in this pack are very pretty.",Great quality!,5.0,B000OQL8DI
"I never saw the products, it was sent right to the Victims.... but I am sure it is a great product",Donation to Hurricane Sandy,5.0,B000OQL8DI
My daughter loves these.  They have a nice fit and don't ride up.  The prints and colors are very cute.,"Good fit, cute prints",5.0,B000OQL8DI
"Shipped very well  the unit works very good
Unit as described on the money works very good
thank you
rfriedman",AAAA,5.0,B000OQL8DI
"My daughter stubbornly resists the move to ""junior"" style panties (too small, rides up, too skimpy, etc.).  She's worn Hanes panties most her life and even though she's a teen, she still prefers the comfort of these panties.  She wears a juniors medium in other brands and these Hanes Hipsters in size 16 fit comfortably (a little loose, no rubbing at the leg openings).  They land below her belly button in front, but give full coverage in back.  The cotton is soft and they don't shrink.","Perfect for my ""big"" girl",5.0,B000OQL8DI
These are decent cotton panties but seem a little cheap. Hanes had some others I liked better but cannot find them...these will do just fine.,Decent girls panties,3.0,B000OQL8DI
"My daughter already had the 2t/3t size of these underwear. They are fine quality for the price, and especially great for little ones who go through a lot of underwear. I ordered the next size up, the 4t, since she is growing out of her others. I should have listened to reviews that they are small!! The 4t are hardly bigger than the 2t/3t size, when I hold them together they are maybe 1/2 cm wider at the waistband. They fit her just the same as the smaller size does. Waste of money considering I still need to buy her bigger underwear!",Small!,3.0,B000OQL8DI
Good value for the money. Seems we never have enough clean underwear so its nice to get several pair at a good price. The colors and designs in this pack were fun for an older girl.,Good value,5.0,B000OQL8DI
Little bit loves them,Five Stars,5.0,B000OQL8DI
Comfortable - love these!!!!,Five Stars,5.0,B000OQL8DI
Good price cute good quality for the price,Five Stars,5.0,B000OQL8DI
Great! They came and were just as we expected them. It saved us a trip to the store.,Five Stars,5.0,B000OQL8DI
Got this for my 11 year old daughter and she loves it. She says it's comfortable and not tight at the waist.,She says it's comfortable and not tight at the waist,4.0,B000OQL8DI
There good..,Four Stars,4.0,B000OQL8DI
buen producto excelente,Five Stars,5.0,B000OQL8DI
Great value. 9 pair total. Quality & quantity matched with great fit,Super Nice fit,5.0,B000OQL8DI
"a gift so I'm guessing on the size.  They're stretchy, so the size is probably close to being exact.  The colors are attractive, good for anyone who likes color in their undies. Fabric is average thickness for undergarments.",good for anyone who likes color in their undies,5.0,B000OQL8DI
a little cheepishly made but good for everyday wear,Four Stars,4.0,B000OQL8DI
She loves them!,Five Stars,5.0,B000OQL8DI
"Average quality, nothing special.",Three Stars,3.0,B000OQL8DI
good value,Five Stars,5.0,B000OQL8DI
Good Fit,Five Stars,5.0,B000OQL8DI
Bought for my 9 yr old daughter and she loves them.  Super comfy.  Highly recommend.,Super comfy. Highly recommend,5.0,B000OQL8DI
Very good product price is very satisfied,Five Stars,5.0,B000OQL8DI
"My baby girl needed new undergarments. She is a little on the ""big boned"" side. So even though she wants Disney princesses, on her undergarments.... She just does not usually get to partake in those designs anymore. I saw this pack and thought... they are ""Cute Enough"". I was wrong, they are absolutely adorable and my daughter LOVES them. They are true to size and we have had zero issues with wear and tear, or shrinkage from  the wash. Will totally buy these again when she is ready for a new pack. :) My only complaint is they donot come in Mommy size.",they are absolutely adorable and my daughter LOVES them,5.0,B000OQL8DI
Fits my daughter perfectly.,Five Stars,5.0,B000OQL8DI
"Nice bright colours.
But quality is a bit poor. Esp the elastic waistband.",Three Stars,3.0,B000OQL8DI
As expected,Five Stars,5.0,B000OQL8DI
"My girls are very picky with their underwear ""fit"". These are the best brand and with no tags. My girls are 7 & 9 and they both wear a size 8. They are hipsters, so they cover the ""cheeks"" and aren't high waisted...just right! They tend not to shrink like some brands. Highly recommend for those picky little girls!",Perfect Undies for those picky girls! Covers the cheeks :),5.0,B000OQL8DI
My daughter loves them...thanks!,Five Stars,5.0,B000OQL8DI
A little small but the price is reasonable,Four Stars,4.0,B000OQL8DI
Arrived on time and were as described.,Five Stars,5.0,B000OQL8DI
The product came looking like it was a return and not in product packaging. The underwear are unrolled too. My girls are disappointed there are no prints and all solid colors unlike the product photo shown above.,The product came looking like it was a return and not in product packaging,3.0,B000OQL8DI
Good fit,Four Stars,4.0,B000OQL8DI
good,Five Stars,5.0,B000OQL8DI
Wore and held up just fine,Five Stars,5.0,B000OQL8DI
Completely different colors and patterns. Im disappointed but not enough to return. But they definitely give out the less flattering patterns that probably didn't sell in stores,Not as pictured,2.0,B000OQL8DI
"Another quality product from Hanes! Good fit, nice print, soft cotton construction and comfort. They launder beautifully and a great price to boot.",Hanes up!,5.0,B000OQL8DI
"I bought these for my granddaughter, hope that they will wash well.",Seem to be sturdy,5.0,B000OQL8DI
Bought for Days for Girls kits. Good value.,Good value.,5.0,B000OQL8DI
"Just a tad bit small, but it worked. Amazing quality.",Amazing quality.,3.0,B000OQL8DI
"Medium was the perfect fit for my 7yo who is approximately 55 pounds, long and lean.  Great price!",Great buy!,5.0,B000OQL8DI
Beautiful and bright colors. Very comfortable too.,Love it!,5.0,B000OQL8DI
Excelente,Five Stars,5.0,B000OQL8DI
"We have the dress in a size 8 for my oldest daughter.  It is her favorite dress and she wants to wear it for every occasion.  The workmanship is exceptional and the price is even better!  The best part, it is Made in the USA!",Magical!,5.0,B000PJYLM4
all I can say is this was a perfect dress for my granddaughter the quality of the dress was beautiful and she was beautiful will order from this company again,all I can say is this was a perfect dress for my granddaughter the quality of the dress ...,5.0,B000PJYLM4
I bought this dress for my daughter for my up-and-coming wedding it fits like a dream she absolutely loves it.,... for my daughter for my up-and-coming wedding it fits like a dream she absolutely loves it,5.0,B000PJYLM4
Ordered the 2 for a 2T - she normally wears a 3T to 4T now and the dress was really long. There were some clean up items that could have been done before shipping but over all very satisfied with the dress. I arrived ahead of expected schedule when I paid for expedited shipping which made me very happy as I waited too long to order the dress.,There were some clean up items that could have been done before shipping but over all very satisfied with the dress,4.0,B000PJYLM4
This dress is absolutely gorgeous! The material is very nice and comfortable to wear. There is very small pearl beading on the top. Some of the beads came off but still the top look great. Kids are rough even when all dressed up. The dress held up well.,Couldn't be happier!,4.0,B000PJYLM4
Beautiful high quality dress,Five Stars,5.0,B000PJYLM4
BEAUTIFUL bright white dresses!,Five Stars,5.0,B000PJYLM4
"Loved this dress! I bought this for my niece, who was my flower girl, and it was perfect. She looked beautiful in it and she LOVED wearing it. Fast delivery and great packaging",Loved this dress,5.0,B000PJYLM4
This dress was comically small. I ordered the size for a tall 4 year old based on the size chart. What came wouldn't fit a one year old,Comically small,1.0,B000PJYLM4
"DO NOT BUY FROM E-LOVELY!!
I first bought two pink ones size 1 and 8 for my daughter's birthday... The dress was little on the larger size but is so very beautiful and verywell made, the shipment was from KID collection..we got a lot of compliments about the dress on her birthday..
So Latee I ordered another size 8 blue one for my daughter's best friend for her birthday.. The shipment took about a month to arrive and it came from e-lovely from I think... I just opened the package on her Birthday to gift pack it, just to realize it was so cheaply made.. The size was much smaller than what my daughter has...also the zipper at the back is broken!! Totally annoyed that I had to look for another last minute gift for the child and also my daughter was terribly upset. I contacted the company on Amazon last week about the damaged product, no response.. Have sent another one today and awaiting... Let see! So so disappointed!",The dress was little on the larger size but is so very beautiful and verywell made,1.0,B000PJYLM4
"Dress is larger than expected but is great value for money.  The lace appliqu was not sewn on properly, I was able to sew it myself, for $20 this was not a big deal for me. Really pretty. It also had a zipper in the back not button up like on the description.",Dress is larger than expected but is great value for money,4.0,B000PJYLM4
Fantastic quality for price,Five Stars,5.0,B000PJYLM4
"Some beads fell off, the beads needs to be secured properly",Three Stars,3.0,B000PJYLM4
BEAUTIFUL!! This dress is even prettier in person. My daughter word it for her senior kindergarten graduation and it was a big hit!,Exceptional dress,5.0,B000PJYLM4
Love this! So cute.  True to size.  Delivery came on time.  Just needs ironed & I added a tulle slip to make it a bit more full.,Adorable!,5.0,B000PJYLM4
This dress made my flower girl look so adorable and elegant! She was so comfortable and danced the night away!,Perfect!,5.0,B000PJYLM4
Beautiful dress for first communion.  Loved it!,great dress!,5.0,B000PJYLM4
"My daughters were flower girls in a wedding and the bride requested pink dresses.  After searching and sifting through countless options, we settled on this one.  We were not disappointed. The dresses looked and fit beautifully!",We were not disappointed. The dresses looked and fit beautifully,5.0,B000PJYLM4
Looked wonderful for my daughter's first holy communion! Fit her perfectly.,Perfect for first holy communion,5.0,B000PJYLM4
Beautiful! Pleased with this! How it is cheaply priced I don't know how!,Five Stars,5.0,B000PJYLM4
My daughter is 7 yrs. and she wears a size 7. But I bought this dress in a size 8 and when I went to button it up it was snug so I would buy the next size up ladies for your girls. My daughter weights around 53 lbs. too.,My daughter is 7 yrs. and she wears a ...,4.0,B000PJYLM4
"I gave the product 2 stars because the fit was off and quality wasn't up to my expectations.

Our needs: My daughter needed a white or ivory dress for her stint as a flower girl. She is 4.5 years old, and is petite and slim to regular build. She typically fits 4T We wanted a pretty dress that would be comfortable enough to wear during the wedding/reception but not too expensive considering the one time use.

I purchased several dresses online. The design is very princess like but it did not look very nice on my daughter. I ordered a size 4 having the expectation is would be too large based on the info in the size chart. I purchased this size because the size 4 had free returns while the size 2 did not. The dress fit across her shoulders but was very big in the chest and waist and was too long. Because it was too big, it hit more towards her lower calf and dropped the waist down.  In addition, the quality in the material/sewing was not good around the button holes. Threads were loose so when I undid the buttons, it got caught in the threads. This happened with several buttons.

In the end, I am returning because of the fit and quality. I am not going to order the size 2 because I have another dress that we purchased that looks much better and is within our price range.",Pretty but fits large and issues with buttonholes,2.0,B000PJYLM4
Beautiful dress. So glad I bought it.,Five Stars,5.0,B000PJYLM4
See through must buy a slip,Three Stars,3.0,B000PJYLM4
Loved it,Five Stars,5.0,B000PJYLM4
Very pretty!,Five Stars,5.0,B000PJYLM4
beautiful,Five Stars,5.0,B000PJYLM4
"Gorgeous dress for my little girl, we will be using it as a flower girl dress. Good fit, good quality. The color is a very light pink, as shown in the picture.",Great dress,5.0,B000PJYLM4
granddaughter (8) looks beautiful in the dress.  Fits perfectly.  She is average size.,Five Stars,5.0,B000PJYLM4
"My 7 year old daughter wears 7/8 size.  I knew the size 6 would probably be too small so we went for the 8.  It is a little big on her but I expected that.  However, it was not too big that she cant wear it since you could adjust the bow.  She loved it and will be wearing it for her first communion. It is a little see through with the right lighting but not as bad as others we tried on.  Great dress! Great price!",It is a keeper.,4.0,B000PJYLM4
I love!!perfect ivory dress for my flower girl! :),Absolutely adore!,5.0,B000PJYLM4
So elegant,Four Stars,4.0,B000PJYLM4
"Beautiful dress for our granddaughter's First Communion.  She is very petite, mainly in her chest and waist area.  She normally wears a size 5 dress and size 6 slim pants and 6 shirts.  Because the dress measurements listed referred to waist and chest sizes I ordered a size 4.  Her waist and chest measured was 21""
Having to order a size 4, the dress is a little shorter than I thought.  Still below her knees but not tea length. With her measurements I may need to adjust the dress only by moving the buttons over slightly.  The buttons on the back of the dress are beautiful and she is completely in love with it.",Beautiful dress for our little princess,5.0,B000PJYLM4
