reviewText,summary,rating,asin
"I expected these to be smaller than normal. However, they were just fine. I like the loose fit and I am very comfortable in them.",Fit as expected,4.0,B0002A4JZA
The only problem is I think they run just a little smaller than other athletic shorts in the size small.,Athletic shorts,3.0,B0002A4JZA
"These tights are exactly what they are supposed to be.  I've washed them and she's danced in them half a dozen times and they have held up well..no runs or pulls. I do not know how they would be for heavy use (like someone who dances every day) which is why I gave 4 stars instead of 5. My daughter is a size 10 in most clothes and these fit perfectly as long as I stretch them as I'm pulling them up.

My daughter doesn't like these tights because she said they make her legs itch and ""prickle"" when she's dancing and getting hot, but that is my daughter and not the product.  I mention this in case you have a child who has sensitive skin, or suffers from skin rashes like eczema.  They may not like the feel of these as they are not soft like a microfiber.",They do what I want them to do!,4.0,B0002QVAAG
"nice tights....easy for a 7yo to put on...have a shimmer to them which hannah really likes,,,,I would prefer no shimmer",ballet tights,4.0,B0002QVAAG
"I recommend purchase. They fit pretty well. Light toast (which I ordered) was more like - dark suntan, so only complaint was that it was a bit darker than the picture.",Mostly as expected,4.0,B0002QVAAG
"I was looking forward to sturdier-than-usual tights, and they seemed tough, but our 2-year-old daughter had a hole on the back of her knee within the first hour (and we were at a wedding, so it's not like she was climbing around . . .). Disappointing, particularly for the price.",Ripped in the first hour,3.0,B0002QVAAG
These tights fit my 3 year old daughter perfectly and they are adorable!  I bought them for ballet.  My daughter is a bit rough and tumble and has already taken a couple of spills in these tights and the tights still look as good as new!,Durable and adorable,5.0,B0002QVAAG
Product arrived quickly.  These were tights for my grand daughter for Easter.  We opened the package on Easter morning and went to put the tights on.  Unfortunately there was a hole in the crotch.  She had to wear them anyway and throughout the day the hole got bigger.  I spent much more on these tights hoping they would be long lasting.  What a waste of money!,hole in crotch!,1.0,B0002QVAAG
"These tights are all I expected and more.  They are very shiny and pure white.  They are thick just as dance tights should be.  My daughter wore them for Easter and will be using them for her dance show in a few weeks.

They are pretty true to size as well.  She is a size 5 and they fit with some room left for height.",Stunning,5.0,B0002QVAAG
"My daughter wears these shimmery tights to ballet classes and they are pretty much perfect. They wash well, look great and are the perfect density - not too thin and not too thick. The sheen on the tights is just right. I'm going to be purchasing more in the next size up as well.",best tights,5.0,B0002QVAAG
"Great tights, good fit, great price.  Somewhat sheer and have a slight sparkle.  Our five-year loves them and will use for her dance review. Her classmates loved the sparkle.",Excellent tights for girls,4.0,B0002QVAAG
Nice thick fabric.  It was a different color pink than her leotard but it will work with her black one.,Nice thick fabric,4.0,B0002QVAAG
They are good quality but a little smaller than expected. About 1/2 - 1 size smaller,Three Stars,3.0,B0002QVAAG
Fit my 6 year old perfectly. This was a last minute order. So fortunate that the fit was just right!!!,So Perfect,5.0,B0002QVAAG
Great quality!,Five Stars,5.0,B0002QVAAG
"Reminded me of ""old nurses stocking"" , shiney , looks like support stockings, not the tights i am use to seeing for young girls. Fit slightly short, and lots of spandex,  hsrd to pull on.",SO SO ITEM,3.0,B0002QVAAG
"Great pair of tights and I believe the quality is there, especially for the price. Our pair just had a hole in the seam in the crotch area. We had no choice but to wear them as I didn't my open them until right when we needed them, don't believe I am able to return/exchange now.

My daughter is wearing the T 2/4 size. She is 3 and very petite. She wears size 2t pants. There is still room to grow.","Worth the buy, check them out before wearing :)",3.0,B0002QVAAG
great,Four Stars,4.0,B0002QVAAG
"The foot and ankle portion is so incredibly wide and awkward looking. It bunches up. Unable to wear. I really like the color, though. Disappointed that we cannot use.",I really like the color,1.0,B0002QVAAG
"I bought these for my 3yr old ballet star. She is a typical 3 yr old, very rough, on her knees, crawling a lot. These tights have held up for last 3 months and still look brand new.",Great quality,5.0,B0002QVAAG
"Very sturdy and durable for my 3 year old! Lasted all the way through a wedding, half of the time with her shoes off!",Good quality,5.0,B0002QVAAG
grand daughter loved them tho,Five Stars,5.0,B0002QVAAG
Nice and Shimmery! Perfect for Dance Recital.,Four Stars,4.0,B0002QVAAG
"I have bought several pairs of these tights in the past year, and bought a pair of pink and tan to tuck away for my daughter's dance recital.  I have had pairs that washed and held up well through many washings, and a few that I had to toss after a few times because they got a run very quickly.  I just pulled out a brand new pair yesterday for dress rehearsal.  The pink pair ripped RIGHT OUT OF THE PACKAGE.  The manufacturing of these tights are inconsistent.  I won't buy them again.",Inconsistent manufacture,1.0,B0002QVAAG
Fit and looked great for her dance recital!,Five Stars,5.0,B0002QVAAG
"I order the 4/6 but the tag listed 4/5.  My child is very petite so trust me when I say the tights run small.  Luckily, I had an extra pair that I bought at the ballet school.  I purchased the 6x/7 for my other child but it is more like a 6/6x with no extra room for growth.",Too small!!!,1.0,B0002QVAAG
As described.,Five Stars,5.0,B0002QVAAG
Way smaller then expected,Five Stars,2.0,B0002QVAAG
"Perfect fit for my 4 year old. Love the look to them. And they look durable, as they are not thinly made.",Perfect fit for my 4 year old,5.0,B0002QVAAG
"They are a smidge too small, but that's ok, I think they'll work. I really like the quality of the material. My tall 4 year old has not danced a lot in them yet, but they seem like they'll hold up for the long haul.",I really like the quality of the material,4.0,B0002QVAAG
"In the toddler size, the feet and ankles are too wide and bunch up.",Too wide in feet and ankles,3.0,B0002QVAAG
The only dance tights my daughter hasn't managed to tear after a single wear.,Four Stars,4.0,B0002QVAAG
Cute shimmery nude color for a superhero costume. We're perfect.,We're perfect.,5.0,B0002QVAAG
Both my girls have ballet and these are high quality tights that have lasted six weeks without a snag.  I'm very impressed!,High quality tights!,5.0,B0002QVAAG
"Good fit, seems like they will last. Will buy again.",Good tights.,5.0,B0002QVAAG
"Great tights for my 5yo daughter! Threw them in the wash, air dried and they still look fab.",Great Tights!,5.0,B0002QVAAG
Durable.,Five Stars,5.0,B0002QVAAG
Fit  well. Just wish the color spectrum was more diverse for darker AA girls.,Fit well. Just wish the color spectrum was more ...,4.0,B0002QVAAG
Good tights,Good tights,4.0,B0002QVAAG
Fits my daughter fine,Four Stars,4.0,B0002QVAAG
"These stockings rip very easily, but they fit very well.",Five Stars,5.0,B0002QVAAG
"Beautiful shimmer!  I originally tried to save these just for performances, but my daughter wants to wear them for every practice.  Good quality, no rips, despite the rough treatment they get every week for months so far.",Beautiful shimmer! I originally tried to save these just ...,5.0,B0002QVAAG
Item arrived with a HUGE black stain on it that I couldn't get off. Unfortunately I couldn't send it back because we were in a time crunch and my daughter has to have them. So we covered it with a long dress.  Disappointed.,Black stains,1.0,B0002QVAAG
"These tights are fine, but the foot part isn't shaped like a foot, so the toe and heel area is quite bulky. I would not purchase this style again.",Not my first choice,3.0,B0002QVAAG
Will be ordering more soon!! Like the thickness and shimmer of the stockings!!,Perfect!!,5.0,B0002QVAAG
Solid tights!,Five Stars,5.0,B0002QVAAG
Was the perfect color. Fit great.,Five Stars,5.0,B0002QVAAG
"Adorable dress! I purchased this for my 6th grader to wear to a dance. Well made, fits perfectly and is a little grown up but not *too* grown up. Age appropriate.",Really cute and well made,5.0,B0009DK8ZU
Fit just right length was perfect my daughter loved it. Was a last minute buy but worked out great .,very cute,5.0,B0009DK8ZU
"Beautiful dress, the only complaint I have is the rhinestone belt was loose in a couple of places. Otherwise it's very nice and a good quality.",Beautiful!,5.0,B0009DK8ZU
Looked so nice on my flower girl for our wedding. She loved the dress and said she felt pretty (7 years old). Would highly recommend!,Looked so nice on my flower girl for our wedding,5.0,B0009DK8ZU
This dress is even more spectacular in person! My daughter can't wait to wear this dress for her cousin's Communion!!,Coral Gorgeous!,5.0,B0009DK8ZU
Absolutely beautiful,Five Stars,5.0,B0009DK8ZU
Absolutely beautiful,Five Stars,5.0,B0009DK8ZU
"I ordered this dress in the Ivory color for an 8 year old girl. She's about four feet tall, 60lbs. I ordered the size 8.
Very cute dress!",Cute!,5.0,B0009DK8ZU
Not even close to the dress I received. The dress I received was all lace and had no waist strip. I ordered this specifically for pictures and It's. Or what I wanted.,Not what I ordered,1.0,B0009DK8ZU
Great looking dress and true 2 size!,Five Stars,5.0,B0009DK8ZU
"the dress was too large, but beautiful none the less.",but beautiful none the less,5.0,B0009DK8ZU
Super cute dress!! I bought a size 7 for my 8 yr old and shes thin but has a little bit of tummy. It fit snug but it fit comfortably. If your daughter is a little bigger in the mid section I'd go a size up. Fast delivery!,Super cute dress,5.0,B0009DK8ZU
We bought this for out pre-teen granddaughter to wear to church and Christmas parties. She loved it.,Great Holiday dress.,5.0,B0009DK8ZU
Beautiful dress but runs small. We purchased 3 of these. 2 did not fit. The one that did fit was damaged. Amazon would not match the price I paid for a size exchange or the damaged dress. We will be returning all of these dresses and finding new ones. To get the same dress I will be paying for 1 dress what I had paid for all 3. No thanks.,Runs small and they will. OT honor the price I paid,3.0,B0009DK8ZU
Dont put on a chubby little girl,Three Stars,3.0,B0009DK8ZU
Very pretty dress!,Great holiday dress!,5.0,B0009DK8ZU
gorgeous dress. My daughter is so beautiful i nit.,beautiful,5.0,B0009DK8ZU
Nice for the price but somewhat smaller and shorter than expected.,Pretty dress,4.0,B0009DK8ZU
"Oh, my, I'm Speechless. This dress is so pretty, and fits my daughter so well.  It will be perfect for special occasions. She adores it too.","This dress is so pretty, and fits my daughter so well",5.0,B0009DK8ZU
"Beautiful pice,  my daughter absolutely loves it!","Beautiful pice, my daughter absolutely loves it",5.0,B0009DK8ZU
"My daughter looks beautiful in this dress! I'd been looking for something that was more modest, which is hard to find. It comes to her knees. She is between a 12 & 14, the 12 was a little too tight but the 14 is perfect.",Beautiful,5.0,B0009DK8ZU
"Great shirt, but ended up being too small for our daughters so we had to return them. :(  Excellent quality for the money.",Great shirt!,5.0,B0009YL20E
My daughter loves this rash guard. It's a perfect fit for her. It's great quality and a great look. I will buy it again next year. Highly recommend.,Great quality and great look,5.0,B0009YL20E
"This did a great job of keeping my daughter covered and protected from the sun - she wore it all day on the beach. It dries easily and the colour looks cuter in real life. My daughter is 20months so the sleeves were long on her, but she'll grow into them. Great price too!",Great sun coverage,5.0,B0009YL20E
Looks exactly as in the photo and matched the sunhat perfectly.  So far has held up well against chlorine.  Sizing seems right.,Beautiful,5.0,B0009YL20E
I bought this because we were going to be on the water in the mountains outside of Jackson Hole. We have a family history of melanoma so I really try to be proactive. My granddaughter wore this while fishing in the mountains and floating down the Snake River. It was comfortable and she was totally protected from the effects of the sun.,It worked,5.0,B0009YL20E
"LOVE this sun shirt!  My daughter has used this shirt for two summers and I am purchasing another only because she has outgrown it.  The quality is superior and the fabic has not faded or broken down over two summers of use.  I've had less expensive sun shirts but they barely survive the season.  You definitely get what you pay for and knowing the fabic is holding strong gives me comfort that the sun isn't getting through to my daughters sensitive skin.
I originally bought the two piece with the matching shorts but the waist band on the shorts are not adjustable or elastic so they were always falling off.  I will only be buying the shirt this time.",Get what you pay for!,5.0,B0009YL20E
"My kids ""live"" in these when we spend a week, in the sunshine, at the lake.  They just wear it over their suits and under their life jackets when we spend a week at the houseboat and I don't have to worry about missing a spot of sunscreen or having to reapply - at least for on their arms, tummies, or necks.",Perfect for vacations in the sun.,5.0,B0009YL20E
"Very good product. I was wondering why a swim shirt would cost so much. (note: it costs $29-$31 just for the top). Had there been similar products at walmart, they would have sold it in the range $7.99 - $9.99. It surely turned out to be of very good quality. I am very satisfied with with quality of the product, though it is still priced on the higher side :( $17.99 - $22.99 would be and ideal (worth) price for the product.",Nice (but pricey),4.0,B0009YL20E
I got this at the beginning of the summer for my granddaughter. She loved the colors and patterns. She wore it all summer with no sunburns. It held up beautifully!,She loved the colors and patterns,5.0,B0009YL20E
Love it!!,Five Stars,5.0,B0009YL20E
Fits better than expected! My kid has a long torso and it stil fit,Five Stars,5.0,B0009YL20E
My grand child loved it!!!!,Five Stars,5.0,B0009YL20E
Worked great on my little girl this summer.  We spent an entire week outside in FL and not one bit of sunburn!,Great little shirt,5.0,B0009YL20E
My daughter loved it and is comfortable whenever she wears it.,Five Stars,5.0,B0009YL20E
"Daughter loves this shirt, bought short sleeve version also, Mom loves the fact she's protected in the sun, win-win",Daughter loves this shirt,5.0,B0009YL20E
Love. Great bathing suit. I buy for my daughter with the matching shorts.,Five Stars,5.0,B0009YL20E
"I love it, its high quality and sure to last a long time unfortunately my child hates it because the neck is too restrictive and refuses to wear it. My child doesn't like anything on the neck.","A great deal, great fit, covers well.",5.0,B0009YL20E
very comfy.,Five Stars,5.0,B0009YL20E
Quality product,Perfect for toddler who loves the beach,5.0,B0009YL20E
very nice durable swim shirt. great value,Five Stars,5.0,B0009YL20E
Fit a bit snug and I ordered 1 size up. Great quality product and its adorable.,Not as described size wise.,3.0,B0009YL20E
"This provided really good coverage for my daughter while out in the beach for an extended period of time. The size 6/7 fit her well for a slim, average height 8 yr. old.",Good quality,5.0,B0009YL20E
Nice and light.,Nice and light.  Fits just right.,5.0,B0009YL20E
"Neck opening was too small, had to cut in a V neck for baby's head to fit.",Three Stars,3.0,B0009YL20E
Great fit!,Five Stars,5.0,B0009YL20E
Great for outdoors and swimming,Will buy again,5.0,B0009YL20E
Nice quality.,Four Stars,4.0,B0009YL20E
"The opening for the head is too small.  We can't even get it on her.  Otherwise, the size looks about right.",The opening for the head is too small. We ...,2.0,B0009YL20E
Great shirt and seller,Five Stars,5.0,B0009YL20E
The quality is excellent! Nice product.,Four Stars,4.0,B0009YL20E
"I hate this shirt. We put it in our wet bag with the other suits and it bled pink all over everything. What is the point of a swimsuit that bleeds dye when it is wet? Sand got trapped in the white parts which made it look gray and dirty. And after a few hand washings it faded terribly. Buy a cheaper, better suit at Target or Costco.",I hate this shirt,1.0,B0009YL20E
Good swimwear for a conservative 11 year old.  We found some others but were confused on sizing before we settled on this one.  Fit perfectly. - Dad.,"Great fit, great swimwear.",5.0,B0009YL20E
For my daughter and she wore this in the ocean at Maine and it protected her against sunburn which is a huge plus.,For my daughter and she wore this in the ocean ...,4.0,B0009YL20E
It was nice for this summer but It was faded very soon.,Three Stars,3.0,B0009YL20E
Very small.  Sent back.,Two Stars,2.0,B0009YL20E
The quality of the material and cut is better than I had expected.  Beautiful color.  Just runs a bit large for my skinny kid but my child loves it anyway.  Thanks for a nice product!,The quality of the material and cut is better than I had expected,5.0,B0009YL20E
"We will buy many more of these!  They are great for sun protection, and they are very cute!",Wonderful sunshirt!,5.0,B0009YL20E
"Looks nice and fits as expected, but pricey for a swim shirt that will be outgrown in one season, especially when buying the matching shorts to go with it.",Expensive swim shirt,4.0,B0009YL20E
It's exellent option for protect our childrens.,Five Stars,5.0,B0009YL20E
My girl loves it.,Five Stars,5.0,B0009YL20E
Beautiful! And bright colors!,Five Stars,5.0,B0009YL20E
Fabulous find!  No more sunburns for my fair-haired grandaughter!,Fabulous find! No more sunburns for my fair-haired grandaughter ...,5.0,B0009YL20E
Very cute and dries quickly,Five Stars,5.0,B0009YL20E
"I am allergic to sunscreen, it's so bad I can't even put it on my daughter because if she hugs me, it rubs off. I bought this shirt and short set to ride our bike outside in the hot 110 degree Arizona sun. We frequently bike around 40-50 miles, and are in the sun for many many hours. This outfit not only prevented sunburns, but it also helped keep her cool. We are planning a beach vacation with a large family group next year, and I am sure these will work great!",Prevented sunburns and kept wearer cool,5.0,B0009YL20E
"We bought Tuga swim shirts and a pair of shorts two years ago. They have worn well enough in terms of construction and seams, but they have faded more with every single wash. They always bleed on the other laundry so I have to wash separately. They even stained the towel they were wrapped in after the pool last week -- after two years of swimming and washing!",Color bleeds and bleeds and bleeds,2.0,B0009YL20E
"I purchased those for my newly minted ballerina girl. She's one of those children who hate tags or anything that feels uncomfortable on the skin, so I was a bit apprehensive about the open foot feature bothering her, but she really likes them and tells me they are soft and comfortable. The only - probably inevitable - downside is that they are wearing out a bit sooner than I expected. She only takes ballet once a week and despite gently laundering and hanging them out to dry they are looking a bit worse for wear. Time to buy a second pair.",Soft and comfortable ballet tights for girls,4.0,B000A0LRCK
"These are great tights. If your girl is chubby on the waist i think you should order a number up. they are a strong tihgts. My daugther has it for more than 4 months and hasn't broken them. She only complains some days about the waist, just when she has had a lot of milk or food recently. she's 3 years old.",Great!,5.0,B000A0LRCK
These ended up being very durable and the perfect size for my little three year old.  Very good quality tights.,Perfect!,5.0,B000A0LRCK
"It is easy borken, only 3 times and there was a big hole,  don't buy",Two Stars,2.0,B000A0LRCK
When I bought these my girls were 5-6 years old. Lets just say I don't know how these were going to fit an 8-12 year old. But they fit perfect for them at the time.,Runs small,3.0,B000A0LRCK
good quality product.,Four Stars,4.0,B000A0LRCK
"They are good at first but didn't last very long. We dance once a week, and they started falling apart in about 6 weeks of use.",They are good at first but didn't last very long,3.0,B000A0LRCK
The band around her middle is tight and I wish I had chosen a different band at the waistline. But they are thick and well made.,The band around her middle is tight and I wish ...,4.0,B000A0LRCK
"Order larger than usual as the sizes run small in my opinion. I have also noticed that the light suntan seems dark when opening the package, but after some research apparently it is the correct color and simply darker for stage lighting. Sincerely, a former hockey player now dance mom ",Order larger than usual as the sizes run small in ...,5.0,B000A0LRCK
Fit as expected!,I would buy again,5.0,B000A0LRCK
Size is too small for my daughter.,Four Stars,4.0,B000A0LRCK
sizing is off.,Three Stars,3.0,B000A0LRCK
"great quality,recommend",Five Stars,5.0,B000A0LRCK
Very nicely made and heavy. Fit just as expected with room to grow for my average size 6 year old.,Very nicely made and heavy,5.0,B000A0LRCK
Happy with product. Just what I wanted and needed.,Great!!!!!,5.0,B000A0LRCK
My child loves them!!!  She is 5 so I bought the 8-12 as she is tall for her age and they fit perfectly. Being able to slide the tights off her foot is great so she doesn't ruin the bottom of her tights when getting home.,Tranistion tights are the best!,5.0,B000A0LRCK
nice fit,Five Stars,5.0,B000A0LRCK
Dancer loved the color the feel & the fit!,Five Stars,5.0,B000A0LRCK
"We have purchased these tights before, but this time it seems as if Capezio has changed them slightly and they are running slightly smaller.","We have purchased these tights before, but this time ...",4.0,B000A0LRCK
I bought these for my son because he was the dancer from Sia's videos.  They fit will.  He wears a size 6.,I bought these for my son because he was the ...,4.0,B000A0LRCK
Cozy fit.,Five Stars,5.0,B000A0LRCK
"These are great dance tights. The only reason I didn't give five stars is because I think the sizing for 2-6x is completely bogus. My daughter is 4 and tall for her age, but she certainly isn't bigger than 6x. These tights BARELY fit her. If you have a tall daughter like I do, and you are looking for something for age 4 and up, I would size up. Don't buy the 2-6x size.",Size up if you have a tall daughter.,4.0,B000A0LRCK
Excellent buy.  The quality is great. Looks like she'll get a lot of wear out of this!,Great Item!,5.0,B000A0LRCK
Daughter loves it.  Works well for her dance class.,Daughter loves it. Works well for her dance class ...,5.0,B000A0LRCK
Bought for my 5 year old daughter. Size I bought 8-12 and it fit just right.,Four Stars,4.0,B000A0LRCK
Fit great,Five Stars,5.0,B000A0LRCK
"We love these tights and keep repurchasing them. They are incredibly soft and comfortable, and the when my daughter pulls the tights to cover her toes, the hole at the bottom of her foot doesn't bug her. The tights fit well and the color is lovely. Best tights we have owned.",Best tights we have owned,5.0,B000A0LRCK
LOVE them!  They are perfect!,LOVE them! They are perfect,5.0,B000A0LRCK
"These are by far the best dance tights out there! They are durable, do NOT run easily, and no odd lines on the thighs! These are the only tights I buy my girls!",Fantastic!,5.0,B000A0LRCK
Capezio Little Girls' Ultra Soft Transition Tights fit perfect.,Capezio Little Girls' Ultra Soft Transition Tights fit perfect.,5.0,B000A0LRCK
The best ever!! Go capezio!!,Five Stars,5.0,B000A0LRCK
Best tights!!!!,Five Stars,5.0,B000A0LRCK
Tights are thick and sturdy. They take the wear and tear of dance practice. Theyre soft and well made,Quality tights,5.0,B000A0LRCK
These were perfect! My daughter is 7 but I read the reviews and went with the size 8-12. They were a perfect fit.,These were perfect! My daughter is 7 but I read the ...,5.0,B000A0LRCK
Seems very high quality.  My daughter loves them for switching between dance shoes.  Has worn them several times with no runs or holes.,Seems very high quality. My daughter loves them for ...,5.0,B000A0LRCK
The holes at the bottom are very bothersome.. they ripped after 3 uses.,One Star,1.0,B000A0LRCK
"Nice quality, just be sure to go a size or 2 up. My daughter is 5 and I ordered 8-10 and they fit her like her smaller sized tights do.",Go a size or 2 up.,4.0,B000A0LRCK
"I bought these for my 8 year old expecting them to be on the larger size for her to grow into.  She wears a size 7/8 clothes and these were actually a little snug.  They do fit her but, there is definitely no room to grow",I bought these for my 8 year old expecting them ...,4.0,B000A0LRCK
These are perfect for my 3 year old as transition tights. Works great! Nice quality.,Five Stars,5.0,B000A0LRCK
