reviewText,summary,rating,asin
We liked it. Easy to put on and take off. Only negative comment would be it shrinked when washed. She didn't get as many wearings out of it as expected.,Nice Swimming Bodysuit,4.0,B000FPVZ36
"The skirt is very cute, but the material bunches up in a really strange way. It also fits in an odd way, and not exactly like I thought it should fit my daughter. It did look exactly as described, however, and it arrived in a very quick fashion. It wasn't a complete bust, and my daughter did end up wearing it a little bit anyways.","Eh... Cute, But not all that great",3.0,B000G0F8XI
Perfect color perfect shipping BUT they snagged right away.  Needed them within a couple days so I had to hand sew the large hole that went accrossed and up and down.,Perfect color perfect shipping BUT they snagged right away,2.0,B000G8GMMG
Purchased this as part of my daughters costume and they fit perfect.  material was thick and sturdy which helped keep her warm.,... as part of my daughters costume and they fit perfect. material was thick and sturdy which helped keep ...,5.0,B000G8GMMG
I got it for my daughter who is 8 and she wears a 10/12 pants or a 16 in some other brands. It has stretch but still a bit snug. Color is great! Wish I could of gotten a size up. Still happy with our purchase!,Color is great! Wish I could of gotten a size up,3.0,B000G8GMMG
My child is 3.5 years old and wears a 3 and these were way too big,One Star,1.0,B000G8GMMG
Great product! perfect for being a ninja turtle for halloween and then to keep using at dance.,Four Stars,4.0,B000G8GMMG
"Very pleased with the tights, great quality and they were shipped in a timely manner!",Very happy,5.0,B000G8GMMG
They are very green. They matched perfect with my daughters homemade poison ivy Halloween costume. Great buy,They matched perfect with my daughters homemade poison ivy Halloween costume,5.0,B000G8GMMG
"I bought these tights to go a long with a yellow leotard I purchased so that my daughter could be a minion for Halloween.  I had originally thought about using body paint for her arms and legs but I live in Florida and with the heat I anticipated that being a mess.  Also, she's two and I just didn't think she'd sit still long enough for me to get the job done.  So I sought after some yellow tights and a long sleeve yellow leotard.  I wish that I had been able to purchase both from the same seller so that I knew that colors would match perfectly, but these tights were an almost perfect match for my leotard.  The size says 2-4T.  I think it's more true to size for 2-3T.  I don't see her getting much use out of them past Halloween 2016 but they were slightly large so I see her getting a lot more use for the next 6 months.",Great Match for What I Was Looking For,5.0,B000G8GMMG
These tights are a food it!,Five Stars,5.0,B000G8GMMG
,Four Stars,4.0,B000G8GMMG
My girl loves it!,Five Stars,5.0,B000I2RLBQ
"We just received the jacket in size 3T.  It's absolutely adorable and my little girl loves it.  The sizing seems to be fairly true, and the quality is quite nice.  My only suggestion would be to change the buttons to snaps.  That way she could do it herself.  The buttons are a tight fit for the holes.  Overall, an excellent purchase!",Very Cute!,5.0,B000I2RLBQ
"Okay, so this is probably way overpriced, esp with the shipping, but, as the aunt, I can spoil and get away with it!  I have purchased 2 of these for my little nieces and although, the kids don't care, the mothers love them!  Too, too cute!",Pink denim jacket,4.0,B000I2RLBQ
Paper package holding the tights were very old and yellowed.  The tights had th correct logo on them but the material was much rougher and thinner than the tights we bought at the dance studio.  Something's not quite right.....,Doesn't seem authentic,2.0,B000I9QB60
"I purchased the size 8 -12 and that is what it said on the package, and on the tights inside label.  They originally looked way to small to me, but they stretched out to fit perfection.","Very stretchy, they looked to small but were not.",5.0,B000I9QB60
Fits perfect,Five Stars,5.0,B000J429LU
My daugter realy like them,Five Stars,5.0,B000J429LU
Small but nice,Four Stars,4.0,B000J429LU
"Daughters said fit okay, and mostly comfortable. Complain that waistband starts to get uncomfortable towards the end of the day. Good price.",Okay.,3.0,B000J429LU
My daughter is 3 n half and is petite. She usually wears a 4T and just started wearing 4 in panties. The hello Kitty ones she has are size 4 and they fit comfortably. However the size 4 in this brand were small and kept riding up. Had to trash it after wearing it once and purchased a different brand,Small,3.0,B000J429LU
poor quality - elastic waistbands started fraying after just a few washes,fraying waistbands,2.0,B000J429LU
"The size is not to the US standards.
Measurement chart is misguiding.
Too Small for the Age.
Had to return.",The size is not to the US standards. Measurement ...,2.0,B000J429LU
I didn't get the colours that are posted in the picture. Totally different order but righr size.,wrong colours.,3.0,B000J429LU
Excellent quality product.,Five Stars,5.0,B000J429LU
"These size 6 underwear are the same size as the Fruit of the Loom size 4 underwear I bought for her a couple of years ago. It still fits ok, but there's no room to grow into it. So, kind of disappointing, but usable.",These size 6 underwear are the same size as the ...,3.0,B000J429LU
"Although I still think the rain coat is adorable, when it arrived and I tried it only daughter, it was quite a bit larger than expected. But, we just rolled the sleeves and wore it anyway! She has gotten many compliments on it still!",Still adoreable!,5.0,B000J65UBY
"Arms are a bit long.  Ours came with a defect, one of the black spots was not fully colored in.","Nice, but runs big",3.0,B000J65UBY
"I got it with the Western Chief Laydbug rain boots. My granddaughter's bedroom is in the ladybug theme, and she loves the Ladybug Girl books.",So cute!,5.0,B000J65UBY
I purchased this for a 5 year old girl.  She loves the Jacket.  It is of good quailty material.  I am so please with the product.,Western Chief girls Ladybug Raincoat,5.0,B000J65UBY
"I loved this product however when I went to purchase more it seemed that price had more than doubled!! It's not worth $30 and I'm very disappointed in Amazon raising the price so significantly. Actually, I believe the official claim was they ran out. When I ordered the original item there was no mention of limited quantities. (Like we normally see).",Loved Product,5.0,B000J65UBY
"I got this for my granddoughter, and she loved it, I thought it was to small, but she didn't want me to send it back, she was afraid that she might not get the same one.",She loves Pink,5.0,B000J68WDC
Says it was machine washable but it completely fell apart in the wash before my daughter had a chance to wear it. the metal snaps broke off. Waste of money.,Waste of money,2.0,B000JD10ZM
bought it montsh ago and still fits bby,Five Stars,5.0,B000JD10ZM
"This is very cute. My daughter loves the pockets. It is very soft, she asked to wear it to bed. :)",Soft and cute pockets,5.0,B000KEJWUK
Love it!,Five Stars,5.0,B000KGIGAA
Perfect fit and so cute and comfy!,Great buy!,5.0,B000KGIGAA
perfect and good quality,Five Stars,5.0,B000KGOSR0
Cute little outfit for my 3yo niece. Fit well and held up after many washes.,Loved it. Great for the price.,5.0,B000KGOSR0
Excellent,Five Stars,5.0,B000KGOSR0
Love it,Five Stars,5.0,B000KGOSR0
I just wish it didn't have the cuffs on the bottom of the pants.  Otherwise we like it.,Otherwise we like it.,4.0,B000KGOSR0
thanks,Five Stars,5.0,B000KGOSR0
Adorable-good quality.,Five Stars,5.0,B000KGOSR0
awesome,Five Stars,5.0,B000KGOSR0
Very cute,Five Stars,5.0,B000KGOSR0
just beautiful,Five Stars,5.0,B000KGOSR0
"The picture was very misleading. The scarf would barely overlap and tuck into the lapel, it was way too short.",Very Small for a Man's Scarf,2.0,B000KL3HMM
"My husband has another scarf with silk on one side and cashmere or wool on the other and that one seems sturdier than this one. He says he'll wear it and he seems happy enough, but it wasn't entirely as expected. I thought it would be slightly more substantial.",Thinner than expected,3.0,B000KL3HMM
"This is so soft and what a color!  Cashmere and silk....for a tango instructor.  This was a birthday gift for
a friend from Venezuela who dances tango with me.  He deserves the best! Beyondancing!",Gift,5.0,B000KL3HMM
Goes so well with my husband's new leather bomber jacket.  Now he looks like an authentic navigator! Great quality scarf1,Great mens scarf,5.0,B000KL3HMM
"silk on one side  patterned cashmere on the other,off white pure style.  I shall wear it as an ascot tucked in a shirt, sweater, vest.  Chicks dig it or not It's still style.",ascot anyone,5.0,B000KL3HMM
"I had a white silk scarf many years ago, but lost it somewhere along the road of life. My wife decided it was time for a new one, and so surprised me at Christmas a few years back. I wear this with a long woolen overcoat during those (relatively) cold months of January and February here in North Carolina, and it is not only decorative but functional when the cold wind blows and I can't afford to have ""hat hair.""

For the guy who likes to dress well and who thinks he has everything -- he doesn't until he gets one of these scarves!",Foppish pleasure.,5.0,B000KL3HMM
She loves it!  Her sister wanted to share it.,She loves it! Her sister wanted to share it ...,4.0,B000KSRCG2
"Light enough to use in summer and feels really nice quality. well made, super cute my daughter loves it.",Five Stars,5.0,B000KSRCG2
The coat is adorable and well made. I bought a size up luckily because the fit is a bit small in the body while the arms are a little long and I have to fold the sleeves.,Love the coat,4.0,B000KSRCG2
"The coat is so cute and flares out nicely at the bottom. My twin girls are just turning 2 now but are really big for their age. The sleeves are just a tad long, but easy to roll up, so that they can keep wearing the coat all year long.",Cute and Comfortable,5.0,B000KSRCG2
nice and thick,Five Stars,5.0,B000LFQSDW
So soft,Five Stars,5.0,B000LFQSDW
Daughter loves this jacket!,Five Stars,5.0,B000LFQSDW
"Grand daughter in heaven. She loves that her tomboy side has the Camo and her girly side has the pink. Fit well, and warm and comfortable.",and warm and comfortable.,5.0,B000LFQSDW
"Excellent gift for 5 yo grand, well made, good price, practical. Got 6X to have for 2, probably 3 seasons",Excellent!,5.0,B000LFQSDW
It's a little big but that's fine she has room to grow in it. Nice and worm for our area.,It's a little big but that's fine she has room to grow in it,5.0,B000LFQSDW
"Love the reversible coat, but please note the sleeves run a little skinny!  I don't think it would be comfortable with a long sleeve shirt under it.  (and it is on a normal sized 4 year old, not a husky girl)",Love the reversible coat,4.0,B000LFQSDW
Sizes run small,Two Stars,2.0,B000LFQSDW
My daughter loves this jacket.,Five Stars,5.0,B000LFQSDW
Excellent!!!,Five Stars,5.0,B000MOOJCY
beautiful!,Five Stars,5.0,B000MOOJCY
"I purchased this for my 3 year old niece to wear in my wedding since she was the flower girl. It's a beautiful dress but was itchy on her. Her mom fixed that problem by sewing in an undershirt into the dress. It worked perfectly and my niece even wore this dress in my sister's wedding the year after. It fit her a little better too, being 4 years old.",It's a beautiful dress but was itchy on her,4.0,B000MOOJCY
My junior bridesmaid likes this dress will more sizes be available soon?,question about availability,5.0,B000MOOJCY
Beautiful.,Five Stars,5.0,B000MOOJCY
I ordered 2 dresses a size 4 and a size 6.  The size 6 was very small and the size 4 was larger.  It was fine I had my daughter wear the 4 and she is usually a 6 and I had my niece were the 6 and she is usually a 4 or smaller.  They were beautiful dresses and worked wonderfully for the photo shoot I did.  But be aware of the sizing.,size,4.0,B000MOOJCY
It was a perfect fit~,My daughter was beautiful as my flower girl!,5.0,B000MOOJCY
Cute detail...my daughter wore this as a flower girl dress and it was adorable! Had to send back original size because it was too big,Runs a little big...order a size down,5.0,B000MOOJCY
"This dress is very beautiful and fit true to size. It comes down to the ankles on my 9 year old daughter. She wears a black shrug with it to cover her shoulders. We bought this because my daughter is a member of a school choral group and each child is required to wear black formal clothing. The girls wear a yellow sash around the waist. We were able to remove the flower on the waist (it is pinned) and tie the sash in it's place. It is a beautiful dress. I'm glad it is so long and will fit her for a while. The dress ties in the back, so if it is a bit big you can make it fit snug with the ties.",Beautiful dress!,5.0,B000MOOJCY
"Bought this dress size 10 for my daughter for my sisters wedding. The dress arrived when expected, was beautiful, didn't need to send to cleaners. She wore with a pedi-coat to give it a little bit of puff.
Very happy.",Beautiful,5.0,B000MOOJCY
Very nice and looks so cute on my niece. She had to wear them right away!,Five Stars,5.0,B000MVIK0Y
"very good, Thanks",Five Stars,5.0,B000OOH3ZW
I love the fact it has a built in diaper. Its very cute and easy to put on. I had so many people stop me at the pool and ask where I got it. My daughter has already out grown it. But this is a great buy still. Her next suit will be one like this.,very cute,5.0,B000P5TC6I
A little short wasted.  But super cute and soft.  Wore it with candy cane leggings for Christmas.,Cute,5.0,B000P8AK3Y
"It is very pretty, but very sheer.",Sheer sweater,3.0,B000P8AK3Y
"Runs a little small, have to return",Runs small,4.0,B000P8AK3Y
A good buy.,Five Stars,5.0,B000P8AK3Y
Great granddaughter  loves  it wore it to school  the next day,Great granddaughter loves it wore it to school the next,5.0,B000P8AK3Y
I bought this for my ten year old who is on the thicker (muscular) side. It fit her very nicely and looked elegant. We have a hard time with cute clothes since a lot of items are made for tiny little skinny girls but this fit her nicely.,Great for Thicker Frame,5.0,B000PKDPVQ
"Great top. Cute, well made. Runs small! Would give it 5 stars if it fit like her other tops that are the same size.",Great top. Cute,4.0,B000PKDPVQ
Granddaughter  loves it,Four Stars,4.0,B000PKDPVQ
My daughter loves this top. She's starting to look like a photograph because she wears it so much.,She's starting to look like a photograph because she wears it so much,5.0,B000PKDPVQ
Very nice top.,Five Stars,5.0,B000PKDPVQ
Bought for my daughter and she loves it!,"Very cute, fits perfectly!",5.0,B000PKDPVQ
"Beautiful! Fits well, well made, the attached necklace is really pretty. My daughter loves this top.",Fantastic buy!,5.0,B000PKDPVQ
Great!,Five Stars,5.0,B000PKIR4G
She likes it.,Five Stars,5.0,B000PKIR4G
never tried it on her because it arrived with a stain and I sent it back!!,One Star,1.0,B000PKIR4G
"Soft, breezy, and a lovely color. The recipient was pleased.",Cute summer top,5.0,B000PKIR4G
SO cute and girly!,Five Stars,5.0,B000PKIR4G
Beautiful!  My six year old loves it,Beautiful! My six year old loves,4.0,B000PKIR4G
This shirt would fit probably Asian women in XL but way too small to fit me! Way too tight! Too bad too because it is pretty but just can't wear it. Buyer beware!,WAY TOO SMALL! XL = Medium,2.0,B000PKIR4G
Fit a little small but she really likes it.,Four Stars,4.0,B000PKIR4G
"I bought this top for my 8 year old daughter. She is bigger around the tummy, and we have a hard time finding tops that fit her and look cute. This top is so cute on her. The tank underneath is soft and stretchy, and the top layer lays nicely.",Cute top!,5.0,B000PKIR4G
"My daughter loved the look and feel of this top but it did run too small. She also didn't like how the necklace wasn't a complete necklace but hooked up to buttons on the shoulders, which was uncomfortable. It's long enough, though, so it would be easy to add some connectors so she could wear it as a necklace. We're replacing this with a larger size. It's perfect for the summer, very lightweight and airy.",Sweet top perfect for hot days,3.0,B000PKIR4G
"Super cute! It's hard to tell in the photo what the mesh layer is about. It is a soft pink layer, looks better in real life. My granddaughters loved their princess nighties. For the price,a great purchase.",Granddaughters loved their princess nighties,5.0,B000QFJXLG
"Perfect little nightgown. The only had a 3T, but I know my granddaughter will grow into it (she's a 2T). It came with a star wand and I think she likes that more than the dress!! Big hit.",Perfect little nightgown,5.0,B000QFJXLG
Fits well except around the neck I really had to pull down to get the gown over my girl's head.,Too small around the neck,3.0,B000QFJXEI
My daughters legs showed and she normally fits a size three.  Just too short for a warm nightgown.,Four Stars,4.0,B000QFJXEI
A bit small but not by much.  VERY CUTE for Christmas Eve and morning.,Here comes Santa baby,4.0,B000QFJXEI
"Huge size difference between 7 and 8. There were no more 7s left so I thought the 8 would be okay, but my daughter was drowning in the dress. Size 7 fit perfect.",Size 7 fit perfect.,2.0,B000QIXWXS
My six year old likes this.,Nice fit.,4.0,B000QIXWXS
Very nice. The pocket is useful. Daughter loves it. Different than the other dresses so it gives a unique feel.,Nice.,5.0,B000QIXWXS
"I had this item shipped to my granddaughter for her new school year.  Her school requires attire to be plain with no logos, characters, etc.  My daughter said it was very high quality and fit perfectly.  Thanks for your great service.",Dickies kids girls 7-16 pleated jumper,5.0,B000QIXWXS
It is a Great school jumper. My granddaughter loves it. Sturdy material good construction. Just what was needed for back to school. I would buy this again.,Jumper,5.0,B000QIXWXS
My daughter is little But this was way Too big! Too boxy. Might be cuter in the smaller size but its not very cute. Sending it back.,Too big,3.0,B000QIXWXS
"I bought a size 7 for my almost 7 yr old who usually wears a size 6/7 dress and a size 10 for my tall 9 yr old.  The younger daughter tried on her uniform first and it was almost down to her ankles & she swam in it. I initially thought I'd been sent a size 10 in both colours (I got Navy for her and Khaki for the older daughter). I had the 9 yr old try on the size 7 and it fit her perfectly.  Someone commented that it was stiff and I do agree but the quality is good and she's wearing leggings & a polo shirt underneath so it doesn't bother her.  Thankfully Amazon has a great return policy so I just had my older daughter keep the size 7 and exchanged her size 10 Khaki for a size 7. I got a French Toast uniform jumper for the 7 yr old.  It's lighter-weight, softer fabric and was true to size (got her a 6X).","Good quality, good price but it's HUGE!!",4.0,B000QIXWXS
"Did not like anything about this uniform.....very stiff, even after I washed and added softener a several times. I would have thought I purchased a cheap Girl Scouts uniform..... I will Never order again",Girls Uniform,1.0,B000QIXWXS
"I like the make and the details except that it was above the knee for my daughter. I am going to buy larger size. If you order a certain size, then please order a size bigger so you wouldn't have to exchange like me. The customer service was great.","Nice one, runs small..Great customer service!",4.0,B000QIXWXS
"Good length, good fit, it does not require much if any ironing. My daughter perfers to wear dresses to school and she likes this one because it has a pocket!",Great uniforms!,5.0,B000QIXWXS
Cute print.  Nice cut.  Just wish it was a touch bigger.,Happy,4.0,B000R95RQQ
So pretty and colorful,Five Stars,5.0,B000R95RQQ
My daughter loves this shirt.,Five Stars,5.0,B000R95RQQ
"LOVE this shirt...it's very soft and the colors are pretty. Only drawback - the neck is very wide, almost looks like it was stretched out. Not sure if it's a defect or if that's the ""look"".

*edited* After only one wear/washing the neck of this shirt stretched out even more, and became an 'off-the-shoulder' look. A shame because I love the color, design, etc.  I guess it's possible that we just got a funky one. Sadly, my daughter was only able to wear it once.",Received quickly in good condition. Thank you!,5.0,B000R95RQQ
Nice top!,Four Stars,4.0,B0007L0G4C
My 8 year old granddaughter loves these.  They fit well and are soft and comfortable.,They fit well and are soft and comfortable.,5.0,B000RO5S1K
Perfect sweatpants for my daughter.,Five Stars,5.0,B000RO5S1K
"These are great - soft, flexible materials and a great alternative for PJ pants.",Five Stars,5.0,B000RO5S1K
"Should specify that these are for children. Had no idea if it meant ""big girls"" as in plus size, adult, or ""awww look who's a big girl now!"" It was the latter. Took a chance and they are wayyyy too small. Thank goodness they're cheap.",Should specify that these are for children. Had no ...,1.0,B000RO5S1K
These are fantastic! I thought the arms and legs wouldn't be long enough but they do their job perfectly! We are going to spend most of summer at a water park/amusement park and my fair girl needed protection! Way better than chemicals,Yes yes yes!,5.0,B000ROJCKI
"My little one was very comfy in it. She's a 4month old, learning to swim and her new suit didn't slow her down one bit. She weights about 14lb. I got her a 3-6months size in the purple. It is easy to get on with a choice of over the head (like shirt) or to slip on (like pants). The buttons do make it easy for diaper changings but because she has chunky thighs it does stretch to a snug fit around that area. I highly recommend this product though.",LOVE IT!,5.0,B000ROJCKI
I love this swim suit especially when we are in the sun all day because they are fully covered. The only problem I've had is the small turtle emblem on the front has worn off after a few washes.,Great Buy,4.0,B000ROJCKI
"I love the tuga swimwear like for my active toddlers, I've been buying it for three summers straight now. This was for my 2.5 year old daughter who is very petite and wearing 18 month old clothes comfortably. I like more full coverage swim suits as she tends to sit in the sand and play on the beach (and crawl around) and I like there to be a little more protection from her clothes than the traditional one piece girls swim suit. It also cuts down on the amount of sun screen I have to lather on. I pair this with a matching sun hat and she's super cute and dressed practically for beach play and water temperatures that are slightly cooler.",Great quality,5.0,B000ROJCKI
My children love these they say they are very comfortable and they keep them warm in the water... so far so good...,My children love these they say they are very comfortable and they ...,5.0,B000ROJCKI
good,Five Stars,5.0,B000ROJCKI
"after several days of using the logo with the turtle has come unstuck. this is a great product, but I think that you need to pay attention to the quality of the application of the logo","this is a great product, but I think that you need to ...",4.0,B000ROJCKI
love this item for my daughter. wonderful fit,Five Stars,5.0,B000ROJCKI
I bought this for my 2 month old in preparation for a beach vacation. The 3-6 month size fits well with plenty of room for her to grow into it and use it the rest of this year. If your child is especially chunky I would recommend sizing up.  The fabric and stitching all seem like high quality. She was very comfortable when we tried it out at the pool. She had her tuga suit on and a sun hat and did not even get close to pink while we were out in the sun. I am very pleased with this purchase.,Baby is ready for the beach,5.0,B000ROJCKI
"Great fit. I have a stockier 2 year old and a lengthier 3 (almost 4) year old. This suit fit them both very well. I ordered the 2/3 and the 4/5. The mid-section was a tad snugger and the arms/legs a tad longer on the 2 year old. The suit fit great on the 3 year old, giving both girls room to grow as they get leaner and taller. The torso on these suits is a bit short compared to the arms/legs being a bit long in general, but this worked great for my kids. These should fit great next year as well, so that helps make up for the higher price.",Great fit.,5.0,B000ROJCKI
So cute on and happy it's SPF and covers most of my baby's skin,Five Stars,5.0,B000ROO9BK
"The colors are true to picture, the fabric is somewhat hard and stiff. The quality seems to be good, although we haven't used it yet and don't know how it will hold up. The sizing is way off. I got size 2t-3t, measured it up to her existing swimsuit of the same design size 18-24months, and it's even smaller than that. Buy a few sizes up","Decent quality, size runs very small, the fabric is not soft",3.0,B000ROO9BK
Poor quality,One Star,1.0,B000ROO9BK
One of the snaps on the bottom let go the first time I tried to use it.,Snaps broke first wear,1.0,B000ROO9BK
Great suit.  Wish the girls' version came in something other than my little pony pink. . . but it protects from the sun so we'll go with it.,Good suit. . . bad color.,4.0,B000ROO9BK
"Has held up nicely with continuous wear. The sand is especially hard on these suits, and it gets caught in the fabric, but my child isn't getting burned and she's staying comfortable. We've been at the beach and pool all summer and it's still intact and looking great. She's never complained of being hot in this suit either.",Worth the $$,5.0,B000ROO9BK
