reviewText,summary,rating,asin
"I own several Russell t-shirts that are about 10 years old.  They are heavy cotton and even 10 years later...still are holding up well.  I got this one today and the cotton is probably 50% of what it used to be.  You can almost see through it compared to the old Russell shirts.  I think that a Beefy T-shirt is thicker.  Disappointing for what they used to be.  If you don't mind a thinner cotton shirt, this one is good.",Quality has gone down,3.0,B0002X4HTK
"Either my shirt was mislabeled, or someone doesn't know how large to make ""large"" size shirt.  It was so big, I just gave it to my grown son, who is much, much bigger than me.",Made for a Gorilla,2.0,B0002X4HTK
"100% Quality.
This brand is very good, the quality is unmatched and is very modern and beautiful models.",Columbia shirt,5.0,B0002XSXWW
"very good I am in Venezuela and the article I came in great condition, I commend you for your prompt repli",very good,5.0,B0002XSXWW
"I am a thrift store shopper. I never spend this much on a shirt. However, my husband got this same shirt 15 years ago and I noticed about a month ago that the collar was very worn and the seams were wearing thin. We both remarked on how awesome it was that the shirt had lasted so long and so well because he loves that shirt and wears it alot. So, as a Father's day surprise I decided to hunt for a similar shirt. I was thrilled to find that the exact same shirt is still being made! So I bit the bullet and bought four of them (two long sleeved and two short sleeved). For me to spend $160 it has to be a darn good shirt. But I figured if that last for 15 years it's worth it. My husband was surprised and thrilled! He thought four shirts was overkill but I was concerned they might stop making them so what to heck. Great shirt, great quality. Hopefully these new ones are, indeed, the same quality as the one made 15 years ago.",Columbia fishing shirt,5.0,B0002XSXWW
This shirt was expensive but I bought it for a special occasion and it appears to be good quality. It is nice looking and comfortable to wear.,Canary yellow shirt,4.0,B0002XSXWW
I have purchased several of these shirts over the years and have found them very comfortable to wear and fish in.,KBFishing,5.0,B0002XSXWW
"good morning, the next article, I translate from Spanish to English because I speak only Spanish.

I am very happy with my shirt columbia, only one size is a little big for me, is to be envisaged that the m in the united states is a bit larger than the size m here in Venezuela, but still I think I did an excellent buy",excelente,4.0,B0002XSXWW
"Great seller, but the shirt that i received is in diferent color than the image",Columbia shirt,3.0,B0002XSXWW
"I was really suprised at how comfortable this shirt is, and how many great pockets it has.  What was really nice is a little tab for your glasses.  I am constantly loosing my glasses and now i have a convenient place to put them.  The shirt look good, and is comfortable.  Oh and the sizes are correct.",Great shirt,5.0,B0002XSXWW
"el producto es excelente, comodo, fresco. ideal para las personas que viven cerca del mar",muy comoda,5.0,B0002XSXWW
"I have been buying these shirts for years.  They are great for fishing or any outdoor wear. The back is vented and there are plenty of pockets for keeping things like cell phones or keys secure, especially in a boating environment.  I'd give it 10 stars if I could.",One of my absolute Favorites - Would give 10 Stars if I could,5.0,B0002XSXWW
Ok,Ok,5.0,B0002XSXWW
excellent,Five Stars,5.0,B0002XSXWW
These Columbia shirts cant be beat. really good price,really good,5.0,B0002XSXWW
Excellent Quality and Price,Excellent Quality and Price,5.0,B0002XSXWW
"Other than the fit, i.e.a small runs like a medium, fantastic Columbia fishing shirt. Pops loves these and decent deal.",a small runs like a medium,5.0,B0002XSXWW
Way too big,One Star,1.0,B0002XSXWW
perfect,Five Stars,5.0,B0002XSXWW
Nice,Five Stars,5.0,B0002XSXWW
"This are great shirts,they do run large",Great shirts,5.0,B0002XSXWW
I like,Five Stars,5.0,B0002XSXWW
Great price on a nice shirt,Five Stars,5.0,B0002XSXWW
"Nice blue color and made with quality. Shirt fits way to big, if you normally wear a large order medium. I wear large shirts but this fits like an XXL.",Fits big,3.0,B0002XSXWW
XL size is seriously oversized--far too baggy and long for me to wear comfortably.,Oversized,2.0,B0002XSXWW
Actually a very nice looking shirt. But it runs big. I normally wear a medium. I guess maybe I should have tried a small but small shirts almost never fit me.,Actually a very nice looking shirt,3.0,B0002XSXWW
Awesome thank you so much,Great shirt,5.0,B0002XSXWW
"The material is not the same I have bought, it is not better is bad",it is not better is,1.0,B0002XSXWW
"Great price, cant beat it. Quality is the same as regular price.",Five Stars,5.0,B0002XSXWW
Would be better if they didn't wrinkle so bad!,Four Stars,4.0,B0002XSXWW
I bought this shirt in 3 colors and I love these shirts but they RUN LARGE.  I wear XL in T shirts and this was like a tent.  I had to return and buy the next smaller shirt.  They are great shirts.  Very comfortable and the air vent in back is perfect.  I collect rocks in West Texas and in the summer and even winter i love these.  When collecting I wear the long sleeve style of these shirts since it keeps the thorns from ripping my skin.  These on the main shirt I pack when going out in the field.  Highly recommended for any out door environment short of snow.,Great Shirt - Runs on the Large size.,5.0,B0002XSXWW
Cool. Retro look and light breezy fabric,Five Stars,5.0,B0002XSXWW
"I was very dis appointed in this shirt, after I washed it. I t wrinkled so badly that it was ridiculous!
In fact it was so bad as compared to the other Columbia Bonehead shirts that I had previously purchased that it made me wonder if this shirt was a counterfeit?",Poor quality after washing,2.0,B0002XSXWW
It's a shirt,Four Stars,4.0,B0002XSXWW
Husband love it....but he is an Extra Large and we have to buy a Medium because they fit too large.,Husband love it.,5.0,B0002XSXWW
Great quality,Five Stars,5.0,B0002XSXWW
The color was just what I expected Fit great! Price less than department stores,Five Stars,5.0,B0002XSXWW
"I have ordered these shirts for years, always the same size (small).  This time the shirts were definitely not size small even though the label said they were small.  They were way too big, untucked they go to just above my knees.",Size problem,2.0,B0002XSXWW
Comfortable; Breathes well; LOTS of pockets,Comfortable; Breathes well; LOTS of pockets,5.0,B0002XSXWW
I love these cotton shirts by Columbia!!  I can't find the women's original BONEHEAD shirts so I get a men's small and I get a little extra room to move.  But they are terrific shirts for summer!!  And you don't have to worry about a camp fire too close and melting the polyester or nylon!!!,I love these shirts!!!,5.0,B0002XSXWW
"It is very fresh, you have to by one size less.",Five Stars,5.0,B0002XSXWW
perfect,Five Stars,5.0,B0002XSXWW
Great shirt,Five Stars,5.0,B0002XSXWW
Perfect,Five Stars,5.0,B0002XSXWW
Great,Five Stars,5.0,B0002XSXWW
"Reviewers were not joking when they said this shirt ran large. Way too large. My husband normally wears an XL, but after reading many reviews he decided to order a size down to a large. When it arrived, even the large was ridiculously big. He was swimming in this shirt. A medium would've been perfect for him, but even so, maybe a little loose. He doesn't like his clothes skin tight at all. My husband likes his clothes to be loose and breath well, but this shirt style definitely runs on the big side.

Not only does it run big, the cut of it also is very far from slim cut. It's a very relaxed fit. Too relaxed even for him. Other than the fit, the shirt was good quality and lightweight. It was well made and the design is nice. We loved the flap in the back and the pockets. Everything was good besides the fit. We had to return the shirt because it was just gigantic.",Runs LARGE.,4.0,B0002XSXWW
Nice airy shirt. Great for fishing or just wearing around. Great for traveling.,Good all around shirt,5.0,B0002XSXWW
"I ordered this product on a saturday and I received Monday, couldn't believe it came so fast and it was the exact product I was looking for. Would do business anytime with them.",Fast and Exact service,5.0,B0006U695E
Have not received latest 2 items mailed. The 1st was sent last month w/other 2 same items to be shipped later but still no pkg.  Way too slow & where is latest pkg supposedly shipped?,Haven't received items?,1.0,B0006U695E
"I'll admit, I'm 28 years old and very skinny so I can wear these.  Compared to the baggy hip hop jeans and the relaxed fit jeans that middle-aged pale skinned office workers wear these are the anti-Christ.  But dang does my posterior look good!  Warning do not attempt to wear with your loose boxers, briefs, form fitting boxer briefs, or a thong is a must.",Cowboy Up!!!!!!!!!!!!,5.0,B0006U695E
"If you are used to Levi's or the regular Wrangler jeans, here's some help in choosing a the right fit for this. This jean is the ""slim"" version of classic Cowboy Cut jean that Wrangler has been making since 1947. Among the Levi's jeans, the fit of this jeans is most similar to that of the Levi's 512,but it is cut slimmer in the seat. It doesn't have as much orange stitching as a Levi's, the back pockets sit higher. It has a zipper fly. The so-called ""rigid denim"" looks a lot like the ""shrink to fit"" rigid denim of the Levi's button fly 501 when new and will lose a lot of indigo dye on the first wash, but that's where the resemblance ends. The 501 shrinks about 10%, but the Wrangler shrinks less than 3%, because it is Sanforized. But, since even 3% shrinkage adds up to almost a full inch on a 32 waist, you should probably go up one inch to play safe.

The the really neat thing about the Wrangler is that they still have copper rivets on the back pockets, something Levi's stop doing generations ago when schools complained that the rivets scratched the wood desk chairs the school kids used to sit in!

Compared to the regular the Wrangler Cowboy Cut, the this slim Fit is quite a bit skimpier. The slim fit seat is smaller and the legs are pretty trim--it's more of a boy's cut. If you are really on the thin side, it may work for you, but many men will find it too constricting in the waist and seat.

Wranglers stonewash finishes are pretty mainstream compared to some of the more exotic things Levi's is doing now. These definitely are not so-called ""destructed"" jeans. You won't find whiskering or abrasion the way you will on the stonewash Levi's.

Overall, these are very solid well-made jeans that offer a nice alternative to the more popular Levi's models. Like Levi's, they are well made and indestructible.",Excellent Jeans.,5.0,B0006U695E
"The rise in this pair of jeans was very different than that of all the other Wranglers I have.  As a result, I had to take them to a tailor and have them shortened by 1 1/2 inches.",Wangler Slim Fit Jeans,3.0,B0006U695E
I bought these for my husband. He is hard to shop for because of the odd sizes he needs for a good fit. These jeans fit him perfectly and he says they are very comfortable. The jeans shipped fast and arrived in good shape. I would highly recommend these jeans for anyone needing good well made jeans at a decent price.,Wrangler slim fit jeans,5.0,B0006U695E
"Amazon will beat prices, this is the only jean my husband fits and he will wear wrangler men's cowboy cut slim fit jeans.  very good!",wrangler jeans,5.0,B0006U695E
Luv these. Great fit,Great,5.0,B0006U695E
My older pair of 936 slim fit were a true fit. These newer 936 are a little baggy.,Had to wear a belt,3.0,B0006U695E
"Color and fit is what I most liked, super; and thats all that matters; :-); although I WANT ONE MORE INCH OF LEG OPENING.
The least I liked: seems the jean had a little rip on the lower back side of the right leg, which had been stitched; something that I realized only after wear it 3 or 4 times. See photos, outside first, then on leg interior.","ONE, ONLY ONE MORE INCH OF LEG OPENING. Still, I love this jean.",5.0,B0006U695E
He loves them!,Five Stars,5.0,B0006U695E
true to size,Five Stars,5.0,B0006U695E
"Very well made, however found them to be sized smaller than stated, Great quality and well made.",Great quality and well made,4.0,B0006U695E
Sexiest pair of jeans hands down! And hubby still rocks the same size he did in high school! thank you Wrangler for not trying to fix something when it wasn't broken. Best jeans available for men!,Wrangler Rules!,5.0,B0006U695E
"Let me start by saying that these jeans are rugged. The rigid denim is scratchy, tough, and startched to hell; but they sure break in nicely after a hot soak. These are classic cowboy jeans. All the rough working men have a pair out where I live, & I can see why. Ive been putting mine through the ringer now for the last few months and I am beyond satisfied with these jeans. They fit nice; ladies love how my butt looks; and they're wearing in nicely. They do fit much smaller than your traditional Levis. Im normally a 30x32 in my 505s, but I had to get a 32x32 in these 936DENs. I recommend wearing them a few weeks at a time between washes to not wear them out so quickly.

Made In Mexico",Classic Denim,4.0,B0006U695E
"Great fit, cut, and style",Five Stars,5.0,B0006U695E
Both pairs are defective.  One has one leg two inches shorter and both legs are shorter than other pairs of Wranglers I own in the same size.  The other pair is an inch smaller in the waist than normal.,These jeans are too small!,1.0,B0006U695E
Perfect,Five Stars,5.0,B0006U695E
a great product at a good price.,Five Stars,5.0,B0006U695E
"33 waist a bit tight
Ill return",Three Stars,3.0,B0006U695E
Great fit.,Five Stars,5.0,B0006U695E
They fit fine. But the zipper broke the second day I wore them. So Im not that happy at all with them honestly,They fit fine. But the zipper broke the second day I ...,1.0,B0006U695E
"Excellent jeans, came up perfectly. I also bought them in a different color.",Five Stars,5.0,B0006U695E
"The pants are fine but they are not slim fit in my opinion. They look and fit like ordinary jeans, loose. I guess slim is not what it used to be.",not slim fit,4.0,B0006U695E
Good Product,Five Stars,5.0,B0006U695E
I'll definitely purchase from you again.  Quality of product is excellent and the fit was perfect for my friend.  The fast delivery was unexpected and delightful!,Great Service & Product,5.0,B0006U695E
It is a perfect fit.,Five Stars,5.0,B0006U695E
"Unlike the Levis 517 which now fits substantially looser than they did 15 years ago, the Wrangler 936 slim fit jean fits the same way it always has for the last billion years and they have never lowered the quality.  If you ran these jeans over with a lawn mower, you'd need to buy a new lawn mower,  enough said",The best jeans out there today,5.0,B0006U695E
"Great trousers but as expected with Wranglers, run a little tight in the thighs and seat. I ordered a size up in the waist from my usual size and they fit perfectly.",Run a size too small but very nicely made.,5.0,B0006U695E
"The jeans are very stiff. Even though I have washed them several times, they stay stiff and get very winkled in the wash.  You have to iron them just to get the wrinkles out and soften them up.",The jeans are very stiff. Even though I have ...,3.0,B0006U695E
love this jeans...wonderful color and fit perfectly with my boots.,Five Stars,5.0,B0006U695E
Ive been wearing this exact style for 20 plus years. I cant imagine wearing any other style.  Im a rancher and I put to work everyday and they hold up and last years for me!!,Ive been wearing this exact style for 20 plus years ...,5.0,B0006U695E
this item was bought as a Christmas gift and they loved it with no complaints.,... item was bought as a Christmas gift and they loved it with no complaints,5.0,B0006U695E
"The material is wonderful, however these run small and tight.",Three Stars,3.0,B0006U695E
what I needed,Five Stars,5.0,B0006U695E
Satisfied,Five Stars,5.0,B0006U695E
,Five Stars,5.0,B0006U695E
Item was exactly as expected.  Not a secondary product.  Good quality!,Good quality!,4.0,B0006U695E
quick delivery....product as described......A+,quick delivery.... product as described. ...,5.0,B0006U695E
Waist fits good but to loose in the seat and legs,Three Stars,3.0,B0006U695E
"legs were too long, even though they measured to 32 ?",Three Stars,3.0,B0006U695E
The right fit for me! Not as stiff as un-prewashed.,Five Stars,5.0,B0006U695E
Very stiff and tight in the crotch area. A bit small for this reason,Three Stars,3.0,B0006U695E
Wrangler can't be beat,Five Stars,5.0,B0006U695E
https://www.amazon.com/dp/B0006U69OA/ref=cm_cr_ryp_prd_ttl_sol_2,https: //www. amazon.,3.0,B0006U695E
Luv these. Great fit,Great,5.0,B0006U68Z0
My older pair of 936 slim fit were a true fit. These newer 936 are a little baggy.,Had to wear a belt,3.0,B0006U68Z0
"Color and fit is what I most liked, super; and thats all that matters; :-); although I WANT ONE MORE INCH OF LEG OPENING.
The least I liked: seems the jean had a little rip on the lower back side of the right leg, which had been stitched; something that I realized only after wear it 3 or 4 times. See photos, outside first, then on leg interior.","ONE, ONLY ONE MORE INCH OF LEG OPENING. Still, I love this jean.",5.0,B0006U68Z0
He loves them!,Five Stars,5.0,B0006U68Z0
true to size,Five Stars,5.0,B0006U68Z0
"Very well made, however found them to be sized smaller than stated, Great quality and well made.",Great quality and well made,4.0,B0006U68Z0
Sexiest pair of jeans hands down! And hubby still rocks the same size he did in high school! thank you Wrangler for not trying to fix something when it wasn't broken. Best jeans available for men!,Wrangler Rules!,5.0,B0006U68Z0
"Let me start by saying that these jeans are rugged. The rigid denim is scratchy, tough, and startched to hell; but they sure break in nicely after a hot soak. These are classic cowboy jeans. All the rough working men have a pair out where I live, & I can see why. Ive been putting mine through the ringer now for the last few months and I am beyond satisfied with these jeans. They fit nice; ladies love how my butt looks; and they're wearing in nicely. They do fit much smaller than your traditional Levis. Im normally a 30x32 in my 505s, but I had to get a 32x32 in these 936DENs. I recommend wearing them a few weeks at a time between washes to not wear them out so quickly.

Made In Mexico",Classic Denim,4.0,B0006U68Z0
"Great fit, cut, and style",Five Stars,5.0,B0006U68Z0
Both pairs are defective.  One has one leg two inches shorter and both legs are shorter than other pairs of Wranglers I own in the same size.  The other pair is an inch smaller in the waist than normal.,These jeans are too small!,1.0,B0006U68Z0
Perfect,Five Stars,5.0,B0006U68Z0
a great product at a good price.,Five Stars,5.0,B0006U68Z0
"33 waist a bit tight
Ill return",Three Stars,3.0,B0006U68Z0
Great fit.,Five Stars,5.0,B0006U68Z0
They fit fine. But the zipper broke the second day I wore them. So Im not that happy at all with them honestly,They fit fine. But the zipper broke the second day I ...,1.0,B0006U68Z0
"Excellent jeans, came up perfectly. I also bought them in a different color.",Five Stars,5.0,B0006U68Z0
"The pants are fine but they are not slim fit in my opinion. They look and fit like ordinary jeans, loose. I guess slim is not what it used to be.",not slim fit,4.0,B0006U68Z0
Good Product,Five Stars,5.0,B0006U68Z0
I'll definitely purchase from you again.  Quality of product is excellent and the fit was perfect for my friend.  The fast delivery was unexpected and delightful!,Great Service & Product,5.0,B0006U68Z0
It is a perfect fit.,Five Stars,5.0,B0006U68Z0
"Unlike the Levis 517 which now fits substantially looser than they did 15 years ago, the Wrangler 936 slim fit jean fits the same way it always has for the last billion years and they have never lowered the quality.  If you ran these jeans over with a lawn mower, you'd need to buy a new lawn mower,  enough said",The best jeans out there today,5.0,B0006U68Z0
"Great trousers but as expected with Wranglers, run a little tight in the thighs and seat. I ordered a size up in the waist from my usual size and they fit perfectly.",Run a size too small but very nicely made.,5.0,B0006U68Z0
"The jeans are very stiff. Even though I have washed them several times, they stay stiff and get very winkled in the wash.  You have to iron them just to get the wrinkles out and soften them up.",The jeans are very stiff. Even though I have ...,3.0,B0006U68Z0
love this jeans...wonderful color and fit perfectly with my boots.,Five Stars,5.0,B0006U68Z0
Ive been wearing this exact style for 20 plus years. I cant imagine wearing any other style.  Im a rancher and I put to work everyday and they hold up and last years for me!!,Ive been wearing this exact style for 20 plus years ...,5.0,B0006U68Z0
this item was bought as a Christmas gift and they loved it with no complaints.,... item was bought as a Christmas gift and they loved it with no complaints,5.0,B0006U68Z0
"The material is wonderful, however these run small and tight.",Three Stars,3.0,B0006U68Z0
what I needed,Five Stars,5.0,B0006U68Z0
Satisfied,Five Stars,5.0,B0006U68Z0
,Five Stars,5.0,B0006U68Z0
Item was exactly as expected.  Not a secondary product.  Good quality!,Good quality!,4.0,B0006U68Z0
quick delivery....product as described......A+,quick delivery.... product as described. ...,5.0,B0006U68Z0
Waist fits good but to loose in the seat and legs,Three Stars,3.0,B0006U68Z0
"legs were too long, even though they measured to 32 ?",Three Stars,3.0,B0006U68Z0
The right fit for me! Not as stiff as un-prewashed.,Five Stars,5.0,B0006U68Z0
Very stiff and tight in the crotch area. A bit small for this reason,Three Stars,3.0,B0006U68Z0
Wrangler can't be beat,Five Stars,5.0,B0006U68Z0
https://www.amazon.com/dp/B0006U69OA/ref=cm_cr_ryp_prd_ttl_sol_2,https: //www. amazon.,3.0,B0006U68Z0
loved,Five Stars,5.0,B0006U68Z0
They were a perfect and were received promptly,Exactly what I ordered!!,5.0,B0006U68Z0
"I bought these for my husband.  He almost never complains about clothes and said these were way too stiff.  I've bought jeans for him in this exact size in other brands and he never had issues with them being too small.  I could see them being fine once you wash them a dozen times wear them around everywhere, but in our case, it was better to return them and buy another pair because the size seems way off.",too small and stiff,1.0,B0006U68Z0
Just as described and the best part was I didn't have to leave the house :),Five Stars,5.0,B0006U68Z0
"ordered a 32"" length and got 33"" plus! No quality control at all!  32`s are a push for me in length so 33 + SUCKS!",No Quality Control,1.0,B0006U68Z0
"Great looking, great fitting jeans.  They were a little stiff and snug at first but feel great after washing.  My only complaint with Wrangler jeans is that I wish the front pockets were a little deeper and easier to get into.  I'm willing to put up with that in light of the great look and fit.",My Favorite Jeans for Boots,5.0,B0006U68Z0
"I bought these because they don't sell black cowgirl cut jeans and I love them but they definitely are made for men. Little tight around the hips, so if any women are reading just be warned. They do stretch out and they fit great over my boots.",... they don't sell black cowgirl cut jeans and I love them but they definitely are made for men,5.0,B0006U68Z0
These shorts were perfect for workouts and looked good enough to wear in all casual settings. They washed perfectly with no shrinking. Highly recommend them to all.,Great Quality Shorts,4.0,B000783Z7A
These shorts are awesome...Fit like they are suppose to...wish they had more colors though,AWESOME BABY,5.0,B000783Z7A
The shorts are outstanding.  I have been wearing the same brand of shorts for over 4 years.  They fit well and wear like iron.,Theair my favorite.,5.0,B000783Z7A
Well made and fit as expected.,Five Stars,5.0,B000783Z7A
great price and very tough,Four Stars,4.0,B000783Z7A
I've tried a few different pairs of shorts out on Amazon.  These are fantastic -- they fit well and are comfortable.,Great.,5.0,B000783Z7A
Nice athletic shorts for comfortable wear around the house. They fit perfectly.,Recommended Athletic Shorts,5.0,B000783Z7A
Little pricey,Four Stars,4.0,B000783Z7A
Great,A++,5.0,B000783Z7A
I Luv  it they fit prefect !,5 Stars!!,5.0,B000783Z7A
"Fits well, has a nice hand.  Light, and wicks nicely.  If you can deal with the price, buy 2 pair.",has a nice hand. Light,4.0,B000783Z7A
Great shorts. I have several pairs of these in different colors. I'm 6'2 390 so I'm a big dude and the 4X big size fits great. The pants like these are also great if your in colder weather or like pants.,Great shorts. I have several pairs of these in ...,5.0,B000783Z7A
Very Good set of shorts.  The pair I had before fit looser in the legs and weren't so long but they don't make those anymore.  Either way these are a great set of shorts and I wear them daily,Great set of shorts,4.0,B000783Z7A
great quality,Five Stars,5.0,B000783Z7A
"Love these for working out.  If I can get them on sale, they're my favorite.  Light, move easily, and dry quickly.  The tough part is finding them discounted enough to get past my cheap filter.",Love these for working out,5.0,B000783Z7A
"My brother in law loved them, very comfortable.",Four Stars,4.0,B000783Z7A
Great,Five Stars,5.0,B000783Z7A
Love everything about these shorts. Already purchased another pair in a different color.  Need more variety of colors.,Great buy.,5.0,B000783Z7A
