reviewText,summary,rating,asin
"The shirt fit well, a little scratchy tho. What I do not like about the shirt is how wide the end of shirt is. The sleeves are reasonably long with slack but the base of the shirt is very short and wide",Nice plain long sleeve but made for short wide individuals,3.0,B0002X4HTK
I love the fabric and the shirt doesn't easily get loose after repeatedly washing and wearing it,I love the fabric,5.0,B0002X4HTK
Nice quality of cotton.,Four Stars,4.0,B0002X4HTK
"Its very nice, I love wearing it almost anywhere, the fit is perfect and the feel of the fabric on my body is very warm",very nice,5.0,B0002X4HTK
"i love the fitting and the color. i am so satisfied to have this one. what an awesome find indeed, i really love it. great find! i did not even expected it to be this nice.",awesome find,5.0,B0002X4HTK
The fit is really good and the length is great for long and tall people,great for long and tall people,5.0,B0002X4HTK
well thread and the type of fabric uses is in good quality. Great buy,Great buy,5.0,B0002X4HTK
great product for a good price,classic long sleee T shirt,4.0,B0002X4HTK
Fit weird,One Star,1.0,B0002X4HTK
"Great shirt, but this 2XL was WAY too big.  My husband is a 2XL in most Tommy Bahama, but this was like a dress.  Great quality though.","Great shirt, but this 2XL was WAY too big",4.0,9828381591
"These jeans run a little small and the fit is tight....my teen grandsons think it is ""cool""....the grandson I purchased them for could not wear them because they ran a little small, but his younger brother felt really lucky because they fit him.

A good buy for young males that have slim frames...not for the more mature male.",Tight fit!,4.0,B0006LBXUE
"I bought these jeans because they were so inexpensive, I thought it was worth the gamble.  Little did I expect they would be the best jeans I own!  I love the look, the linen blend, the fit AND the price.  Perfect!",Amazing!,5.0,B0006LBXUE
"I had to respond to most of the other reviewers of 2(x)ist jeans, because I love them and think the sale price is the steal of the century.

These are LINEN JEANS.  They are thinner than Levi 501's or regular thick jeans.  They're meant to be, and are great for warm weather or any time you're not mining gold.  These also have a low rise, like the name ""So Low Jeans"" would suggest, even though the rise isn't as low as some other jeans.

The waist size seems fine to me.  Based on previous reviews, I bought a size up but that was bad advice.  If anything, I'd recommend rounding down if you're borderline between sizes.  I normally wear between 29 and 30 waist and I bought 31 based on the recommendations; the 29 fits me perfectly.  I know stores like Wal-Mart or Target often cut their clothes VERY large, so if you're used to those sizes then adjust accordingly.

I think these jeans are great and have no major complaints.  The wash is inconsistent though; I bought two pairs of ""Banger"" jeans to make up for the waist sizing error and the washes looked almost completely different.  They both look good, though.  I'm guessing they are test marketing these jeans on Amazon (because I can't find any info on them anywhere else, including 2xist's own web site) so they might be tinkering with the formula a little bit.

Highly recommended to the slim and hip (or wannabe hip like me)",Incredible jeans.,5.0,B0006LBXUE
"I normally wear 32x32 jeans, so I was pleased when my 32x32 Dubliners fit perfectly. The styling was not as dramatic as in the pictures, and this also pleased me. My only complaint regarding the fit or looks is that the flare is a bit large. It's not too bad, though.

However, I have a major complaint with the durability of these jeans. The fabric is exceptionally thin; any time there is any stress on the seams, the stitches look like they're going to pop out. Plus, I wore them only once and there's already a hole in the fabric. Needless to say, I am not pleased.

Pros: Fit as expected, look cool, low price.

Cons: Exceptionally thin fabric, low durability.

Conclusion: These jeans aren't worth it, even for $20.",Not recommended -- low durability,2.0,B0006LBXUE
"I'd like make one point before reviewing these ""jeans"". They are LOW RISE jeans, meant to be worn on the HIPS. When you order, order your HIP SIZE, not your waist, otherwise you may be dissapointed to find that they do not fit you, or are one size too tight.

Okay, I ordered this with high expectations, considering it's from one of the leading designers for male underwear, but these jeans are a letdown compared to other products manufactured my 2(x)ist. Just as a poin of reference, I purchased this pair and the Banger style, from the same brand, same size. That last point is very important as the Dubliner seems to be an inch more loose and with an extra inch on the inseam, which is quite annoying. The Banger pair fits like a charm. There are quite a few cons I'd like to point out though.

One, the fabric is rather thin, and I was surprised to find the tag noting that it is 100% cotton. They feel (and smell, even) more like polyester, as hard as that is to believe. Two... They are rather soft for jeans, but they just don't have the feel or texture you would expect from denim. I'm not exactly satisfied with these jeans, not considering the difference in fit compared to the Banger pair. The wash itself looks alright, but the front has very many light specks which LOOK like pulled threads, which is a bad thing, although they just seem to be part of the style. As I wrote in my other review, I would call these faux jeans as opposed to authentic denim. The actual stitch seems rahter cheap as well. Aside from that, I would say 19.99 is a just price for the product, but it is definitely not worth the 128 retail. Why they even put that on the tag to begin with is beyond me. Concerning the durability... they DO seem built to last, though I have to admit, they can't possibly be as durable as higher grade denims.",You call these jeans??,2.0,B0006LBXUE
"I was a little skeptical of ordering jeans online, and them fitting correctly, but was pleasantly surprised with these (and also purchased the Hero design).

First off, the jeans are not very heavy.  There were 2 pairs of jeans in the box and it really felt like there was only one pair.

Normally I wear a waist in the 32-34 range, and the 33's fit like I had expected.  I would say to perhaps order one size up if possible.

I really like the design of the Dubliner's with a lighter blue at the top, going to a dark blue at the bottom.

The reason I'm giving this a 4 out of 5 is that I wish they would have had a 34 waist at the time I ordered, because I think it would have been a bit more comfortable, but I am still very pleased with the 33 waist.",Good jeans for the price,4.0,B0006LBXUE
Bought these for my husband.  He is a hard worker and these jeans are comfortable to work in for him.  Have bought 3 more for him.,He is a hard worker and these jeans are comfortable to work in for him,5.0,B0007CKM4A
NEEDS CELL  PHONE POCKET,Four Stars,4.0,B0007CKM4A
Great product.,Five Stars,5.0,B0007CKM4A
Good quality pants. Meant to get the tighter pair but still fit well.,Good quality pants,5.0,B0007CKM4A
"Love the jeans and they got there really quick!!!  My husband loved them!!!
Thank you so much",Five Stars,5.0,B0007CKM4A
My husband is pleas d with them.,Fit ....really important,5.0,B0007CKM4A
Love it!,Love it!,5.0,B0007CKM4A
They look and fit my husband very nice. He kids them they are his new favorite jeans. He even wears them out to dinner or to work. I will be purchasing more.,Nice fitting Jeans,5.0,B0007CKM4A
Great fit ! Perfect !  I love these jeans. They will last a long time. High Quality !!,Best Quality Jeans !!,5.0,B0007CKM4A
Fit was perfect.  Was afraid to order Jeans online without trying them on.  These fit perfect.,Fit was perfect. Was afraid to order Jeans online without trying ...,5.0,B0007CKM4A
comfy and durable. These are literally the only pants I will ever buy.,Five Stars,5.0,B0007CKLJG
Glad to find jeans that had a long enough inseam.,Five Stars,5.0,B0007CKLJG
Jeains fit great and look good,Five Stars,5.0,B0007CKLJG
What I was looking for.,Five Stars,5.0,B0007CKLJG
"I've been wearing these jeans for years. They fit great, look good, and last for a long time. I usually buy 6 pair at a time. Wrangler is The Cowboy jean!",Cowboy Jeans,5.0,B0007CKLJG
My husband loves these jeans,Five Stars,5.0,B0007CKLJG
great,Five Stars,5.0,B0007CKLJG
Good,Five Stars,5.0,B0007CKLJG
For my son...I order them every year!,For my son... I order them every ...,5.0,B0007CKLJG
"waist line was somewhat smaller than expected
probably due to the washing
rest of the fit was top notch",Three Stars,3.0,B0007CKLJG
good jeans,pants! pants de le on,5.0,B0007CKQ96
"These fit like I had hoped they would, and they are made of very heavy denim which was a surprise",These fit like I had hoped they would,5.0,B0007CKQ96
Fit just right,Fit good,3.0,B0007CKQ96
this is ripped already. these were an awful quality of jean,One Star,1.0,B0007CKQ96
"Even though these jeans are made of quality material, they are not cut same as they were years ago. It took three tries from the same manufacturer to get the fit sort of right. What should have been the correct length was to long, what should have the correct waist was to tight. So on the third attempt went up one size in the waist and shorter in the length and its still not right. So I figure at this point I'll just run it through the washing machine it a few times at it'll fit right by then. Price wise, this was the best on the internet with the least amount of hassle.",Mediocre,3.0,B0007CKQ96
its wrangler enough said,Four Stars,4.0,B0007CKQ96
"I keep coming back because I love the fit and feel but the last two pair I purchased were trash within three months. First pair the zipper stopped staying closed, second pair completely split at the seem in the crotch after about ten wears.",I keep coming back because I love the fit and feel but the last two pair ...,1.0,B0007CKQ96
I am having a hard time finding jeans that allow me to move more freely and not feel like they bind up and these are a decent pair of jeans. But I am still looking for a better pair.,These are not a bad pair of jeans,4.0,B0007CKQ96
Nice quality fits perfect!,My husband loves this shirt!,5.0,B0007XOF1A
"Love the shirt but it is too small. I say this because I compare it with shirts I have bought for my husband (and his brother) from Tommy Bahama, Ross Sutherland and other men's stores. I am returning this to get a larger size. Otherwise, it was very well made, the fabric is lovely and the colors just as vivid as seen in the photo on Amazon.",Great Shirt but Runs Small,5.0,B0007XOF1A
"Color same as picture.
Was just what I wanted.
Turned it into a A's shirt looks great.",will buy from seller again,5.0,B0007XOF1A
"My husband loves this shirt. Fits great, wears well and is well made.","Fits great, wears well and is well made",5.0,B0007XOF1A
I bought this for the person who really likes Hawaiian shirt. He says it is hard to find Black Hawaiian Shirt in Japan. So I finally found it here and gave it to him. He loves it. This is also affordable price.,very good for the person who likes Hawaiian shirt,5.0,B0007XOF1A
"Classic Dickies, well made.  Nice to locate a pair in white.",Nice to locate a pair in white,5.0,B00091T0N8
100% authentic and well priced. Lots of color options is my favorite thing.,Lots of color options is my favorite thing.,5.0,B00091T0N8
Ok,Four Stars,4.0,B00091T0N8
Like I said I will buy my work clothes from east coast jeeps they are awesome,Five Stars,5.0,B00091T0N8
"Took an hr to iron our the creases. Very thick material. Overall, nice",nice,4.0,B00091T0N8
Thanks!,Five Stars,5.0,B00091T0N8
I love these shorts and they fit as expected.,Five Stars,5.0,B00091T0N8
Have about six or seven of these. Love the classic look and the below the knee fit.,Love the classic look and the below the knee fit,5.0,B00091T0N8
I ordered these for someone that has not been able to find white shorts for the summer and the Dickies are his favorite.....they are perfect.,... shorts for the summer and the Dickies are his favorite..,5.0,B00091T0N8
"Dealing with East Coast Jeeps was extremely difficult.
Over a pair of Dickies that was too large.
Beware!",Frustrating.....,2.0,B00091T0N8
My son needed white shorts for his community service at our local hospital. These shorts fit perfectly and were nice and durable. Very pleased with the quality of this product and the service of the seller.,Great Quality Dickies Shorts,5.0,B00091T010
Did not fit,One Star,1.0,B00091UO4M
Waist sizes run small.,Waist sizes run small.,3.0,B00091UO4M
Husband loves them.  Plan on purchasing another pair!,Great work pants for painters!,5.0,B00091UO4M
To big but nice,Four Stars,4.0,B00091UO4M
too small,too small,2.0,B00091UO4M
There were too tight legs and side,One Star,1.0,B00091UO4M
Thank you. Fit great and was on time.,Fit great and was on time,5.0,B00091UO4M
"Basically like wearing sand paper, fashionable sand paper. Oh well",Two Stars,2.0,B000922WFU
Way too small I ordered to differ types of dickies shorts the black pair I bought fits correctly. This pair is way past my knees and I can't get it around my waist. I'm a tall guy at 6ft 4inch and these were still too long.,Way too small I ordered to differ types of dickies ...,2.0,B000922WFU
Love the fit,Five Stars,5.0,B000922WFU
Dickies  shorts are a great buy with a comfortable fit and being a light color you don't have worry about them getting saints even after being washed they still look as good as before.,great pair of shorts,5.0,B000922WFU
"The explanation/description for the size and fit was too vague to determine the correct size for ordering.  I wear a 38/40 in most true-to-size items. Because of a size description issue, the 44's that I ordered wouldn't fit even if I put suspenders on them.  However, Amazon and BareBones Workwear were more than will to accommodate an return/refund of shipping.  I reordered a 40 a few days ago, we'll see how that works.

April 14:  brown and black arrived
size 40 (perfect fit and looks awesome with sneakers or casually dressed up. Overall, I like them, if you don't like wide leg shorts, yo may want to go with regular fit Dickies, that fit more like slacks.",Looks great!!,4.0,B000922WFU
"Excellent Product! Professional Handleing!! I am a very satisfied customer, and I will do business with again!!!
Many Thankx",Dickies,5.0,B000922WFU
"Shorts are great, fits as expected and no issues with product itself but despite the fact that I paid for shipping through Amazon I had to pay 6.92 at the post office in order to pick up my package.",Shipping?,2.0,B000922WF0
Just what I was looking for and for the reasonable price. Will order more at the time needed.,Five Stars,5.0,B000922WF0
"Luv the color, luv the lose feeling and the come right below my knees like I like.",luv the lose feeling and the come right below my knees like I like,5.0,B000922WF0
Excellent,Five Stars,5.0,B000922WF0
"for some reason it runs kind of small, it fits like its 2 sizes smaller then all my other dickies",great deal!!,5.0,B000922WF0
As expected,Four Stars,4.0,B000922WF0
Good,Four Stars,4.0,B000922WF0
"Fit great, universal style, extremely durable . These shorts take a beating and work like a charm. I personally love them in white the most, however I scotch guard them to keep them in pristine condition.",Love this style short,5.0,B000922WF0
Have been wearing them consistently since purchase. The small pocket on the leg easily fits my phone. Quite happy with these shorts,Great shorts,5.0,B000922WF0
I had looked high and low for these shorts.  I messed up my husbands pair in the laundry and he act like it was ok but I knew better.  He has these shorts in 5 colors and of course white was his favorite for summer.  That's again for having them available to me.,Great Shorts,5.0,B000922WF0
Love it. It's a great holiday shirt that doesn't really look like a holiday shirt. Very subtle.,Five Stars,5.0,9789839685
A review indicated that the shorts ran small so order extra size up.  We did and the shorts are way too big.  We will keep them anyway and they seem like if we had the right size that would work well.,We will keep them anyway and they seem like if we had the right size that would work ...,3.0,B000A22DOY
Sizing is completely wrong plus it's made weird so doesn't fit properly. Complete waste of product. Would not recommend it to anyone,Complete waste of product,1.0,B000A22DOY
"Waist is really poorly cut.  How about a drawstring or draw-webbing?  And cut the waist about four inches higher?  On the plus-side, these are the only neoprene shorts big enough around for my phat-butt.  Unfortunately, they are still unwearable.",Poorly cut.,2.0,B000A22DOY
It was the wrong size I sent it back. I didn't receive the right size.,Wrong size Neoprene training shorts.,3.0,B000A22DOY
These things are super uncomfortable... they work but I'm just going to stick to sweat pants and a neoprene belt.,These things are super uncomfortable.,2.0,B000A22DOY
WAS DISAPPOINTED NOT TO GOOD,Three Stars,3.0,B000A22DOY
incredible,Five Stars,5.0,B000A22DOY
"Too big in the waist, can't keep them up when trying to work out!",Two Stars,2.0,B000A22DOY
"They are miss sized  There is no way the will fit a 42-46 inch waist.  I have a 46 inch waist and the shorts were almost too big.  I tried exercising with them and had to continually pull them up until I was about 25 minutes in the routine.  My body sweat than caused them to adhere without having to pull them up any further.  Since my goal is to lose inches around my waist, they are totally useless.",Miss sized,1.0,B000A22DOY
It come bigger than what it is. I was not a me to fit and I am size 29 :( and I ordered the smallest one.,Big!,1.0,B000A22DOY
I buy these again and again.  Comfortable fit.,Comfortable fit,5.0,B000AD394Q
"I wasn't expecting much for the price, but they still disappointed me. They are very constricting around the legs, and are abrasive on the skin. I only wore them once and threw them out.",Uncomfortable and constricted cut,2.0,B000AD394Q
"Nothing negative to say about these shorts. They're a little thicker than I thought. This is not negative in any way, just my expectations. For some, that could be a bonus. Over all, the purchase was fine.",workin' just fine,5.0,B000AD394Q
"It seems all active wear manufacturers/sellers have given up quality to maintain price and this is also true of Champion.  Not the same quality of material as the same short at the same price a couple of years ago, but it is as advertised and as expected.  A much better quality than Hanes which now has very flimsy knitwear",As Advertised,4.0,B000AD394Q
"I bought for workouts and are flexible (elastic) and not fitted to body ... then I realized I had to have more. They are good for being at the gym, home, or even sleeping. The pockets are useful since they are at both sides and made of the same fabric. I had put a wider elastic waist but the one it comes with is fine. For my height, they are good since it goes down to the lower thigh. Colors are very decent. Now I have 4.",Good Fit for several occasions,4.0,B000AD394Q
"I bought these for my husband for sleepware.  He finds the material is too heavy and coarse.  He, also, doesn't like the waiste band as the rubber lining rubs against his stomach. I don't plan to get him another pair.",Rugby Pants,1.0,B000AD394Q
Great shorts for exercising. Thick and long enough to keep from seeing up legs during exercise.,Champion Mens's Rugby Short,5.0,B000AD394Q
"I bought these and 2 pair of Russell at the same time to compare. I found the Russell preferable with just a little softer material and seam stitching as well as little bit loose fit in the seat. Russell also has a printed logo compared to the embroidered Champion (which feels like a small hard scab on the otherwise soft material).  These were comfortable and fit well and they've worn well for the last 4 months. For me though, I like the Russell slightly more.",adequate,3.0,B000AD394Q
The shorts arrived on time and were the quality and fit expected.  Well done.,As Expected,5.0,B000AD394Q
I would purchase these again.  My husband loves them and says they are extremely comfortable,Wonderful Champion shorts,5.0,B000AD394Q
"Great, durable shorts. Fantastic color",These will last a loooong time! Aftco makes the best shorts,4.0,B000BBG624
"My son loves these shorts.  While I think they're overpriced, they are well made and hopefully will last a while",Son loves these,5.0,B000BBG624
I hesitated buying these shorts due to price but after buying the first pair.  I ordered 2 more!  They are very well made and are very comfortable.  I have no doubt they will hold up well.  The pliers pocket is a neat feature that has a reinforced layer to keep the shorts from tearing.  Very nice short.  I got the long and like where they land on my lower thigh.  I am a big guy and the 46 fit perfectly.,My first pair and already bought 2 more because of quality,5.0,B000BBG624
"These are my GO TO fishing shorts.  I wear them ALWAYS when surf or bay fishing.  They hold everything needed.  I'll say it here...bait smells, blood stains, and dirt wash right out!  These are the perfect fishing shorts.  Also, they dry quickly (when necessary).  I'm a huge fan of these.  Yes, I wish they were less expensive BUT YOU GET WHAT YOU PAY FOR.  These are worth every penny.","It's OK to PAY, They are WORTH IT",5.0,B000BBG624
Perfect fit -- will purchase several more,Excellent Fit,5.0,B000BBG624
"The Best most durable, fastest drying, most comfortable and longest lasting shorts I have ever owned. And I ware them everyday for work in Florida in a Towing business....",SHORT STORY !!,5.0,B000BBG624
"Get em, they last forever. I have 25 pair (no joke) the oldest pair are 12 yr old and finally about to be toast. Love em",You will never buy other shorts!!!!,5.0,B000BBG624
Fantastic quality and functionality - nice material - properly sized,Worth the Price,5.0,B000BBG624
My grandson loves his AFTCO Men's Long Fishing Shorts!!!!,One Star,1.0,B000BBG624
Shirt was a little big but who cares lol loved it ,Five Stars,5.0,B000BPHWN2
Brilliant shirt for price,Cheaper than buying at the show,4.0,B000BPHWN2
Nice,Three Stars,3.0,B000BPHWN2
Nice Fit. Nice graphic.,Four Stars,4.0,B000BPHWN2
"The fit on this shirt is awful. I've indicated it as too small, but it's both too small and too large. The neck is almost too small to get over my head and the sleeves, despite being billed as a short sleeved shirt, fit like a three quarter length baseball style shirt. It's like this shirt was made for some lanky hobbit with a small head.","Too small, too big - too bad",1.0,B000BPHWN2
"fit him a little snug, buy a size bigger for best fit",buy a size bigger for best,3.0,B000GBQ7LO
as expected,Five Stars,5.0,B000GBQ7LO
Really like this type of short but it is really hard to find and this one was perfect for me,Hard to find,5.0,B000GBS80M
"I bought them for the gym, but they ended up being a tad smaller than expected. So instead I use them for when I want to do my laundry including my undies I'm wearing.
Maybe also good for sleeping in...",Good for when your doing laundry!,4.0,B000GBS7V2
These shorts are cheap and snug. No pockets and absorbs no sweat. Literally only good for covering you up.,You get what you pay for!,2.0,B000GBS7V2
Pockets would make it better.,Four Stars,4.0,B000GBS7V2
Lil snug in waist. No pockets though.,Three Stars,3.0,B000GBS7V2
"Good quality shorts for lounging around in, and if you are OK with a minimalist design for training, these pants will be more than adequate.",Good quality shorts for lounging around in,4.0,B000GBS7V2
no pockets!,Three Stars,3.0,B000GBTSC4
PERFECT FIT AND WILL BE USED SOON.,Four Stars,4.0,B000GBTSC4
f,Three Stars,3.0,B000GBTSC4
"The only problem I have is they don't have pockets!! That is my fault, I was not paying attention, when I ordered them!!",The only problem I have is they don't have pockets ...,4.0,B000GBTSC4
a lot of light elastic in the band. comfortable.,good,4.0,B000GBTSC4
The inner waistband is rough on bare skin.,OK,4.0,B000GBTSC4
Looks good didn't wear yet!,Five Stars,5.0,B000GBTSC4
Waist band is too tight--It does not expand enough for me---I have limited strength in my hands.  Will give the Champion shorts to Goodwill.  Have purchased Russell brand and they meet my needs and allows me to use the disposable urinal bag,The product  does not fit for me - I am confined in power chair and need more expansion so I can  use a Travel John,2.0,B000GBTSC4
"the stem or stalk of it is too short, tried to mount on 4 wheeler, tractor & golf cart.... it was not tall enough to give you head clearance. other then that it was okay i guess.","the stem or stalk of it is too short, ...",1.0,B000GBQ7S2
Good product,Five Stars,5.0,B000GBQ7S2
"No pockets, otherwise they are ok",no pockects,2.0,B000GBQ7S2
"not what I expected, but I like them",but I like,3.0,B000GBQ7S2
nice fit,quality,5.0,B000GBQ7S2
perfect  fit!,Five Stars,5.0,B000GBV7QE
"although nice shorts, I did return them as they were not comfortable.",Four Stars,4.0,B000GBV7QE
Love the no-pocket design.,Five Stars,5.0,B000GBV7QE
"Very comfortable, fit perfectly. Breathe well.

They have worn very, very well since I purchased several pairs a few
months ago. I'll purchase more of them soon.",Very comfortable and durable.,5.0,B000GBV7QE
Love these shorts but theirs no pockets.,NO POCKETS,4.0,B000GBTS38
