reviewText,summary,rating,asin
"Originally purchased in July 2011. For over a year I thought this a 5-star suit. Then about six months ago the elastic started to go. Now the elastic is totally shot and the lining has pulled loose to the extent that it has lost it's function. Originally medium, the suit looks and feels like large now. I swim laps 3-5 times a week and rinse the suit thoroughly each time. No problem with fading, and the outer fabric seems to be wearing like iron. If you're not going to get more than 18 months out of a suit, save some $$$ with another brand. I'm replacing with a TYR suit for about $9 less.
12/2/14 Update. The elastic in the TYR suit that I got at the end of May 2013 gave out a few months sooner than the Speedo's, but I've just ordered another because I like the feel in the water. It's called a drag suit but you're barely aware of it when you swim. The Speedo feels like just too much material for lap swimming. I kept using the TYR by tightening the cord, but could never quite get it tight enough and eventually tore out the cord (this is #1 reason that I'm replacing it now). BTW the suit is totally faded. Was navy, is now silvery and sheer looking. Flesh shows thru the legs, but the liner is still good, so the privates are private enough. At this time the price difference is about $6 in favor of TYR.",Expected it to last langer,3.0,B000YT1VZ0
"I recently started swimming again, and this appears to be the only short pair of trunks on the market for workout/athletic swimming. I have, at present, a good 36 to 37 inch waist, and I just fit into the large size (so the size chart is pretty spot on). I like the freedom afforded by the short 14.5 (or so) outseam and 3.5-4 inch inseam. They're long enough to be modest but short enough to minimize the bulk. I wouldn't want them to be any longer.

Like my previous Speedo trunks, the fabric dries quickly, and the suit feels well-made. The only thing that would make it better is at least one pocket, should I have to use these at a hotel pool or other location without a locker room for storing a key or cash. I prefer board shorts at water parks.
I plan to buy another pair.",A nice pair of SHORT swim trunks,5.0,B000YT1VZ0
This is a nice quick drying suit for the guy who isn't trying to show off his package but likes to swim laps without feeling like he is dragging a diaper.,love it,5.0,B000YT1VZ0
"I do not like the long lengths on swim shorts and these are a better length, comfortable and have held up with regular swimming at my gyms heavily chlorinated pool and being put in a spinning swim suit dryer on an regular bases.",Good Swimmers,5.0,B000YT1VZ0
"Ordered the item based on the picture becasue I have owned a pair before.  Received a totally different style, although they were the same brand.",Picture doesnt match product,1.0,B000YT1VZ0
"This is a great suit for someone who doesn't want a speedo brief. No pockets to create drag if you swim distnace.
The polyester is colorfast and one of the only suits that I have gotten that doesn't rot in < 3 months of daily use, in either salt or clorine pools.",Colorfast and durable,5.0,B000YT1VZ0
"I'm an older guy who never got used to baggy, knee length swimsuits that cling to your legs when wet. Compared to the swimsuits I had been wearing, it seemed pretty short at first (the inseam is only about 3"") but it reminds me of the swimsuits I wore as a teen. I do like the shorter length and I especially like the feel of the fabric, its lack of cling and the quick drying of the water repellent fabric. So much so, I've ordered a second.",Great swimsuit,5.0,B000YT1VZ0
"John, what you want is the Speedo Roofer, Style number 7320167.  It has two normal front pants-type pockets and a  right rear hidden zip pocket, perfect for a drivers license, credit card and perhaps a bit of cash wrapped around it.

Otherwise the style is nearly identical to this one.  The store that sounds like a 1 cent coin used to stock it every year, but this year they're carrying something a little longer.

Update:  Now the Rally V Volley is the Speedo Trunk with two front pockets and a zipped back pocket.  The Roofer has been discontinued.  I think the Volley is 1"" longer than the Roofer (19"" vs. 18"", sigh.)  Why do folks think that shorts should hang down to the knees?

Dec. 10, 2012 Update:  The Rally or Rally Volley, both style number 7840110 is now the model with two front pockets and a zipped rear pocket.  The inseam is still 19"" instead of the Roofer's 18"".  The Surf Runner (7320256) has a 14"" inseam.  If only it had pockets.  Sigh.",The Speedo Roofer has pockets,4.0,B000YT1VZ0
Good fit.,Five Stars,5.0,B0012FQ5BK
Fits a little tight at the neck otherwise perfect.  Good weight. Does not get fuzz on the shirt underneath.,Very good shirt.,5.0,B0012FQ5BK
"Nice shirt , fit well enought . Not as bright after a few washings .",Does the job,4.0,B0012FQ5BK
This sweatshirt is of nice quality material. Not too thick and not too thin. Fits my husband perfectly. Highly recommend.,Good quality material,5.0,B0012FQ5BK
Love the shirt!,Five Stars,5.0,B0012FQ5BK
Just the right color for my husbands job and it will keep him warm on those very cold days .great,Construction,4.0,B0012FQ5BK
"economic material

Shirt line for use in the gym, but clarified that are longer than other shirts of the same size.

the article meets my expectations based on the price",economic material,5.0,B0015P9AFU
I purchased two of these shirts and I only wear them around the house as the neck line hangs very low and shows more skin than I care to display in public.,Too revealing,2.0,B0015P9AFU
"I bought several of these to wear to the gym to lift weights. Very comfortable, soft fabric. Good fit. A little revealing, but a classic bodybuilding look which is about as close to shirtless as most gyms allow these days (although they do cover the nipples), permitting very easy movement without any constriction of the arms and shoulders. For $9.95 apiece, they are a steal. 100% cotton is easy to care for, too: wash in the regular cycle, dry in the dryer.",Great Value,5.0,B0015P9AFU
"Wrong size I need to return, Not only the wrong size, you also shipped the wrong color. send me a return number",Wrong size wrong color,2.0,B0015P9AFU
"This workout shirt is just what I expected, inexpensive but still a great shirt. It's very thin and I've worn it about 10 times now and it is still in great condition. I would definitely recommend it.",Great Product,5.0,B0015P9AFU
"I can't find racer back tanks in stores, so I go online.  Here they are not over priced, as in some online stores.  They arrive very quicky, too.","Exactly what I wanted, at a great price.",4.0,B0015P9AFU
Good quality tank top. These are hard to find in stores in my area and well worth the price.,"Tank top Y back, Muscle shirt",4.0,B0015P9AFU
"I am very satisfied with the product I recieved and the smooth transaction.
thank you.",Very satisfied,5.0,B0015P9AFU
"Great for those that can wear it.  Need to be in good shape.  The stringer shows off the muscles your have (or don't have) from the gym.

Especially great for those with big lats.",Great stringer tank top,5.0,B0015P9AFU
Great Tee I'm just continuing to work out getting ready for summer,Five Stars,5.0,B0015P9AFU
Jacked tan juicy af,Jacked,5.0,B0015P9AFU
"Would liked a narrower strap and maybe a bit slimmer fit, but the product is well made and will operate fine during a workout.",Would liked a narrower strap and maybe a bit slimmer fit,5.0,B0015P9AFU
The fit and look of this muscle tank top are  great.  I will purchase this brand in the future!,THE ALL COTTON MATERIAL FEELS GREAT,5.0,B0015P9AFU
Fits great! Nice material.,Five Stars,5.0,B0015P9AFU
The Athletic-Cut Muscle Workout Tank Top I bought from Iwearit fits good and looks good! I am completely satisfied with this product!,Fits good!,5.0,B0015P9AFU
5 stars,Five Stars,5.0,B0015P9AFU
Great,Five Stars,5.0,B0015P9AFU
Material feels great!,Three Stars,3.0,B0015P9AFU
Okay fit but it definitely shrunk after a wash,Four Stars,4.0,B0015P9AFU
"Good shirt for price, I'm six ft athletic 180 lbs, large was perfect.",Four Stars,4.0,B0015P9AFU
Im so happy with my order I love it,Five Stars,5.0,B0015P9AFU
So nice,Five Stars,5.0,B0015P9AFU
I like the top but the size chart that they display  Was not that accurate if it fits me  to big,I like the top but the size chart that they display ...,2.0,B0015P9AFU
"Men wearing T-back shirts is not a thing yet. When looking in the stores for a nice tank top, I have to go to the women's section of stores which doesn't bother me anymore, but Amazon has a fairly decent choosing. I enjoy the look and feel of wearing T-back shirts. The skin on the back has more sun exposure and I enjoy the air flow without having to go topless.

I typically wear an XL for most shirts. If you are not very muscular, it might be a little loose. This shirt is built with a wider chest base so it's loose on a not so muscular guy. I did end up ordering another in L as well and it fit better. I still like how loose the XL shirt is for some occasions like at the pool or beach.",Nice Male T-Back Shirt Design.,5.0,B0015P9AFU
larger than expected,Four Stars,4.0,B0015P9AFU
"Way too small, cheap material. Doesn't rake returns, then I won't return it, or buy another.",Two Stars,2.0,B0015P9AFU
Great product.  Very satisfied,Five Stars,5.0,B0015P9AFU
Size L  5'11 180lbs athletic build,Fits great!,5.0,B0015P9AFU
Look good in my ,Five Stars,5.0,B0015P9AFU
"I like this tank ,bought it for working out,the only thing i don't like is it is way too long. I can have it shortened,but it is really unusually long for the size.",I like this tank,4.0,B0015P9AFU
"Comfortable tank, this one. Thanks!",Nice,5.0,B0015P9AFU
"Great value, perfect for workouts.",Five Stars,5.0,B0015P9AFU
"I love the tank top, it fits perfectly but the material is pretty thin.",Great for the price,3.0,B0015P9AFU
The  lwearit Traditional Athletic-Cut Tanktop M-BLK  fits great. It is lightweight but I like that when I'm working out. Also the tank covers my nipples so I don't know what all that talk is about. Buy it Work out in it and enjoy,Buy it Work out in it and enjoy,5.0,B0015P9AFU
"Yes, my big, bulging muscles are on public display with this slinky, stringy tank. I almost feel like ripping it off just to scare everyone at the gym once I get pumped up. Yeah... there's lots of chattering dentures when I walk into that senior fitness center ... :/","Big, big bulges...",5.0,B0015P9AFU
perfect,Five Stars,5.0,B0015P9AFU
best stringers online and ive gotten ALOT of them - experienced meathead,Five Stars,5.0,B0015P9AFU
"Looks good, great price and shipped quickly.",Five Stars,5.0,B0015P9AFU
"went by the size chart, bought a large... too large.... bought a medium... too big fine in the shoulders, way big in the waist. WE WILL NOT BE BACK",too big fine in the shoulders,1.0,B0015P9AFU
Great fit !,Five Stars,5.0,B0015P9AFU
"We had to shrink it a few times because the shirt is not true to size--it's bigger. But, it's fine now.",it's fine now.,3.0,B0015P9AFU
"It is way to small, possibly perfect for maybe a small person? I am confused because an XL is suppose to mean Extra Large not Small...
One star for soft material and because zero wasn't optional.",WTF?,1.0,B0015P9AFU
Nice workout tank top,Nice tank top,5.0,B0015P9AFU
A little baggier then i would have liked.,Three Stars,3.0,B0015P9AFU
Not good quality fabric,Not good quality fabric,1.0,B0015P9AFU
"Originally purchased in July 2011. For over a year I thought this a 5-star suit. Then about six months ago the elastic started to go. Now the elastic is totally shot and the lining has pulled loose to the extent that it has lost it's function. Originally medium, the suit looks and feels like large now. I swim laps 3-5 times a week and rinse the suit thoroughly each time. No problem with fading, and the outer fabric seems to be wearing like iron. If you're not going to get more than 18 months out of a suit, save some $$$ with another brand. I'm replacing with a TYR suit for about $9 less.
12/2/14 Update. The elastic in the TYR suit that I got at the end of May 2013 gave out a few months sooner than the Speedo's, but I've just ordered another because I like the feel in the water. It's called a drag suit but you're barely aware of it when you swim. The Speedo feels like just too much material for lap swimming. I kept using the TYR by tightening the cord, but could never quite get it tight enough and eventually tore out the cord (this is #1 reason that I'm replacing it now). BTW the suit is totally faded. Was navy, is now silvery and sheer looking. Flesh shows thru the legs, but the liner is still good, so the privates are private enough. At this time the price difference is about $6 in favor of TYR.",Expected it to last langer,3.0,B000YT1VZ0
"I recently started swimming again, and this appears to be the only short pair of trunks on the market for workout/athletic swimming. I have, at present, a good 36 to 37 inch waist, and I just fit into the large size (so the size chart is pretty spot on). I like the freedom afforded by the short 14.5 (or so) outseam and 3.5-4 inch inseam. They're long enough to be modest but short enough to minimize the bulk. I wouldn't want them to be any longer.

Like my previous Speedo trunks, the fabric dries quickly, and the suit feels well-made. The only thing that would make it better is at least one pocket, should I have to use these at a hotel pool or other location without a locker room for storing a key or cash. I prefer board shorts at water parks.
I plan to buy another pair.",A nice pair of SHORT swim trunks,5.0,B000YT1VZ0
This is a nice quick drying suit for the guy who isn't trying to show off his package but likes to swim laps without feeling like he is dragging a diaper.,love it,5.0,B000YT1VZ0
"I do not like the long lengths on swim shorts and these are a better length, comfortable and have held up with regular swimming at my gyms heavily chlorinated pool and being put in a spinning swim suit dryer on an regular bases.",Good Swimmers,5.0,B000YT1VZ0
"Ordered the item based on the picture becasue I have owned a pair before.  Received a totally different style, although they were the same brand.",Picture doesnt match product,1.0,B000YT1VZ0
"This is a great suit for someone who doesn't want a speedo brief. No pockets to create drag if you swim distnace.
The polyester is colorfast and one of the only suits that I have gotten that doesn't rot in < 3 months of daily use, in either salt or clorine pools.",Colorfast and durable,5.0,B000YT1VZ0
"I'm an older guy who never got used to baggy, knee length swimsuits that cling to your legs when wet. Compared to the swimsuits I had been wearing, it seemed pretty short at first (the inseam is only about 3"") but it reminds me of the swimsuits I wore as a teen. I do like the shorter length and I especially like the feel of the fabric, its lack of cling and the quick drying of the water repellent fabric. So much so, I've ordered a second.",Great swimsuit,5.0,B000YT1VZ0
"John, what you want is the Speedo Roofer, Style number 7320167.  It has two normal front pants-type pockets and a  right rear hidden zip pocket, perfect for a drivers license, credit card and perhaps a bit of cash wrapped around it.

Otherwise the style is nearly identical to this one.  The store that sounds like a 1 cent coin used to stock it every year, but this year they're carrying something a little longer.

Update:  Now the Rally V Volley is the Speedo Trunk with two front pockets and a zipped back pocket.  The Roofer has been discontinued.  I think the Volley is 1"" longer than the Roofer (19"" vs. 18"", sigh.)  Why do folks think that shorts should hang down to the knees?

Dec. 10, 2012 Update:  The Rally or Rally Volley, both style number 7840110 is now the model with two front pockets and a zipped rear pocket.  The inseam is still 19"" instead of the Roofer's 18"".  The Surf Runner (7320256) has a 14"" inseam.  If only it had pockets.  Sigh.",The Speedo Roofer has pockets,4.0,B000YT1VZ0
Good fit.,Five Stars,5.0,B0012FQ5BK
Fits a little tight at the neck otherwise perfect.  Good weight. Does not get fuzz on the shirt underneath.,Very good shirt.,5.0,B0012FQ5BK
"Nice shirt , fit well enought . Not as bright after a few washings .",Does the job,4.0,B0012FQ5BK
This sweatshirt is of nice quality material. Not too thick and not too thin. Fits my husband perfectly. Highly recommend.,Good quality material,5.0,B0012FQ5BK
Love the shirt!,Five Stars,5.0,B0012FQ5BK
Just the right color for my husbands job and it will keep him warm on those very cold days .great,Construction,4.0,B0012FQ5BK
I have ordered 9 off these shirts and only the original two were the same size. They were made from a good fabric so I ordered more. The next seven were all different sizes though they claim to be the same. They are made in 3 different countries. The fabric is cheaper. This mirrors the experience I had ordering other style t-shirts from Zorrel. The size you get is a complete crapshoot.,Beware of size variations.,2.0,B001FZJ2SU
Shipping was extremely quick. Wore product same day and held up great under ballistic vest in humid weather. Great quality. Will be buying more.,great product,5.0,B001FZJ2SU
"The shirt was purchased for my fiance'.  I ordered the size I normally order for him but this fit a bit tight.  He really liked it and still wore it.  He has asked for more like it, but I'll order a size up.  He said he liked not having to walk around in a soggy T-shirt, so it appears it did what it was intended to do.",Does the job,4.0,B001FZJ2SU
"Had purchased the same model, size (x-small) and color few times last year and they were perfect fit. Unfortunately in the recent purchase they are 2 inches wider and longer, and the sleeves are 1 inch longer.",inconsistent size,2.0,B001FZJ2SU
I already own 4 of them and ordered 3 more. That tells it all !!! I use them as pajama tops. You can pack several of them in your luggage as they are extremely light.,Comfortable and packable,5.0,B001FZJ2SU
"I wear this shirt when I'm riding my motorcycle b/c it's comfortable and sweat evaporate quickly. This is my second  order of these style shirts so I recommend buying a size larger then normal and after washing allow to air dry instead of dryer. My first order I purchased xL which is my normal size but the shirt was too short, i'm a man I don't wear short shirts lol. But that's my advice, wear whatever float your boat but if you want to feel comfortable buy a size bigger.",nice,5.0,B001FZJ2SU
"Ok, while I believe that these shirts are awesome, they sent me the wrong size and they cannot replace them because the correct sizes are not in stock.

Really?  Then why advertise online that they are?  Quit wasting my time.

Quality, they get 5 stars.
False advertising they get 0 stars.",Zorrel zero,3.0,B001FZJ2SU
"This is a very comfortable shirt to wear under a uniform. I work in a hot, grimy stuffy place and this shirt helps to make that more bearable.",Comfortable,5.0,B001FZJ2SU
Most big men don't order a 5X wishing a form fitting snug tee shirt.  At least I don't.  Wouldn't be bad were it not for that.  Cheap enough for sure.  It will do for layering.,Sized a bit small.,3.0,B001FZJ2SU
"I use this shirt for hiking and they are light weight and wick the mositure off as promised.
They are extreemly comfortable and feel good against your skin.",Awsome Shirt,5.0,B001FZJ2SU
"Talk about your trip down memory lane!

I rock these pants with some old school Reeboks from the thrift shop, and a Frankie Says Relax T-shirt!",Can't touch these,5.0,B001KW8E3M
"I love how these pants are perfect for expressing my love for my country. they totally match my truckers hat and my shirt which I turned into a vest.

I would just wish they came with some sort of adapter that would also mold my assault rifle on one side and a cup holder on the other side so i can take my big gulp on the go.","Loved them, but could be improved",4.0,B001KW8E3M
"I sent these as a gift to someone, selected a Medium upon check out, but the recipient received a Large. Thanks, sunshine casuals.

The pants are awesome, they just sent the wrong size.",Sunshine Casuals dropped the ball.,3.0,B001KW8E3M
"Quality material and looks great, but some of the stitching has come undone.  It was minor so I repaired myself.  I love the pants, but if anymore stitching come undone I will send them back.",Nice workout pants,3.0,B001KW8E3M
"Bought these for my sister for Christmas as she loves Rex Kwon Do.

Nobody will want a round house kick to the face while wearing these bad boys.",Great gift item!,5.0,B001KW8E3M
"Whatever you searched on amazon found you these.  Yes, you should buy these.  I have bought many things on amazon, these were bought for me.  I have been wearing them for many days in a row.  I wish I had two so that I could wear them wall they are in the wash.
I normally wear a medium (31 waste), but these are a large.  I am 6 ft. and they barely touch the bottom of my foot without shoes on.  It is easy to roll, but that makes them tighter.  The parachute part is perfect.  And the material is breathable and easy to move if you were going to work out.  But I have also worn them in 15 degree weather (I'm not saying I was toasty though).
The pockets do not stand out or get in the way.  Easy access.  I was worried because my galaxy note 2 is impossible to get in and out of pants with the case on.  But I wear these pants just because of how easy it is and how nice they feel.
Finally.. Merica",Do it,5.0,B001KW8E3M
"Great pants! I wore them to the gym and everybody loved them. A lot of compliments and envious stares. Matches perfectly with my ""winning"" shirt. My sister thinks they're stupid but I just tell her I cant hear her over the sound of my country being awesome. Murica.","Wore them to the gym, never had a better workout.",5.0,B001KW8E3M
"Great pants, everyone loved them. Would definitely recommend as a present for a guy. Just like the ones Rex has in Napoleon dynamite.",Best gift ever,5.0,B001KW8E3M
"""Trust me you don't want to get a round house kick to the face by someone wearing these!"" Rex from Napolean Dynamite",Round house,5.0,B001KW8E3M
"I bought these pants for my boyfriend, and he says that they're, ""a little less parachute-y than I'd like,"" but he still loves them! They're soft and comfortable and he's been wearing them as pajamas and around the house. Definitely worth it!",BEST PANTS EVER,5.0,B001KW8E3M
As advertised,As advertised,5.0,B001KW8E3M
Great for a fancy dress costume,Five Stars,5.0,B001KW8E3M
my boy loves the pants,red white blue pants,4.0,B001KW8E3M
Love these pants and so does everyone else,Amazing,5.0,B001KW8E3M
"They're a lot longer in the legs than I expected, but they're comfy and the design works for what I needed.",July 4th here I come,5.0,B001KW8E3M
Love them #merica,Awesome,5.0,B001KW8E3M
"I got this item for my son, it was the  his correct fit which he used at a Halloween party. The baggy gym pants of the flag brought out the richness of quality of the product. It was the perfect design for that occasion so I have hesitation of a 4 stars.",Made from good quality fabric and the design is user friendly. Thanks for making this  product available.,4.0,B001KW8E3M
Who wants to take a roundhouse kick to the face with these badboys? Nobody!,Five Stars,5.0,B001KW8E3M
'Merica.,Five Stars,5.0,B001KW8E3M
Exactly what we expected when buying. These were a hit.,Five Stars,5.0,B001KW8E3M
This was for my 16 year old Grandson who reportedly has been wearing them for days!!,Bold & Beautiful,5.0,B001KW8E3M
love these,Five Stars,5.0,B001KW8E3M
Do you think where I am today by dressing like Peter Pan here? Take a look at these pants people. Do you think anyone wants a roundhouse kick to the face while you're wearing these bad boys? Buy these and forget about it.,Does anyone think I'm a failure because I go home to Starla at night?,5.0,B001KW8E3M
I've never felt so patriotic wearing a pair of pants before. I felt like a champion of freedom and justice wearing these bad boys.,Take a look at what I'm wearing people...,5.0,B001KW8E3M
Nobody wants a roundhouse kick to the face while I'm wearing these bad boys.,Forget about it.,5.0,B001KW8E3M
Just like the guy in the move Napoleon dynamite. love these pants.,Five Stars,5.0,B001KW8E3M
"Sent to my husband in Korea. Kim Jong Un nearly surrendered at the sight of that much freedom displayed South of the border. Fantastic purchase.
Pretty much the only way you could improve a Kiowa pilots wardrobe.",Must have for a Kiowa pilot in Korea,5.0,B001KW8E3M
I climb with these pants on. Everybody loves them. Kids stare. People complement them. I used to climb v1 before I bought these but now I climb v15. The pants are power. The pants are truth. All hail pants. (Seriously they're pretty sweet),(Seriously they're pretty sweet),5.0,B001KW8E3M
Would you like a roundhouse kick to the face with these bad boys? I don't think so!,Five Stars,5.0,B001KW8E3M
Expensive but worth it.  And they help give roundhouse kicks to the face much easier.  Forget about it.,Expensive but worth it. And they help give roundhouse ...,5.0,B001KW8E3M
Great for parties!,Four Stars,4.0,B001KW8E3M
Got the pants for my son for his birthday and he loved them.,... pants for my son for his birthday and he loved them.,5.0,B001KW8E3M
Gave these s a birthday gift to my brother and he loved them. He said they fit great!,Great Gift,5.0,B001KW8E3M
Love them. Love America.,Freedom,5.0,B001KW8E3M
Woo,Five Stars,5.0,B001KW8E3M
I put these bad boys on an immediately felt empowered. On my into the gym that morning an eagle landed on my shoulder promising to spot me with his majestic wings as I deadlift.,I put these bad boys on an immediately felt empowered,5.0,B001KW8E3M
These are the pants from that one movie joke you're thinking about.....,Five Stars,5.0,B001KW8E3M
